TC004398,PERRY CORPORATE SERVICES LIMITED,寶勵秘書有限公司,"3/F, TUNG FAI BUILDING, 27A CAMERON ROAD, TSIM SHA TSUI, KOWLOON, HONG KONG",,
TC004399,GYTHO COMPANY LIMITED,嘉好秘書服務有限公司,"5/F, JARDINE HOUSE, 1 CONNAUGHT PLACE, CENTRAL, HONG KONG",,
TC004400,CLIENT NOMINEES LIMITED,,"5/F, JARDINE HOUSE, 1 CONNAUGHT PLACE, CENTRAL, HONG KONG",,
TC004406,MISSION CORPORATE SERVICES LIMITED,中通企業服務有限公司,"ROOM D1, 17/F, BILLION PLAZA 2, 10 CHEUNG YUE STREET, LAI CHI KOK, KOWLOON, HONG KONG",,
TC004407,WISELAND SECRETARIAL SERVICES LIMITED,慧能秘書服務有限公司,"FLAT/ROOM 2105, 21/F, CHUNG KIU COMMERCIAL BUILDING, 47-51 SHANTUNG STREET, MONG KOK, KOWLOON, HONG KONG",,
TC004408,BAUHINIA STAR LIMITED,紫荊星有限公司,"ROOM 1403, WEST TOWER, SHUN TAK CENTRE, 168 CONNAUGHT ROAD CENTRAL, HONG KONG",,
TC004411,PRO-FUSION CONSULTANT LIMITED,保輝顧問有限公司,"ROOM 1301, 13/F, PROSPER COMMERCIAL BUILDING, 9 YIN CHONG STREET, MONG KOK, KOWLOON, HONG KONG",,
TC004412,BLUE OCEAN GROUP (INTERNATIONAL) LIMITED,藍海集團(國際)有限公司,香港上環皇后大道西2-12號聯發商業中心5樓502室,,
TC004414,GENERAL RESERVE OF DIGITAL ASSETS LIMITED,數字資產儲備股份有限公司,"12/F, 80 GLOUCESTER ROAD, WAN CHAI, HONG KONG",,
TC004418,FULLEVER LIMITED,,"21/F, TESBURY CENTRE, 28 QUEEN'S ROAD EAST, WAN CHAI, HONG KONG",,
TC004419,WOODLAND SECRETARIES COMPANY LIMITED,快活林秘書有限公司,"FLAT/ROOM 1808, 18/F, BEVERLY HOUSE, 107 LOCKHART ROAD, WAN CHAI, HONG KONG",,
TC004420,PATRICK NOOHU MANAGEMENT COMPANY LIMITED,華彪顧問有限公司,"FLAT/ROOM 1808, 18/F, BEVERLY HOUSE, 107 LOCKHART ROAD, WAN CHAI, HONG KONG",,
TC004425,ASIAPACIFICSEC LIMITED,,"2504, 25/F, UNIVERSAL TRADE CENTRE, 3 ARBUTHNOT ROAD, CENTRAL, HONG KONG",,
TC004427,TOPOST INVESTMENT LIMITED,嘉柱投資有限公司,"ROOMS 1109-10, 11/F, C C WU BUILDING, 302-8 HENNESSY ROAD, WAN CHAI, HONG KONG",,
TC004428,GOOD TALENT SECRETARIAL LIMITED,全能秘書有限公司,"ROOM 405, 4/F, PARK TOWER, 15 AUSTIN ROAD, TSIM SHA TSUI, KOWLOON, HONG KONG",,
TC004429,RONALD NG (NOMINEES) LIMITED,,"UNIT 2906, 29/F, NO. 118 CONNAUGHT ROAD WEST, HONG KONG",,
TC004430,ACCESS CORPORATE LIMITED,,"FLAT/ROOM 1503, 15/F, M PLACE, 54 WONG CHUK HANG ROAD, ABERDEEN, HONG KONG",,
TC004431,SY CHING MAN trading as MUTUAL MANAGEMENT CONSULTANTS,施瀞雯 經營 MUTUAL MANAGEMENT CONSULTANTS,"3/F, COSCO TOWER, GRAND MILLENNIUM PLAZA, 183 QUEEN’S ROAD CENTRAL, HONG KONG",,
TC004432,STEP FORWARD RESOURCES LIMITED,向前進資源有限公司,"29/F, TAI TUNG BUILDING, 8 FLEMING ROAD, WAN CHAI, HONG KONG",,
TC004433,SUNNY WIN LIMITED,濠正有限公司,"FLAT/RM 1101, 11/F, KING CENTRE, 23-29 DUNDAS STREET, MONG KOK, KOWLOON, HONG KONG",,
TC004435,WESSTEX CORPORATE ADVISORY LIMITED,滙利企業諮詢有限公司,"FLAT/ROOM 905, 9/F, KAI WONG COMMERCIAL BUILDING, 222 QUEEN'S ROAD CENTRAL, SHEUNG WAN, HONG KONG",,
TC004439,TOP BOND MANAGEMENT LIMITED,怡邦管理有限公司,"ROOM 703, 7/F, CHEONG K. BUILDING, 84-86 DES VOEUX ROAD CENTRAL, CENTRAL, HONG KONG",,
TC004441,SAT CONSULTANCY LIMITED,世達會計顧問有限公司,"FLAT/RM 01, 10/F, GEE TUCK BUILDING, 16-20 BONHAM STRAND, SHEUNG WAN, HONG KONG",,
TC004442,PRESSON SECRETARIAL SERVICES LIMITED,栢群秘書服務有限公司,"UNIT 904-905, 9/F, SEAVIEW COMMERCIAL BUILDING, 23 CONNAUGHT ROAD WEST, SHEUNG WAN, HONG KONG",,
TC004443,FULLYWIN CONSULTANTS LIMITED,富榮顧問有限公司,"Unit 101A, 1/F, Hing Yip Commercial Centre, 272-284 Des Voeux Road Central, Sheung Wan, Hong Kong",,
TC004444,HONG KONG PROFESSIONAL LIMITED,英明商管專業有限公司,"FLAT/ROOM 7, 19/F, MARINA HOUSE, 68 HING MAN STREET, SHAU KEI WAN, HONG KONG",,
TC004445,FERNHILL LIMITED,灃曉有限公司,"10/F, CHIU LUNG BUILDING, 25 CHIU LUNG STREET, CENTRAL, HONG KONG",,
TC004446,XIAN DE CONSULTANCY COMPANY LIMITED,賢德咨詢有限公司,"ROOM 1210, 12/F, WAYSON COMMERCIAL BUILDING, 28 CONNAUGHT ROAD WEST, SHEUNG WAN, HONG KONG",,
TC004447,HONG KONG SECRETARIES LIMITED,英明秘書有限公司,"FLAT/ROOM 7, 19/F, MARINA HOUSE, 68 HING MAN STREET, SHAU KEI WAN, HONG KONG",,
TC004448,TAM MIU YEE trading as JET ACCOUNTING CONSULTANT COMPANY,譚妙儀 經營 捷誠會計顧問公司,"FLAT/RM 1218, 12/F, BLOCK A1, VICTORIOUS FACTORY BUILDING, 35 TSEUK LUK STREET, SANPOKONG, KOWLOON, HONG KONG",,
TC004450,EWEB.HK LIMITED,易商務税務財策有限公司,"FLAT/RM A, 10/F, YAN'S TOWER, 27 WONG CHUK HANG ROAD, HONG KONG",,
TC004452,FTW SECRETARIES LIMITED,港駿秘書有限公司,"ROOM 1001-1003, 10/F, WING ON KOWLOON CENTRE, 345 NATHAN ROAD, JORDAN, KOWLOON, HONG KONG",,
TC004453,PW MANAGEMENT CONSULTING LIMITED,博匯管理顧問有限公司,"ROOM 501, 5/F, TAI SANG BANK BUILDING, 130-132 DES VOEUX ROAD CENTRAL, CENTRAL, HONG KONG",,
TC004455,WORLD TEAM HOLDINGS LIMITED,匯合集團有限公司,"18/F, GINZA SQUARE, 565-567 NATHAN ROAD, MONG KOK, KOWLOON, HONG KONG",,
TC004456,KEY SERVICES LIMITED,,"31/F, CHINACHEM CENTURY TOWER, 178 GLOUCESTER ROAD, WAN CHAI, HONG KONG",,
TC004457,"FASAC CONSULTING CO., LIMITED",法智特顧問有限公司,"ROOM 1201, 12/F, PROSPERITY CENTRE, 982 CANTON ROAD, MONG KOK, KOWLOON, HONG KONG",,
TC004459,P J CONSULTANTS LIMITED,,"UNIT A, 12/F, TAK LEE COMMERCIAL BUILDING, 113-117 WANCHAI ROAD, WAN CHAI, HONG KONG",,
TC004460,AT REGISTRATIONS LIMITED,海風註冊有限公司,"ROOM 909, 9/F, OFFICE TOWER 2, GRAND PLAZA, 625 & 639 NATHAN ROAD, MONGKOK, KOWLOON, HONG KONG",,
TC004462,TC SECRETARIAL SERVICES LIMITED,天時秘書有限公司,"FLAT C, 9/F, SHUN CHEUNG INDUSTRIAL BUILDING, 26 WING HONG STREET, SHAM SHUI PO, KOWLOON, HONG KONG",,
TC004463,PERFECTION SECRETARIES LIMITED,佳誼秘書服務有限公司,"14/F, LOCKHART CENTRE, 301-307 LOCKHART ROAD, WAN CHAI, HONG KONG",,
TC004465,PULLMAN FINANCIAL SERVICES LIMITED,寶文金融服務有限公司,"ROOM 208, 2/F, CHEVALIER HOUSE, 45-51 CHATHAM ROAD SOUTH, TSIM SHA TSUI, KOWLOON, HONG KONG",,
TC004467,AXIS ASSOCIATES LIMITED,,"ROOM A-B, 25/F, KING PALACE PLAZA, 55 KING YIP ROAD, KWUN TONG, KOWLOON, HONG KONG",,
TC004469,TEAM POWER CONSULTANTS LIMITED,天富顧問有限公司,"FLAT/ROOM 2105, 21/F, CHUNG KIU COMMERCIAL BUILDING, 47-51 SHANTUNG STREET, MONG KOK, KOWLOON, HONG KONG",,
TC004473,LOYAL MERIT INTERNATIONAL LIMITED,友德國際有限公司,"FLAT/ROOM A-E, 23/F, BLOCK 2, BILLION PLAZA, 10 CHEUNG YUE STREET, CHEUNG SHA WAN, KOWLOON, HONG KONG",,
TC004476,RBC INVESTOR SERVICES TRUST HONG KONG LIMITED,加皇信託香港有限公司,"41st and 42nd FLOOR, ONE TAIKOO PLACE, TAIKOO PLACE, 979 KING'S ROAD, QUARRY BAY, HONG KONG",The licensee is a trust company registered under section 78(1) of the Trustee Ordinance (Cap. 29),持牌人屬根據《受託人條例》(第29章) 第78(1)條註冊的信託公司
TC004477,TOPAZ EDELWEISS COMPANY LIMITED,,"25/F, NEICH TOWER, 128 GLOUCESTER ROAD, WANCHAI, HONG KONG",,
TC004478,GLOBALSEC SERVICES LIMITED,環通會計秘書有限公司,"ROOMS 2006-8, 20/F, TWO CHINACHEM EXCHANGE SQUARE, 338 KING'S ROAD, NORTH POINT, HONG KONG",,
TC004480,SANDS SECRETARIES LIMITED,,"30/F, ONE TAIKOO PLACE, 979 KING'S ROAD, QUARRY BAY, HONG KONG",,
TC004481,JFU COMPANY SERVICES LIMITED,傅子剛企業服務有限公司,"UNIT 701, 7/F, CORE B, CYBERPORT 3, 100 CYBERORT ROAD, HONG KONG",,
TC004482,COMSEC CONSULTANTS LIMITED,津華秘書有限公司,"ROOM 605, 6/F, TAI SANG BANK BUILDING, 130-132 DES VOEUX ROAD CENTRAL, HONG KONG",,
TC004484,QUEST MANAGEMENT SERVICES LIMITED,傑思管理有限公司,"FLAT/ROOM 2602, 26/F, CHINA UNITED PLAZA, 1008 TAI NAM WEST STREET, CHEUNG SHA WAN, KOWLOON, HONG KONG",,
TC004485,COMSEC COMMERCIAL MANAGEMENT LIMITED,津華商務管理有限公司,"ROOM 605, TAI SANG BANK BUILDING, 130-132 DES VOEUX ROAD CENTRAL, HONG KONG",,
TC004487,UNITED T&S CONSULTANTS LIMITED,中正顧問有限公司,"ROOMS 2006-8, 20/F, TWO CHINACHEM EXCHANGE SQUARE, 338 KING'S ROAD, NORTH POINT, HONG KONG",,
TC004489,CELL RESOURCES COMPANY LIMITED,,"FLAT/RM 802, 8/F, TAI YAU BUILDING, 181 JOHNSTON ROAD, WAN CHAI, HONG KONG",,
TC004490,MDI CONSULTANTS LIMITED,高鈿國際財稅顧問有限公司,"5/F, GREATMANY CENTRE, 111 QUEEN'S ROAD EAST, WAN CHAI, HONG KONG",,
TC004491,PRO-CORP NOMINEES LIMITED,滙寶代理人有限公司,"FLAT/ROOM 2702-3, 27/F, BANK OF EAST ASIA HARBOUR VIEW CENTRE, 56 GLOUCESTER ROAD, WAN CHAI, HONG KONG",,
TC004492,HALLY CONSULTANTS LIMITED,可利顧問有限公司,"FLAT/RM 1103, 11/F, SHANGHAI INDUSTRIAL INVESTMENT BUILDING, 48-62 HENNESSY ROAD, WANCHAI, HONG KONG",,
TC004493,MANFUL STAR LIMITED,萬運達有限公司,"PENTHOUSE, 39/F, WEST TOWER, SHUN TAK CENTRE, 200 CONNAUGHT ROAD CENTRAL, SHEUNG WAN, HONG KONG",,
TC004494,GOODWILL INTERNATIONAL MANAGEMENT GROUP LIMITED,佳譽國際顧問集團有限公司,"10/F, WELL VIEW COMMERCIAL BUILDING, 8-12 MORRISON STREET, SHEUNG WAN, HONG KONG",,
TC004495,NORDIC MANAGEMENT LIMITED,置峰管理有限公司,"UNIT 803, 8/F, LUCKY COMMERCIAL CENTRE, 103-109 DES VOEUX ROAD WEST, SHEUNG WAN, HONG KONG",,
TC004496,JK (HONG KONG) LIMITED,,"FLAT/ROOM A, 17/F, WARDLEY CENTRE, 9-11 PRAT AVENUE, TSIM SHA TSUI, KOWLOON, HONG KONG",,
TC004497,LUKE MANAGEMENT SERVICES LIMITED,諾佳商務管理有限公司,"SUITES 605-7, 6/F, WHARF T&T CENTRE, HARBOUR CITY, 7 CANTON ROAD, TSIM SHA TSUI, KOWLOON, HONG KONG",,
TC004498,LEADER SECRETARIAL CONSULTANTS LIMITED,領先秘書顧問有限公司,"FLAT/ROOM A, 17/F, WARDLEY CENTRE, 9-11 PRAT AVENUE, TSIM SHA TSUI, KOWLOON, HONG KONG",,
TC004499,SWC COMPANY SERVICES LIMITED,晨旺秘書服務有限公司,"ROOM 706-707, 7/F, YUEN LONG COMMERCIAL CENTRE, 18-24 KAU YUK ROAD, YUEN LONG, NEW TERRITORIES, HONG KONG",,
TC004501,WELL LEAD CONSULTANTS LIMITED,佳達顧問有限公司,"FLAT/ROOM D, 9/F, CANTAKE FACTORY BUILDING, 172 WAI YIP STREET, KWUN TONG, KOWLOON, HONG KONG",,
TC004502,ACTWIN INTERNATIONAL LIMITED,正誠國際商務有限公司,"FLAT/RM 17, BLOCK B, 12/F, MERIT INDUSTRIAL CENTRE, NO. 94 TO KWA WAN ROAD, KOWLOON CITY, KOWLOON, HONG KONG",,
TC004505,MYAE CONSULTANTS LIMITED,汶宜顧問有限公司,"UNIT 604B, 6/F, LUCKY COMMERCIAL CENTRE, 103 DES VOEUX ROAD W., SHEUNG WAN, HONG KONG",,
TC004506,SUCCESSWAY CORPORATE CONSULTANTS LIMITED,駿達商務顧問有限公司,"ROOM 602, 6/F, NATHAN CENTRE, 580G NATHAN ROAD, MONG KOK, KOWLOON, HONG KONG",,
TC004507,RICH SMART LIMITED,駿豐有限公司,"UNIT 710, 7/F, REALITY TOWER, 4 SUN ON STREET, CHAI WAN, HONG KONG",,
TC004508,WONDERFUL RIFE CORPORATION LIMITED,彩豐商務有限公司,"ROOM 13, 16/F, WELLBORNE COMMERCIAL CENTRE, 8 JAVA ROAD, NORTH POINT, HONG KONG",,
TC004509,ONESTEP CORPORATE SERVICES LIMITED,,"FLAT/ROOM 1504A, 15/F, EASTCORE, 398 KWUN TONG ROAD, KWUN TONG, KOWLOON, HONG KONG",,
TC004511,NORTHWESTERN MANAGEMENT SERVICES LIMITED,,"31/F, CHINACHEM CENTURY TOWER, 178 GLOUCESTER ROAD, WAN CHAI, HONG KONG",,
TC004512,BERFIELD ADMINISTRATION LIMITED,,"ROOM 1402-03, 14/F, CONNAUGHT COMMERCIAL BUILDING, 185 WAN CHAI ROAD, WAN CHAI, HONG KONG",,
TC004513,YOUNG WORLD CORPORATION LIMITED,逸萬有限公司,"25/F, TWO CHINACHEM PLAZA, 135 DES VOEUX ROAD CENTRAL, CENTRAL, HONG KONG",,
TC004514,MPCSL NOMINEES LIMITED,,"17/F, FAR EAST FINANCE CENTRE, NO.16 HARCOURT ROAD, ADMIRALTY, HONG KONG",,
TC004515,PROXY CORPORATE CONSULTANTS LIMITED,博思企業顧問有限公司,"ROOM 2602, 26/F, BAYFIELD BUILDING, 99 HENNESSY ROAD, WANCHAI, HONG KONG",,
TC004518,TOP SUCCESS CONSULTANCY LIMITED,智高策略顧問有限公司,"ROOM F2, 16/F, MG TOWER, 133 HOI BUN ROAD, KWUN TONG, KOWLOON, HONG KONG",,
TC004520,EARN BEST CONSULTANTS LIMITED,得隆顧問有限公司,"FLAT/ROOM 2004, 20/F, WELLBORNE COMMERCIAL CENTRE, 8 JAVA ROAD, NORTH POINT, HONG KONG",,
TC004521,CHUN SHING CONSULTANTS LIMITED,晉誠顧問有限公司,"FLAT 1001,10/F, BLOCK A, CHUN WUI HOUSE, KO CHUN COURT, 23 KO CHIU ROAD, YAU TONG, KOWLOON, HONG KONG",,
TC004523,WISDOM LINK CONSULTANTS LIMITED,智力顧問有限公司,"FLAT/RM A, 8/F, NATHAN COMMERCIAL BUILDING, NO. 430-436 NATHAN ROAD, YAUMATEI, KOWLOON, HONG KONG",,
TC004524,JW & YAU LIMITED,萬誠企業顧問有限公司,"ROOM 605, 6/F, EASEY COMMERCIAL BUILDING, 253-261 HENNESSY ROAD, WAN CHAI, HONG KONG",,
TC004525,BRILLIANT WAY CONSULTANTS LIMITED,俊煒顧問有限公司,"FLAT/RM 15, 8/F, INTERNATIONAL PLAZA, 20 SHEUNG YUET ROAD, KOWLOON BAY, KOWLOON, HONG KONG",,
TC004526,CORPORATE HUB LIMITED,兩儀諮詢有限公司,"UNIT 2202, 22/F, KAISER CENTRE, 18 CENTRE STREET, SAI YING PUN, HONG KONG",,
TC004527,HOLMES MANAGEMENT SERVICES LIMITED,鴻成管理服務有限公司,"FLAT A, 17/F, HOLLYWOOD CENTRE, 77-91 QUEEN'S ROAD WEST, SHEUNG WAN, HONG KONG",,
TC004529,K.C. CONSULTANT LIMITED,曦賢顧問有限公司,"ROOM 1209, 12/F, C C WU BUILDING, 302-308 HENNESSY ROAD, WAI CHAI, HONG KONG",,
TC004532,WELL TALENT STRATEGY LIMITED,威才策略有限公司,"FLAT A, 8/F, NATHAN COMMERCIAL BUILDING, 430-436 NATHAN ROAD, YAU MA TEI, KOWLOON, HONG KONG",,
TC004533,FINE SINCERE CONSULTING LIMITED,智誠商務顧問有限公司,"ROOM 1602, 16/F, KEEN HUNG COMMERCIAL BUILDING, 80 QUEEN'S ROAD EAST, WAN CHAI, HONG KONG",,
TC004534,HONG KONG REGISTRATION SECRETARIAL LIMITED,香港註冊秘書有限公司,"UNIT 826, 8/F, OCEAN CENTRE, HARBOUR CITY, 5 CANTON ROAD, TSIM SHA TSUI, KOWLOON, HONG KONG",,
TC004535,TSE MAN KIT trading as MK TSE & CO.,謝文傑 經營 MK TSE & CO.,"UNIT 606, 6/F, THE RAINBOW, 22 WANG YIP STREET SOUTH, YUEN LONG, NEW TERRTORIES, HONG KONG ",,
TC004537,VIEWFORD HONG KONG LIMITED,耀福香港有限公司,"FLAT B, 3/F, WING CHEONG COMMERCIAL BUILDING, 19-25 JERVOIS STREET, SHEUNG WAN, HONG KONG",,
TC004538,SUPREMEWAY ACCOUNTING COMPANY LIMITED,焯譽會計事務所有限公司,"ROOM 602, 6/F, NATHAN CENTRE, 580G NATHAN ROAD, MONG KOK, KOWLOON, HONG KONG",,
TC004540,SPOCKY CONSULTANTS LIMITED,,"FLAT/RM A, 16/F, WING SING COMMERCIAL CENTRE, 12-16 WING LOK STREET, SHEUNG WAN, HONG KONG",,
TC004541,GREAT TOWER SECRETARIES SERVICES LIMITED,雄朗秘書服務有限公司,"ROOM 1611, 16/F, STAR HOUSE, 3 SALISBURY ROAD, TSIM SHA TSUI, KOWLOON, HONG KONG",,
TC004544,KINYEE CONSULTANT COMPANY,健怡顧問公司,"FLAT/ROOM 12, 9/F, BLOCK B, GOLDFIELD INDUSTRIAL CENTRE, 1 SUI WO ROAD, SHA TIN, NEW TERRITORIES, HONG KONG",,
TC004545,ETERNAL MANAGEMENT LIMITED,永恒管理有限公司,"FLAT/RM B, 1/F, IDEAL HOUSE, 71 CAINE ROAD, CENTRAL, HONG KONG",,
TC004548,MEGA TEAM CONSULTANTS LIMITED,萬聯顧問有限公司,"FLAT C, 2/F, YEN YING BUILDING, 221 JAFFE ROAD, WAN CHAI, HONG KONG",,
TC004549,WELLSET NOMINEE & SECRETARIAL LIMITED,浚盈代理及秘書有限公司,"FLAT/RM 03, 12/F, EMPRESS PLAZA, 17-19 CHATHAM ROAD SOUTH, TSIM SHA TSUI, KOWLOON, HONG KONG",,
TC004550,WINFUL RICH SECRETARIES LIMITED,熙明秘書管理有限公司,"FLAT/ROOM 801-2, 8/F, WESTERN CENTRE, 40-50 DES VOEUX ROAD WEST, SHEUNG WAN, HONG KONG",,
TC004551,CONCORD SECRETARIAL SERVICES LIMITED,匯豪秘書服務有限公司,"FLAT/RM 4, 12/F, YUEN LONG TRADE CENTRE, 99-109 CASTLE PEAK ROAD, YUEN LONG, NEW TERRITORIES, HONG KONG",,
TC004554,LONGAIN LIMITED,再朗有限公司,"FLAT/RM E, 2/F, WAN TIN BUILDING, 110 TAM KUNG ROAD, TO KWA WAN, KOWLOON, HONG KONG",,
TC004555,W. L. HO CONSULTING LIMITED,,"ROOM 1702, 17/F, HONG KONG TRADE CENTRE, 161-167 DES VOEUX ROAD CENTRAL, CENTRAL, HONG KONG",,
TC004556,MANHEIM MANAGEMENT CONSULTANTS LIMITED,敏言顧問有限公司,"SUITE 1412, 14/F, C C WU BUILDING, 302-308 HENNESSY ROAD, WAN CHAI, HONG KONG",,
TC004557,HSBC INSTITUTIONAL TRUST SERVICES (ASIA) LIMITED,滙豐機構信託服務(亞洲)有限公司,"1 QUEEN'S ROAD CENTRAL, HONG KONG",The licensee is a trust company registered under section 78(1) of the Trustee Ordinance (Cap. 29),持牌人屬根據《受託人條例》(第29章) 第78(1)條註冊的信託公司
TC004558,HSBC PROVIDENT FUND TRUSTEE (HONG KONG) LIMITED,,"1 QUEEN'S ROAD CENTRAL, HONG KONG",The licensee is a trust company registered under section 78(1) of the Trustee Ordinance (Cap. 29),持牌人屬根據《受託人條例》(第29章) 第78(1)條註冊的信託公司
TC004559,HSBC NOMINEES (HONG KONG) LIMITED,滙豐代理人(香港)有限公司,"30/F, HSBC MAIN BUILDING, 1 QUEEN’S ROAD CENTRAL, CENTRAL, HONG KONG",,
TC004560,HSBC GLOBAL ASSET MANAGEMENT HOLDINGS (BAHAMAS) LIMITED,,"22/F, HSBC MAIN BUILDING, 1 QUEEN’S ROAD CENTRAL, CENTRAL, HONG KONG",,
TC004561,LARVILLE LIMITED,,"SUITE C, 16/F, ON HING BUILDING, 1-9 ON HING TERRACE, CENTRAL, HONG KONG",,
TC004562,COMMENCE MANAGEMENT LIMITED,駿業管理有限公司,"7/F, GUANGDONG INVESTMENT TOWER, 148 CONNAUGHT ROAD CENTRAL, SHEUNG WAN, HONG KONG",,
TC004564,UNION GENIUS LIMITED,合堅有限公司,"SUITE 803A, 8/F, TOWER TWO, LIPPO CENTRE, 89 QUEENSWAY, ADMIRALTY, HONG KONG",,
TC004565,SO YIM TONG ALEX trading as ACEFOUNDER CONSULTANTS COMPANY,蘇炎棠 經營 博智顧問公司,"FLAT/ROOM 2517, 25/F, KWUN HEI COURT, 3 SHEUNG LOK STREET, HO MAN TIN, KOWLOON, HONG KONG",,
TC004566,ROSSMORE SECRETARIES LIMITED,,"ROOM 2001-4, 20/F, CHINA INSURANCE GROUP BUILDING, 141 DES VOEUX ROAD CENTRAL, CENTRAL, HONG KONG",,
TC004568,FORWARD MANAGEMENT LIMITED,創建管理有限公司,"UNIT 2405, 24/F, WORLD WIDE HOUSE, 19 DES VOEUX ROAD CENTRAL, CENTRAL, HONG KONG",,
TC004569,MANCHUEN NOMINEE LIMITED,,"UNIT 2405, 24/F, WORLD WIDE HOUSE, 19 DES VOEUX ROAD CENTRAL, CENTRAL, HONG KONG",,
TC004570,GRANDFIT LIMITED,天賦有限公司,"UNIT 2405, 24/F, WORLD WIDE HOUSE, 19 DES VOEUX ROAD CENTRAL, CENTRAL, HONG KONG",,
TC004571,HK LEADSHOW SECRETARY LIMITED,香港領呈秘書有限公司,"RM C, 13/F, HARVARD COMMERCIAL BUILDING, 105-111 THOMSON ROAD, WAN CHAI, HONG KONG",,
TC004572,FAITHFUL SECRETARIAL LIMITED,德信秘書顧問服務有限公司,"ROOM 619, 6/F, CHEVALIER COMMERCIAL CENTRE, 8 WANG HOI ROAD, KOWLOON BAY, KOWLOON, HONG KONG",,
TC004573,SPLENDOR CORPORATE SERVICES LIMITED,倍達商務有限公司,"ROOM 1601, 16/F, KAI TAK COMMERCIAL BUILDING, 317-319 DES VOEUX ROAD CENTRAL, SHEUNG WAN, HONG KONG",,
TC004574,SKY WORLD ACCOUNTING CONSULTANTS LIMITED,天和會計顧問有限公司,"FLAT/ROOM 8, 14/F, TREASURE CENTRE, 42 HUNG TO ROAD, KWUN TONG, KOWLOON, HONG KONG",,
TC004577,CCM HONGKONG LIMITED,,"SUITE 2012, 20/F, TOWER 1, THE GATEWAY, 25 CANTON ROAD, TSIM SHA TSUI, KOWLOON, HONG KONG",,
TC004578,ENDEAVOUR SECRETARIAL LIMITED,盈信秘書有限公司,"ROOM 1002B, 10/F, FORTRESS TOWER, 250 KING’S ROAD, NORTH POINT, HONG KONG",,
TC004579,ELITE CHARTERED CORPORATE SERVICES LIMITED,卓穎企業顧問有限公司,"SUITE 6, 9/F, TESBURY CENTRE, 28 QUEEN'S ROAD EAST, WAN CHAI, HONG KONG",,
TC004580,LO KA CHUNG KENNETH trading as SMART YIELD CONSULTANTS COMPANY,盧嘉聰 經營 浚溢顧問公司,香港九龍長沙灣長裕街11號定豐中心11樓1105室,,
TC004587,C & L CONSULTANTS LIMITED,煒信顧問有限公司,"ROOM 1712C, 17/F, WITTY COMMERCIAL BUILDING, 1A-1L TUNG CHOI STREET, MONG KOK, KOWLOON, HONG KONG",,
TC004588,ABM CORPORATE SERVICES LIMITED,亞洲企業服務有限公司,"30/F, CATIC PLAZA, 8 CAUSEWAY ROAD, CAUSEWAY BAY, HONG KONG",,
TC004589,RAVEN ORIENT LIMITED,,"ROOMS C-E, 9/F, CHINA OVERSEAS BUILDING, 139 HENNESSY ROAD, WANCHAI, HONG KONG",,
TC004590,SUNTERA (HONG KONG) LIMITED,,"18/F, ON BUILDING, 162 QUEEN'S ROAD CENTRAL, CENTRAL, HONG KONG",,
TC004591,HEALTHWAY CONSULTANTS SERVICES COMPANY LIMITED,弘健顧問服務有限公司,"16/F, NO. 579 NATHAN ROAD, MONG KOK, KOWLOON, HONG KONG",,
TC004592,SUNTERA CORPORATE TRUSTEES (HONG KONG) LIMITED,,"18/F, ON BUILDING, 162 QUEEN'S ROAD CENTRAL, CENTRAL, HONG KONG",The licensee is a trust company registered under section 78(1) of the Trustee Ordinance (Cap. 29),持牌人屬根據《受託人條例》(第29章) 第78(1)條註冊的信託公司
TC004594,WPG CORPORATE & SECRETARIAL SERVICES LIMITED,國誠商業及秘書服務有限公司,"SUITE 2401, 24/F, CHINA INSURANCE GROUP BUILDING, 141 DES VOEUX ROAD CENTRAL, CENTRAL, HONG KONG",,
TC004596,LEE YUK SHAN ANGELA trading as C&A ACCOUNTING SERVICES COMPANY,李玉珊 經營 C&A ACCOUNTING SERVICES COMPANY,"FLAT B, 9/F, KINGSWELL COMMERCIAL TOWER, 171-173 LOCKHART ROAD, WAN CHAI, HONG KONG",,
TC004597,EAST KIND CONSULTANTS LIMITED,益佳顧問有限公司,"FLAT B, 9/F, KINGSWELL COMMERCIAL TOWER, 171-173 LOCKHART ROAD, WAN CHAI, HONG KONG",,
TC004598,NICE FAITH CONSULTANTS LIMITED,昌信顧問有限公司,"ROOM 1403, 14/F, CAPITAL CENTRE, 151 GLOUCESTER ROAD, WAN CHAI, HONG KONG",,
TC004600,CANBRIGHT INC LIMITED,君顯有限公司,"ROOM 508, 5/F, DAVID HOUSE, 8-20 NANKING STREET, JORDAN, KOWLOON, HONG KONG",,
TC004601,FIT-FEET SECRETARIAL COMPANY LIMITED,,"18/F, S. B. COMMERCIAL BUILIDNG, 478 NATHAN ROAD, MONG KOK, KOWLOON, HONG KONG",,
TC004606,ALCO PROFESSIONAL SERVICES LIMITED,愛高專業服務有限公司,"ROOM 1501, 15/F, ALLIANCE BUILDING, 130-136 CONNAUGHT ROAD CENTRAL, SHEUNG WAN, HONG KONG",,
TC004607,SCI SECRETARIES LIMITED,穗文顧問有限公司,"FLAT/ROOM 902, 9/F, PARKES COMMERCIAL CENTRE, 2-8 PARKES STREET, TSIM SHA TSUI, KOWLOON, HONG KONG",,
TC004608,ASIAN WINNER LIMITED,安弘有限公司,"UNIT 1801, 18/F, MALAYSIA BUILDING, 50 GLOUCESTER ROAD, WAN CHAI, HONG KONG",,
TC004609,TIMOTHY CORPORATE SERVICES LIMITED,劉焯文會計顧問有限公司,"FLAT/RM 1709, 17/F, CITICORP CENTRE, 18 WHITFIELD ROAD, CAUSEWAY BAY, HONG KONG",,
TC004610,YEUNG KIT LING trading as GLOBAL CONSULTANTS,楊潔玲 經營 環球顧問,"SUITE 902, 9/F, PARKES COMMERCIAL CENTRE, 2-8 PARKES STREET, TSIM SHA TSUI, KOWLOON, HONG KONG",,
TC004611,BRIGHT WAY ACCOUNTING & SECRETARIAL SERVICES LIMITED,耀程會計及秘書服務有限公司,"FLAT/ROOM 1302, 13/F, 102 AUSTIN ROAD, TSIM SHA TSUI, KOWLOON, HONG KONG",,
TC004612,RELIANCE CENTURY LIMITED,誠信世紀有限公司,"FLAT/ROOM 1203, 12/F, OFFICE TOWER TWO, GRAND PLAZA, 625 & 639 NATHAN ROAD, MONGKOK, KOWLOON, HONG KONG",,
TC004614,GUANGMING SERVICES LIMITED,,"8/F, 30 HOLLYWOOD ROAD, CENTRAL, HONG KONG",,
TC004615,FAMOUS ACCOUNTING & SECRETARIAL LIMITED,榮亮會計秘書有限公司,"ROOM 1703, 17/F, HANG SENG MONGKOK BUILDING, 677 NATHAN ROAD, MONG KOK, KOWLOON, HONG KONG",,
TC004616,MYTTHK LIMITED,,"FLAT/ROOM A, 15/F, 1 PARKRIDGE CRESCENT, DISCOVERY BAY, NEW TERRITORIES, HONG KONG",,
TC004617,EXECUTIVE SOLUTIONS LIMITED,卓方有限公司,"OFFICE 4, 10/F, KWAN CHART TOWER, NO. 6 TONNOCHY ROAD, WAN CHAI, HONG KONG",,
TC004621,"HK KINGSOURCE INT'L DEVELOPMENT CO., LIMITED",香港金源國際發展有限公司,"UNIT B, 22/F, ARTHUR COMMERCIAL BUILDING, 33 ARTHUR STREET, KOWLOON, HONG KONG",,
TC004623,SAPLING CONSULTANCY LIMITED,,"FLAT/RM E, 21/F, NEICH TOWER, 128 GLOUCESTER ROAD, WANCHAI, HONG KONG",,
TC004624,T.I.M. LIMITED,謙賢有限公司,"11A, YUE ON COMMERCIAL BUILDING, 385-387 LOCKHART ROAD, WAN CHAI, HONG KONG",,
TC004626,KING CENTRAL BUSINESS SERVICES LIMITED,景元商業服務有限公司,"G/F, 9 SUI ON STREET, TAI PO, NEW TERRITORIES, HONG KONG",,
TC004627,BMS CORPORATE SERVICES LIMITED,衛信企業服務有限公司,"11A, YUE ON COMMERCIAL BUILDING, 385-387 LOCKHART ROAD, WAN CHAI, HONG KONG",,
TC004628,TIMCROSS LIMITED,天任有限公司,"11A, YUE ON COMMERCIAL BUILDING, 385-387 LOCKHART ROAD, WAN CHAI, HONG KONG",,
TC004629,GRANDLIKE CORPORATION LIMITED,均禮有限公司,"ROOM 212, 2/F, MIRROR TOWER, 61 MODY ROAD, TSIM SHA TSUI, KOWLOON, HONG KONG",,
TC004631,BMS SECRETARIES LIMITED,,"11A, YUE ON COMMERCIAL BUILDING, 385-387 LOCKHART ROAD, WAN CHAI, HONG KONG",,
TC004632,YUTAI SECRETARIAL SERVICES LIMITED,禹泰秘書服務有限公司,"ROOM 2914, 29/F, HO KING COMMERCIAL CENTRE, 2-16 FA YUEN STREET, MONG KOK, KOWLOON, HONG KONG",,
TC004633,AVENTINE LIMITED,雅宏達有限公司,"11A, YUE ON COMMERCIAL BUILDING, 385-387 LOCKHART ROAD, WAN CHAI, HONG KONG",,
TC004634,"HAI MING INTERNATIONAL BUSINESS SECRETARY SERVICE (HONG KONG) CO., LIMITED",海銘國際企業秘書服務(香港)有限公司,"ROOM 32, 11/F, LEE KA INDUSTRIAL BUILDING, 8 NG FONG STREET, SAN PO KONG, KOWLOON, HONG KONG",,
TC004636,WAN KAM CHUEN trading as MASTER ONE MANAGEMENT SERVICE,温錦泉 經營 馬運管理事務所,"ROOM 312, 3/F, GOLDEN LEAGUE BUILDING, 76-82 CASTLE PEAK ROAD, SHAM SHUI PO, KOWLOON, HONG KONG",,
TC004638,NATURAL TECH LIMITED,確然有限公司,"FLAT C, 15/F, BLOCK 4, LES SAISONS, 28 TAI ON STREET, SAI WAN HO, HONG KONG",,
TC004639,CARLFORD SECRETARIES LIMITED,嘉福秘書有限公司,"UNIT A, 7/F, 88 COMMERCIAL BUILDING, 28-34 WING LOK STREET, CENTRAL, HONG KONG",,
TC004640,P & B MANAGEMENT SERVICES LIMITED,培邦管理顧問有限公司,"ROOM 1307-1308, 13/F, DOMINION CENTRE, 43-59 QUEEN'S ROAD EAST, WANCHAI, HONG KONG",,
TC004641,SECTAX NOMINEE SERVICES LIMITED,,"SUITE 820, 8/F, OCEAN CENTRE, HARBOUR CITY, 5 CANTON ROAD, TSIM SHA TSUI, KOWLOON, HONG KONG",,
TC004642,SWL COMPANY SERVICE LIMITED,蕭溫梁公司服務有限公司,"16/F, UNICORN TRADE CENTRE, 127-131 DES VOEUX ROAD CENTRAL, CENTRAL, HONG KONG",,
TC004645,ARIES CORPORATE SERVICES LIMITED,雅仕公司服務有限公司,"26/F, SHUN FENG INTERNATIONAL CENTRE, 182 QUEEN'S ROAD EAST, WAN CHAI, HONG KONG",,
TC004646,TEMPIO LIMITED,天庇有限公司,"UNIT 202, 2/F, 6-8 POTTINGER STREET, CENTRAL, HONG KONG",,
TC004647,TEM MANAGERS LIMITED,,"UNIT 202, 2/F, 6-8 POTTINGER STREET, CENTRAL, HONG KONG",,
TC004648,NFINITE LIMITED,華泰商務諮詢有限公司,"ROOM 05, 21/F, FUTURA PLAZA, 111 HOW MING STREET, KWUN TONG, KOWLOON, HONG KONG",,
TC004650,WASON BUSINESS CONSULTANCY LIMITED,華信企業顧問有限公司,"UNIT 02, 11/F, FORTUNE COMMERCIAL BUILDING, 362 SHA TSUI ROAD, TSUEN WAN, NEW TERRITORIES, HONG KONG",,
TC004651,MUTUAL FAITH MANAGEMENT LIMITED,駿彥秘書服務有限公司,"FLAT/RM A, 19/F, TUNG HIP COMMERCIAL BUILDING, 248 DES VOEUX ROAD CENTRAL, HONG KONG",,
