Licence No.(牌照編號),Name of TCSP Licensee in English(持牌人的英文姓名／名稱),Name of TCSP Licensee in Chinese(持牌人的中文姓名／名稱),Business Address(營業地址),Remarks in English(英文備註),Remarks in Chinese(中文備註)
TC000002,FULLYEAR CONSULTANTS LIMITED,富年顧問有限公司,"UNIT B, 12/F, KA NIN WAH COMMERCIAL BUILDING, 423-425 HENNESSY ROAD, WAN CHAI, HONG KONG",,
TC000003,TRILLION CAPITAL CORPORATE SERVICES LIMITED,盈豐企業顧問有限公司,"ROOM 1409, 14/F, HARBOUR CENTRE, 25 HARBOUR ROAD, WAN CHAI, HONG KONG",,
TC000005,MANIVEST ASIA LIMITED,宏傑亞洲有限公司,"UNIT 1405-1407, DOMINION CENTRE, 43-59 QUEEN'S ROAD EAST, WAN CHAI, HONG KONG",,
TC000006,WINSHIP CONSULTANTS LIMITED,捷誼顧問有限公司,"FLAT/ROOM 14, 7/F, WING ON PLAZA, 62 MODY ROAD, TSIM SHA TSUI, KOWLOON, HONG KONG",,
TC000007,INTERNATIONAL BUSINESS BROKERAGE ADVISORY LIMITED,創峰商務有限公司,"ROOM 602, 6/F, 168 QUEEN'S ROAD CENTRAL, CENTRAL, HONG KONG",,
TC000009,S & F SECRETARIAL SERVICES LIMITED,和橋秘書服務有限公司,"UNIT D, 9/F, KAI CENTRE, 36 HUNG TO ROAD, KWUN TONG, KOWLOON, HONG KONG",,
TC000010,EVERGOLD NOMINEES LIMITED,,"8/F, ASIA STANDARD TOWER, 59-65 QUEEN'S ROAD CENTRAL, CENTRAL, HONG KONG",,
TC000011,FU TANG SECRETARIAL SERVICES LIMITED,富騰秘書服務有限公司,"13/F, LKF29, 29 WYNDHAM STREET, CENTRAL, HONG KONG",,
TC000012,SQUARE ONE CORPORATION LIMITED,,"ROOMS 502-503, 5/F, WANCHAI COMMERCIAL CENTRE, 194-204 JOHNSTON ROAD, WAN CHAI, HONG KONG",,
TC000013,CHK CORPORATE SERVICES LIMITED,中港商業服務有限公司,"SUITE A, 12/F, RITZ PLAZA, 122 AUSTIN ROAD, TSIM SHA TSUI, KOWLOON, HONG KONG",,
TC000014,REGAL VIEW (HK) LIMITED,浚滙(香港)有限公司,"FLAT/RM 1107, 11/F, CELEBRITY COMMERCIAL CENTRE, 64 CASTLE PEAK ROAD, SHAM SHUI PO, KOWLOON, HONG KONG",,
TC000015,CITY BUSINESS DYNAMIC COMPANY LIMITED,全城商業躍動有限公司,"OFFICE K, 15/F, MG TOWER, 133 HOI BUN ROAD, KWUN TONG, KOWLOON, HONG KONG",,
TC000016,WOOCO SECRETARIAL SERVICES LIMITED,,"ROOM 1225, 12/F, PRINCE'S BUILDING, 10 CHATER ROAD, CENTRAL, HONG KONG",,
TC000017,FOCUS WIN LIMITED,豐展有限公司,"UNITS 1102-03, 11/F, 9 QUEEN'S ROAD CENTRAL, HONG KONG",,
TC000018,MLS COMPANY SECRETARY LIMITED,,"UNITS 904-907, 9/F, DAH SING FINANCIAL CENTRE, 248 QUEEN'S ROAD EAST, WAN CHAI, HONG KONG",,
TC000019,YYP LIMITED,,"FLAT/ROOM V, 14/F, CHERRY BUILDING, 35A OAK STREET, TAI KOK TSUI, KOWLOON, HONG KONG",,
TC000020,ULTIMATE SECRETARIAL LIMITED,,"ROOM 805, 8/F, GOLDEN GATE COMMERCIAL BUILDING, 136-138 AUSTIN ROAD, TSIM SHA TSUI, KOWLOON, HONG KONG",,
TC000021,INTERSHORES FINANCIAL SERVICES LIMITED,聯岸金融服務有限公司,"ROOM 712, 7/F, YIP FUNG BUILDING, 2-18 D'AGUILAR STREET, CENTRAL, HONG KONG",,
TC000022,GREBENSTEIN INTERNATIONAL LIMITED,金百頓國際有限公司,"FLAT/RM 1106, 11/F, GOLDEN GATE COMMERCIAL BUILDING, 136-138 AUSTIN ROAD, TSIM SHA TSUI, KOWLOON, HONG KONG",,
TC000023,ANCO BUSINESS SERVICES LIMITED,匡盈商務有限公司,"FLAT/RM 1102, 11/F, CHUNG YING BUILDING, 20-20A CONNAUGHT ROAD WEST, SHEUNG WAN, HONG KONG",,
TC000024,TRADE HONOUR LIMITED,業誠有限公司,"SUITE 1704, 17/F, THE CHINESE BANK BUILDING, 61-65 DES VOEUX ROAD CENTRAL, CENTRAL, HONG KONG",,
TC000025,GREAT TREASURE CONSULTANTS LIMITED,偉寶顧問有限公司,"FLAT/ROOM 1607, 16/F, WELLBORNE COMMERCIAL CENTRE, 8 JAVA ROAD, NORTH POINT, HONG KONG",,
TC000026,JINETIC CONSULTANTS LIMITED,進領顧問有限公司,"ROOM 22B, 22/F, KIU YIN COMMERCIAL BUILDING, 361-363 LOCKHART ROAD, WAN CHAI, HONG KONG",,
TC000027,HONGKONG BEST-SHINE LIMITED,香港百齊勝有限公司,"FLAT/ROOM 802, 8/F, WORKINGPORT COMMERCIAL BUILDING, 3 HAU FOOK STREET, TSIM SHA TSUI, KOWLOON, HONG KONG",,
TC000028,RIBEIRO HUI SERVICES LIMITED,,"6/F, WILSON HOUSE, 19-27 WYNDHAM STREET, CENTRAL, HONG KONG",,
TC000029,KCH SECRETARIAL LIMITED,,"18/F, HENLEY BUILDING, 5 QUEEN'S ROAD CENTRAL, CENTRAL, HONG KONG",,
TC000030,WEST UNION GLOBAL LIMITED,,"7/F, MW TOWER, 111 BONHAM STRAND, SHEUNG WAN, HONG KONG",,
TC000031,GATEWAY REGISTRATIONS LIMITED,港威註冊有限公司,"14/F, CHUN WO COMMERCIAL CENTRE, 25 WING WO STREET, CENTRAL, HONG KONG",,
TC000032,IPRO PROFESSIONAL SERVICES LIMITED,逸駿專業服務有限公司,"16/F, RICH BUILDING, 28 ORMSBY STREET, CAUSEWAY BAY, HONG KONG",,
TC000033,ALPHALAW LIMITED,香港網智有限公司,香港上環文咸東路50號寶恆商業中心1705室,,
TC000034,MW ACCOUNTING AND SECRETARIAL SERVICES LIMITED,敏華會計秘書服務有限公司,"10/F, NEW HENNESSY TOWER, 263 HENNESSY ROAD, WAN CHAI, HONG KONG",,
TC000035,LODESTAR SECRETARIES LIMITED,北極星秘書有限公司,"13/F, WAH KIT COMMERCIAL CENTRE, 302 DES VOEUX ROAD CENTRAL, SHEUNG WAN, HONG KONG",,
TC000036,KAM FUNG AGENT (HK) LIMITED,錦鋒代理(香港)有限公司,"UNIT 5, 4/F, FO TAN INDUSTRIAL CENTRE, 26-28 AU PUI WAN STREET, FO TAN, NEW TERRITORIES, HONG KONG",,
TC000037,HOIKIS COMPANY LIMITED,海褐有限公司,"UNIT 1, 11/F, TREASURE CENTRE, NO. 42 HUNG TO ROAD, KWUN TONG, KOWLOON, HONG KONG",,
TC000038,J & N ACCOUNTING & TAXATION LIMITED,駿朗會計稅務有限公司,"UNIT 904B, 9/F, PORT 33, 33 TSEUK LUK STREET, SAN PO KONG, KOWLOON, HONG KONG",,
TC000039,ATOZ HK CONSULTING LIMITED,,"UNIT 201, 2/F, TWO HARBOURFRONT, 22 TAK FUNG STREET, HUNGHOM, KOWLOON, HONG KONG",,
TC000040,LANCASHIRE MANAGEMENT SERVICES LIMITED,,"17/F, LKF 29, 29 WYNDHAM STREET, CENTRAL, HONG KONG",,
TC000041,REGAL FORCE (HONG KONG) LIMITED,萬盛(香港)有限公司,"ROOM 2808, 28/F, WU CHUNG HOUSE, 213 QUEEN'S ROAD EAST, WAN CHAI, HONG KONG",,
TC000043,EBD CORPORATE SERVICES LIMITED,義必達有限公司,"SUITE 2508, 25/F, TOWER 1, LIPPO CENTRE, 89 QUEENSWAY, ADMIRALTY, HONG KONG",,
TC000046,CENTURY SECRETARIAL SERVICES LIMITED,天時秘書服務有限公司,"UNIT B, 17/F, JCG BUILDING, 16 MONGKOK ROAD, KOWLOON, HONG KONG",,
TC000047,ALLIANCE & ASSOCIATES LIMITED,,"ROOM 2808, 28/F, WU CHUNG HOUSE, 213 QUEEN'S ROAD EAST, WAN CHAI, HONG KONG",,
TC000048,A-SWISS SECRETARIAL SERVICES LIMITED,,"ROOM B, 7/F, PICO TOWER, 66 GLOUCESTER ROAD, WAN CHAI, HONG KONG",,
TC000049,WISDOM FAITH CONSULTANCY LIMITED,智暉顧問有限公司,"UNIT B, 17/F, JCG BUILDING, 16 MONGKOK ROAD, KOWLOON, HONG KONG",,
TC000050,GENICO HOLDINGS LIMITED,捷力高集團有限公司,"3/F, BLOCK E, WANG CHEONG BUILDING, 251 RECLAMATION STREET, YAU MA TEI, KOWLOON, HONG KONG",,
TC000051,BUSINESS FULL CONSULTANTS LIMITED,凱懋顧問有限公司,"19/F, KAM FUNG COMMERCIAL BUILDING, 2-4 TIN LOK LANE, WAN CHAI, HONG KONG",,
TC000052,ONSHORER BUSINESS (HK) LIMITED,在岸港商務(香港)有限公司,"UNIT 826, 8/F, OCEAN CENTRE, HARBOUR CITY, NO.5 CANTON ROAD, TSIM SHA TSUI, KOWLOON, HONG KONG",,
TC000053,CHIU SIU WAI trading as J&B SECRETARIAL AND ACCOUNTANCY SERVICES CO,趙小慧 經營 葉趙秘書會計事務所,"ROOM 701, 7/F, WITTY COMMERCIAL BUILDING, 1A-1L TUNG CHOI STREET, MONG KOK, KOWLOON, HONG KONG",,
TC000054,VISTA BUSINESS CONSULTANTS LIMITED,域斯迪商業顧問有限公司,"UNIT 1002, 10/F, TOWER 1, SILVERCORD, 30 CANTON ROAD, TSIM SHA TSUI, KOWLOON, HONG KONG",,
TC000056,TT CONSULTANTS LIMITED,善財顧問有限公司,"UNIT C, 9/F, TOWER B, BILLION CENTRE, 1 WANG KWONG ROAD, KOWLOON BAY, KOWLOON, HONG KONG",,
TC000057,CMC CONSULTANTS LIMITED,斯穆企業顧問有限公司,"ROOM 605, 6/F, TAI YIP BUILDING, 141 THOMSON ROAD, WANCHAI, HONG KONG",,
TC000058,CM SERVICES HK LIMITED,,"18/F, SOMPTUEUX CENTRAL, 52 WELLINGTON STREET, CENTRAL, HONG KONG",,
TC000059,LA REGISTER GROUP LIMITED,環球註冊集團有限公司,"UNIT B, 26/F, SILVERCORP INTERNATIONAL TOWER, 707-713 NATHAN ROAD, MONG KOK, KOWLOON, HONG KONG",,
TC000060,ON CHING SECRETARIAL & ACCOUNTING SERVICES LIMITED,安晴秘書會計服務有限公司,"ROOM B & C, 20/F, FULL WIN COMMERCIAL CENTRE, 573 NATHAN ROAD, YAU MA TEI, KOWLOON, HONG KONG",,
TC000061,CHINA HONG KONG SECRETARIES LIMITED,中港秘書服務有限公司,"ROOM 1107, 11/F, 655 NATHAN ROAD, MONG KOK, KOWLOON, HONG KONG",,
TC000062,WSKM CORPORATE SERVICES LIMITED,,"ROOM 1203, 12/F, HON KWOK JORDAN CENTRE, 7 HILLWOOD ROAD, TSIM SHA TSUI, KOWLOON, HONG KONG",,
TC000063,ASCENDANT BUSINESS SERVICE LIMITED,創越企業服務有限公司,"FLAT/ROOM B, 13/F, SHING LEE COMMERCIAL BUILDING, 8 WING KUT STREET, CENTRAL, HONG KONG",,
TC000064,PRAXISIFM FIDUCIARIES (HONG KONG) LIMITED,,"20/F, 88 GLOUCESTER ROAD, WAN CHAI, HONG KONG",,
TC000065,PraxisIFM (Hong Kong) Limited,,"20/F, 88 GLOUCESTER ROAD, WAN CHAI, HONG KONG",,
TC000066,ASIA PACIFIC BUSINESS CENTER (HK) LIMITED,亞太商務中心(香港)有限公司,"UNIT B, 9/F, PHASE 2, BILLION PLAZA, 10 CHEUNG YUE STREET, CHEUNG SHA WAN, KOWLOON, HONG KONG",,
TC000067,SYNTRAL LIMITED,尚籌有限公司,"ROOM 201, 2/F, GOLDEN GATE COMMERCIAL BUILDING, 136-138 AUSTIN ROAD, TSIM SHA TSUI, KOWLOON, HONG KONG",,
TC000068,HEADWAY SECRETARIES AND CONSULTANTS LIMITED,科高秘書顧問有限公司,"FLAT A, 11/F, RITZ PLAZA, 122 AUSTIN ROAD, TSIM SHA TSUI, KOWLOON, HONG KONG",,
TC000071,THE LAW SHOP LIMITED,,"FLAT/ROOM 608, 6/F, LAFORD CENTRE, 838 LAI CHI KOK ROAD, CHEUNG SHA WAN, KOWLOON, HONG KONG",,
TC000073,BUSINESS SECRETARIAL CONSULTANTS LIMITED,商務秘書顧問有限公司,"FLAT/ROOM G367, 3/F, KWAI SHING INDUSTRIAL BUILDING, 42-46 TAI LIN PAI ROAD, KWAI CHUNG, NEW TERRITORIES, HONG KONG",,
TC000075,EVERGOLD SECRETARIAL SERVICES LIMITED,,"8/F, ASIA STANDARD TOWER, 59-65 QUEEN'S ROAD CENTRAL, CENTRAL, HONG KONG",,
TC000076,CAVA CONSULTING LIMITED,加利華顧問有限公司,"UNIT F, 26/F, TOWER 2, BILLION PLAZA, 10 CHEUNG YUE STREET, CHEUNG SHA WAN, KOWLOON, HONG KONG",,
TC000078,WELLSON SERVICES LIMITED,,"UNIT B, 17/F, UNITED CENTRE, 95 QUEENSWAY, ADMIRALTY, HONG KONG",,
TC000079,UNITE CORPORATE SERVICES LIMITED,,"UNIT B, 17/F, UNITED CENTRE, 95 QUEENSWAY, ADMIRALTY, HONG KONG",,
TC000080,TALENT WELL CONSULTANTS LIMITED,益俊顧問有限公司,"FLAT/ROOM 1203, 12/F, KALOK BUILDING, 720 NATHAN ROAD, MONGKOK, KOWLOON, HONG KONG",,
TC000081,CLY CONSULTANCY LIMITED,,"OFFICES A, E & F, 21/F, YARDLEY COMMERCIAL BUILDING, 3 CONNAUGHT ROAD WEST, SHEUNG WAN, HONG KONG",,
TC000082,KEN SHEN SERVICES COMPANY LIMITED,建駿服務有限公司,"ROOM 1504, 15/F, HARCOURT HOUSE, 39 GLOUCESTER ROAD, WANCHAI, HONG KONG",,
TC000083,SOPHIE SECRETARIAL SERVICES LIMITED,,"4/F, 4-6 ON LAN STREET, CENTRAL, HONG KONG",,
TC000084,CASSANDRA CORPORATE SERVICES LIMITED,,"4/F, 4-6 ON LAN STREET, CENTRAL, HONG KONG",,
TC000085,ALTQUEST LIMITED,,"FLAT/RM 1101A, 11/F, 88 GLOUCESTER ROAD, WAN CHAI, HONG KONG",,
TC000086,MAXWELL ACCOUNTING LIMITED,,"ROOM 2315, 23/F, METRO CENTRE II, 21 LAM HING STREET, KOWLOON BAY, KOWLOON, HONG KONG",,
TC000087,MY TRUSTED GROUP LIMITED,邁信集團有限公司,"UNIT 8, 3/F, CHEVALIER HOUSE, 45-51 CHATHAM ROAD SOUTH, TSIM SHA TSUI, KOWLOON, HONG KONG",,
TC000088,CK TAX COMPANY LIMITED,展群稅務有限公司,"ROOM 1403 & 1405, 14/F, BEVERLY HOUSE, 93-107 LOCKHART ROAD, WAN CHAI, HONG KONG",,
TC000089,KOS SECRETARIAL CONSULTANTS LIMITED,高盛秘書顧問有限公司,"FLAT/RM 1903, 19/F, PODIUM PLAZA, 5 HANOI ROAD, TSIM SHA TSUI, KOWLOON, HONG KONG",,
TC000090,WOOCO NOMINEES LIMITED,,"ROOM 1225, 12/F, PRINCE'S BUILDING, 10 CHATER ROAD, CENTRAL, HONG KONG",,
TC000091,WITS SERVICES LIMITED,緯智服務有限公司,"ROOM 2804B, 28/F, WU CHUNG HOUSE, 213 QUEEN'S ROAD EAST, WAN CHAI, HONG KONG",,
TC000093,ALPHA FORTUNE LIMITED,利日有限公司,"UNIT B7-M, 3/F, BLOCK B, HONG KONG INDUSTRIAL CENTRE, 489-491 CASTLE PEAK ROAD, LAI CHI KOK, KOWLOON, HONG KONG",,
TC000094,CR EASY LIMITED,公司通有限公司,"ROOM 2405, 24/F, TUNG CHE COMMERCIAL CENTRE, 246 DES VOEUX ROAD WEST, SAI WAN, HONG KONG",,
TC000095,AIT CONSULTANTS LIMITED,,"ROOM 1308, 13/F, WITTY COMMERCIAL BUILDING, 1A-1L TUNG CHOI STREET, MONG KOK, KOWLOON, HONG KONG",,
TC000096,CHEERS WAY PROFESSIONAL SERVICES LIMITED,卓唯專業服務有限公司,"ROOM 1007A, 10/F, OFFICEPLUS @PRINCE EDWARD, NO. 794-802 NATHAN ROAD, PRINCE EDWARD, KOWLOON, HONG KONG",,
TC000097,VONGS CORPORATE SERVICES LIMITED,,"FLAT/RM A&B, 2/F, QUEEN'S CENTRE, 60 QUEEN'S ROAD EAST, WAN CHAI, HONG KONG",,
TC000098,TSE WANG YU trading as DING HONG CO.,謝宏儒 經營 鼎鴻公司,"ROOM D2, 08/F, NO. 2 TAI YAU STREET, KOWLOON, HONG KONG",,
TC000099,EAST ASIA CORPORATE SERVICES LIMITED,東滙商業服務有限公司,"UNIT B, 16/F, YAM TZE COMMERCIAL BUILDING, 23 THOMSON ROAD, WAN CHAI, HONG KONG",,
TC000100,EASCOM LIMITED,,"UNIT B, 16/F, YAM TZE COMMERCIAL BUILDING, 23 THOMSON ROAD, WAN CHAI, HONG KONG",,
TC000101,CHARMWAY SECRETARY LIMITED,浚威秘書有限公司,"UNIT 1202, 12/F, ORIENTAL CENTRE, 67-71 CHATHAM ROAD, TSIM SHA TSUI, KOWLOON, HONG KONG",,
TC000102,FORTUNE PORT SECRETARIAL SERVICES LIMITED,富港秘書服務有限公司,"ROOM 1106, 11/F, STERLING CENTRE, 11 CHEUNG YUE STREET, CHEUNG SHA WAN, KOWLOON, HONG KONG",,
TC000104,LFDI SECRETARIES LIMITED,,"SUITE 2006, 20/F, 340 QUEEN'S ROAD CENTRAL, SHEUNG WAN, HONG KONG",,
TC000105,PH SECRETARIES LIMITED,興偉秘書有限公司,"UNIT 4, 12A/F, SINGGA COMMERCIAL CENTRE, 148 CONNAUGHT ROAD WEST, SAI WAN, HONG KONG",,
TC000106,TEAM TARGET LIMITED,,"FLAT/ROOM 1303, 13/F, KENBO COMMERCIAL BUILDING, 335-339 QUEEN'S ROAD WEST, SAI YING PUN, HONG KONG",,
TC000107,COUNSELOR CONSULTANTS LIMITED,中策顧問有限公司,"FLAT/RM 05, 4/F, TUNG MING BUILDING, 40-42 DES VOEUX ROAD CENTRAL, CENTRAL, HONG KONG",,
TC000108,PANG TZE CHUEN trading as BUSINESS SERVICES & ACCOUNTING COMPANY,彭子全 經營 BUSINESS SERVICES & ACCOUNTING COMPANY,"ROOM 2810, 28/F, ASIA TRADE CENTRE, 79 LEI MUK ROAD, KWAI CHUNG, NEW TERRITORIES, HONG KONG",,
TC000109,VADD INTERNATIONAL LIMITED,金略國際會議展覽有限公司,"FLAT/ROOM 2404, 24/F, WORLD-WIDE HOUSE, 19 DES VOEUX ROAD CENTRAL, CENTRAL, HONG KONG",,
TC000110,MACCON LIMITED,名企有限公司,"FLAT/ROOM 2404, 24/F, WORLD-WIDE HOUSE, 19 DES VOEUX ROAD CENTRAL, CENTRAL, HONG KONG",,
TC000111,ANDY ACCOUNTING SERVICES LIMITED,安達會計服務有限公司,"ROOM 2, 12/F, BLOCK A, CHUNG MEI CENTRE, 15-17 HING YIP STREET, KWUN TONG, KOWLOON, HONG KONG",,
TC000112,RELTCO BUSINESS SERVICES LIMITED,慧誠商業服務有限公司,"ROOM 703, 7/F, AUSTIN TOWER, 22-26A AUSTIN AVENUE, TSIM SHA TSUI, HONG KONG",,
TC000114,XELA BUSINESS SOLUTIONS LIMITED,國賢商業服務有限公司,"UNIT 5B, 5/F, FREE TRADE CENTRE, 49 TSUN YIP STREET, KWUN TONG, KOWLOON, HONG KONG",,
TC000116,ATHENASIA CONSULTING LIMITED,,"ROOM 2301, 23/F, BAYFIELD BUILDING, 99 HENNESSY ROAD, WAN CHAI, HONG KONG",,
TC000117,GOLDEN TREE CORPORATE SECRETARIAL LIMITED,黃金樹秘書服務有限公司,"ROOM B, 10/F, WING TAT COMMERCIAL BUILDING, 121-125 WING LOK STREET, SHEUNG WAN, HONG KONG",,
TC000118,ASIALINK CORPORATE SERVICES LIMITED,瑞華商務顧問有限公司,"ROOM 2204, 22/F, FU FAI COMMERCIAL CENTRE, 27 HILLIER STREET, SHEUNG WAN, HONG KONG",,
TC000120,WONDER GOLD BUSINESS LIMITED,高威商務有限公司,"FLAT B, 3/F, WING CHEONG COMMERCIAL BUILDING, 19-25 JERVOIS STREET, SHEUNG WAN, HONG KONG",,
TC000122,ACCURACY CORPORATE SERVICES LIMITED,鑑準企業服務有限公司,"7/F, GOODFIT COMMERCIAL BUILDING, 7 FLEMING ROAD, WAN CHAI, HONG KONG",,
TC000123,COMPSEC MANAGEMENT LIMITED,,"ROOM 1903, TIMES TOWER, 928-930 CHEUNG SHA WAN ROAD, CHEUNG SHA WAN, KOWLOON, HONG KONG",,
TC000124,LEADER CORPORATE SERVICES LIMITED,能達企業服務有限公司,"ROOM B, 12/F, SHING LEE COMMERCIAL BUILDING, 8-12 WING KUT STREET, CENTRAL, HONG KONG",,
TC000125,J SECRETARY LIMITED,積利秘書有限公司,"FLAT/ROOM 1203, 12/F, CEO TOWER, 77 WING HONG STREET, CHEUNG SHA WAN, KOWLOON, HONG KONG",,
TC000126,RICH ASSETS CONSULTANTS LIMITED,宏志顧問有限公司,"RM 2107-9, 21/F, C C WU BUILDING, 302-308 HENNESSY ROAD, WAN CHAI, HONG KONG",,
TC000127,JV CONSULTANTS LIMITED,捷成顧問有限公司,"ROOM 2108, 21/F, C C WU BUILDING, 308 HENNESSY ROAD, WAN CHAI, HONG KONG",,
TC000128,HKCN SECRETARY SERVICES LIMITED,港匯秘書服務有限公司,"ROOM 2107, 21/F, C C WU BUILDING, 308 HENNESSY ROAD, WAN CHAI, HONG KONG",,
TC000129,AKIN PROFESSIONALS LIMITED,,"20/F, CHAMPION BUILDING, 287-291 DES VOEUX ROAD CENTRAL, SHEUNG WAN, HONG KONG",,
TC000130,TOP TEAM SECRETARY LIMITED,漮誠秘書有限公司,"UNIT 7, 9/F, ENTERPRISE SQUARE THREE, 39 WANG CHIU ROAD, KOWLOON BAY, KOWLOON, HONG KONG",,
TC000131,CITY SECRETARIAL LIMITED,城市秘書有限公司,"ROOM 1902, 19/F, CAMERON COMMERCIAL CENTRE, 468 HENNESSY ROAD, CAUSEWAY BAY, HONG KONG",,
TC000132,REHUBLIC LIMITED,同博有限公司,"ROOM 802, 8/F, CHEVALIER HOUSE, 45-51 CHATHAM ROAD SOUTH, TSIM SHA TSUI, KOWLOON, HONG KONG",,
TC000133,REGENSEC LIMITED,勵晶秘書有限公司,"ROOM 802, 8/F, CHEVALIER HOUSE, 45-51 CHATHAM ROAD SOUTH, TSIM SHA TSUI, KOWLOON, HONG KONG",,
TC000134,VISIONONE FIDUCIARIES LIMITED,,"LEVEL 35, INFINITUS PLAZA, 199 DES VOEUX ROAD CENTRAL, SHEUNG WAN, HONG KONG",,
TC000135,S.K. TAM ACCOUNTING & SECRETARIAL LIMITED,小群有限公司,"FLAT/ROOM E8B, 6/F, LEE SUM FACTORY BUILDING, 28 NG FONG STREET, SAN PO KONG,  KOWLOON, HONG KONG",,
TC000136,J-TECH CONSULTING LIMITED,,"UNIT A, 13/F, KEE SHING CENTRE, 74-76 KIMBERLEY ROAD, TSIM SHA TSUI, KOWLOON, HONG KONG",,
TC000137,GLORY REGION TRADING LIMITED,匯榮貿易有限公司,"ROOM 302, 3/F, MALAYSIA BUILDING, 50 GLOUCESTER ROAD, WAN CHAI, HONG KONG",,
TC000138,A & J STRATEGY LIMITED,丹瑜策略管理有限公司,"ROOM 3, 13/F, PRESIDENT COMMERCIAL CENTRE, 608 NATHAN ROAD, MONG KOK, KOWLOON, HONG KONG",,
TC000140,WONSEC LIMITED,智成商務有限公司,"FLAT/RM 2604, 26/F, FOOK YIP BUILDING, 53-57 KWAI FUNG CRESCENT, KWAI FONG, NEW TERRITORIES, HONG KONG",,
TC000141,HORIZON (HK) CONSULTING LIMITED,中瑞誠(香港)顧問有限公司,"ROOM 302, 3/F, MALAYSIA BUILDING, 50 GLOUCESTER ROAD, WAN CHAI, HONG KONG",,
TC000142,YES CHOICE CONSULTING LIMITED,逸彩顧問有限公司,"ROOM 302, 3/F, MALAYSIA BUILDING, 50 GLOUCESTER ROAD, WAN CHAI, HONG KONG",,
TC000143,YES CHOICE SECRETARIES LIMITED,逸彩秘書行有限公司,"ROOM 302, 3/F, MALAYSIA BUILDING, 50 GLOUCESTER ROAD, WAN CHAI, HONG KONG",,
TC000145,LINKFAIR NOMINEES LIMITED,聯輝代理人有限公司,"24/F, HANG WAI COMMERCIAL BUILDING, 231-233 QUEEN'S ROAD EAST, WAN CHAI, HONG KONG",,
TC000146,YING KEI MANAGEMENT CONSULTANCY LIMITED,盈基管理顧問有限公司,"FLAT/RM 511B, 5/F, WUI WAH FACTORY BUILDING, 41 WING HONG STREET, CHEUNG SHA WAN, KOWLOON, HONG KONG",,
TC000149,ATLANTIS CORPORATE SERVICES LIMITED,,"UNIT 3104-05, 31/F, UNIVERSAL TRADE CENTRE, 3 ARBUTHNOT ROAD, CENTRAL, HONG KONG",,
TC000150,HONG KONG COMPANY SECRETARY LIMITED,,"SUITE 1007-8, 10/F, ST. GEORGE'S BUILDING, 2 ICE HOUSE STREET, CENTRAL, HONG KONG",,
TC000151,TIMOTHY LOH CORPORATE SERVICES LIMITED,,"SUITE 1007-8, 10/F, ST. GEORGE'S BUILDING, 2 ICE HOUSE STREET, CENTRAL, HONG KONG",,
TC000152,H & G SERVICES LIMITED,,"ROOM 2005-11, 20/F, CHINA UNITED CENTRE, 28 MARBLE ROAD, NORTH POINT, HONG KONG",,
TC000153,LAI PAK KIN trading as KIU'S & COMPANY,賴栢堅 經營 KIU'S & COMPANY,"22 SUN ON TSUEN, SAI KUNG, NEW TERRITORIES, HONG KONG",,
TC000155,AMBER SERVICES LIMITED,,"ROOM 1501-08, 15/F, MILLENNIUM CITY 5, 418 KWUN TONG ROAD, KWUN TONG, KOWLOON, HONG KONG",,
TC000156,BMC SERVICES LIMITED,盟諾商業服務有限公司,"FLAT/ROOM 1501, 15/F, MILLENNIUM CITY 5, 418 KWUN TONG ROAD, KWUN TONG, KOWLOON, HONG KONG",,
TC000157,F. S. LI ASSOCIATES LIMITED,,"1001, 10/F, ADMIRALTY CENTRE TOWER 1,  18 HARCOURT ROAD, HONG KONG",,
TC000158,CORPORATE SECRETARIES LIMITED,公司秘書有限公司,"11/F, TOWER 2, TERN CENTRE, 251 QUEEN'S ROAD CENTRAL, HONG KONG",,
TC000159,CORPORATE SECRETARIES (HK) LIMITED,公司秘書（香港）有限公司,"11/F, TOWER 2, TERN CENTRE, 251 QUEEN'S ROAD CENTRAL, HONG KONG",,
TC000163,CORPOSEC MANAGEMENT LIMITED,高寶秘書管理有限公司,"FLAT A, 8/F, KINGSWELL COMMERCIAL TOWER, 171 LOCKHART ROAD, WAN CHAI, HONG KONG",,
TC000164,ACCOLADE SHELF LIMITED,,"ROOM 1002, 10/F, FU FAI COMMERCIAL CENTRE, 27 HILLIER STREET, SHEUNG WAN, HONG KONG",,
TC000165,DOUGLAS MANAGEMENT CONSULTANTS LIMITED,名仕商業顧問有限公司,"ROOM 801, 8/F, TOWER 1, ENTERPRISE SQUARE, 9 SHEUNG YUET ROAD, KOWLOON BAY, KOWLOON, HONG KONG",,
TC000166,LAFON SECRETARIAL & CONSULTANT LIMITED,和豐秘書顧問有限公司,"17/F, WING SING COMMERCIAL CENTRE, 12-16 WING LOK STREET, SHEUNG WAN, HONG KONG",,
TC000167,LAFON LIMITED,和豐專業有限公司,"17/F, WING SING COMMERCIAL CENTRE, 12-16 WING LOK STREET, SHEUNG WAN, HONG KONG",,
TC000168,SUREUNIT (HONG KONG) LIMITED,世優(香港)有限公司,"UNIT 1001, 10/F, HARBOUR CRYSTAL CENTRE, NO.100 GRANVILLE ROAD, TSIM SHA TSUI EAST, KOWLOON, HONG KONG",,
TC000169,POWER POINT SECRETARIES LIMITED,動點秘書有限公司,"ROOM 1702, 17/F, SINO CENTRE, 582-592 NATHAN ROAD, MONG KOK, KOWLOON, HONG KONG",,
TC000170,"POWER POINT MANAGEMENT (HK) CO., LIMITED",,"ROOM 1702, 17/F, SINO CENTRE, 582-592 NATHAN ROAD, MONG KOK, KOWLOON, HONG KONG",,
TC000171,MTS CORPORATE SERVICES LIMITED,,"805-6, 8/F, PROSPERITY MILLENNIA PLAZA, 663 KING'S ROAD, NORTH POINT, HONG KONG",,
TC000172,DF CORPORATE SERVICES LIMITED,,"FLAT/RM A, 12/F, CHINA OVERSEAS BUILDING, 139 HENNESSY ROAD, WAN CHAI, HONG KONG",,
TC000173,BRILLIANT BRIGHT CORPORATE SERVICES LIMITED,暉煌秘書有限公司,"21/F, HING LUNG COMMERCIAL BUILDING, 68-74 BONHAM STRAND, SHEUNG WAN, HIONG KONG",,
TC000174,BL CONSULTANTS COMPANY LIMITED,商傳顧問有限公司,"FLAT/ROOM 1402, 14/F, BEVERLY HOUSE, 93-107 LOCKHART ROAD, WAN CHAI, HONG KONG",,
TC000175,GALLIUM SECRETARIES LIMITED,嘉臨秘書有限公司,"FLAT/ROOM B, 11/F, HANG SENG CAUSEWAY BAY BUILDING, 28 YEE WO STREET, CAUSEWAY BAY, HONG KONG",,
TC000177,LEAD CONSULTANTS LIMITED,元領培訓及教育顧問有限公司,"FLAT/RM 1302, 13/F, TREND CENTRE, 29-31 CHEUNG LEE STREET, CHAI WAN,  HONG KONG",,
TC000178,CENTRAL DYNAMIC SECRETARIAL LIMITED,中恆動力秘書有限公司,"UNIT 1510-17, 15/F, TOWER 2, KOWLOON COMMERCE CENTRE, 51 KWAI CHEONG ROAD, KWAI CHUNG, NEW TERRITORIES, HONG KONG",,
TC000179,PROFIT RANGE LIMITED,利闊有限公司,"FLAT/ROOM 2001-2, 20/F, CC WU BUILDING, 302-8 HENNESSY ROAD, WAN CHAI, HONG KONG",,
TC000180,VINCENT SECRETARIAL SERVICES (NOMINEE) LIMITED,,"11/F, WHEELOCK HOUSE, 20 PEDDER STREET, CENTRAL, HONG KONG",,
TC000181,PRESTIGE CONSULTANCY LIMITED,皓哲顧問有限公司,"UNIT 1003, 10/F, TOWER 2, SILVERCORD, 30 CANTON ROAD, TSIM SHA TSUI, KOWLOON, HONG KONG",,
TC000182,KYI ACCOUNTING & CONSULTING LIMITED,,"FLAT/ROOM 502, 5/F, PROSPEROUS BUILDING, 48-52 DES VOEUX ROAD CENTRAL, CENTRAL, HONG KONG",,
TC000183,SKY BASE MANAGEMENT CONSULTANTS LIMITED,天璣顧問服務有限公司,"20/F, PARKVIEW CENTRE, 7 LAU LI STREET, CAUSEWAY BAY, HONG KONG",,
TC000184,FAITHFUL ACCOUNTING & SECRETARIAL SERVICES LIMITED,信誠會計秘書服務有限公司,"ROOM 1407, 14/F, LOON KEE BUILDING, 267-275 DES VOEUX ROAD CENTRAL, SHEUNG WAN, HONG KONG",,
TC000185,CREDIBLE BUSINESS CONSULTANT LIMITED,誠信商業顧問有限公司,"FLAT/ROOM 18, 10/F, ONE MIDTOWN, 11 HOI SHING ROAD, TSUEN WAN, NEW TERRITORIES, HONG KONG",,
TC000187,APF PARTNERS LIMITED,安培亞洲有限公司,"14/F, SOUTH CHINA BUILDING, 1-3 WYNDHAM STREET, CENTRAL, HONG KONG",,
TC000188,QUARTERMAIN LIMITED,,"FLAT/RM A, 7/F, 128 WELLINGTON STREET, CENTRAL, HONG KONG",,
TC000189,HENSE SECRETARIES LIMITED,新興秘書有限公司,"UNIT C, 9/F, NEICH TOWER, 128 GLOUCESTER ROAD, WAN CHAI, HONG KONG",,
TC000190,WELL GUARD TAX AND SECRETARIAL LIMITED,威格稅務秘書有限公司,"FLAT/ROOM A, 6/F, WING WONG COMMERCIAL BUILDING, NO. 557-559 NATHAN ROAD, YAU MA TEI, KOWLOON, HONG KONG.",,
TC000191,LEE & YU CORPORATE SERVICES LIMITED,李志輝．余仲良企業服務有限公司,"22/F, GUANGDONG FINANCE BUILDING, 88 CONNAUGHT ROAD WEST, SHEUNG WAN, HONG KONG",,
TC000192,ESSENCE ACCOUNTING AND SECRETARIAL SERVICES LIMITED,誠暉會計秘書服務有限公司,"ROOM 1501, 15/F, ALLIANCE BUILDING, 130-136 CONNAUGHT ROAD, CENTRAL, HONG KONG",,
TC000194,COMSEC INTERNATIONAL LIMITED,金誠秘書國際有限公司,"ROOM 1403, 14/F, WEST TOWER, SHUN TAK CENTRE, 168 CONNAUGHT ROAD CENTRAL, SHEUNG WAN, HONG KONG",,
TC000195,BILLION CAPITAL FINANCIAL SERVICES LIMITED,億豐財經顧問有限公司,"ROOM 1502, 15/F, BEVERLY HOUSE, 93-107 LOCKHART ROAD, WAN CHAI, HONG KONG",,
TC000196,SINO PROFIT ADVISORY LIMITED,中盈諮詢有限公司,"ROOM 1601, 16/F, MULTIFIELD COMMERCIAL CENTRE, 426 SHANGHAI STREET, MONG KOK, KOWLOON",,
TC000198,SOUTH ZONE HOLDINGS LIMITED,南洋控股有限公司,"FLAT 1304, 13/F, NEW EAST OCEAN CENTRE, 9 SCIENCE MUSEUM ROAD, TSIM SHA TSUI EAST, HONG KONG",,
TC000200,SWALS EXIM PVT. LIMITED,斯沃克斯進出口有限公司,"FLAT/RM 16, 5/F, EAST OCEAN CENTRE, 98 GRANVILLE ROAD, TSIM SHA TSUI EAST, KOWLOON, HONG KONG",,
TC000201,TRUTHFUL BUSINESS SERVICES LIMITED,至誠商務有限公司,"ROOM 605, 6/F, TAI TUNG BUILDING, NO.8 FLEMING ROAD, WAN CHAI, HONG KONG",,
TC000202,PUI YAN COMPANY LIMITED,,"ROOM 813B, 8/F, HONG KONG PLAZA, 188 CONNAUGHT ROAD WEST, HONG KONG",,
TC000204,HAPPY OCEAN AGENCY LIMITED,悅海代理有限公司,"FLAT/ROOM A2, 15/F, UNITED CENTRE, 95 QUEENSWAY, ADMIRALTY, HONG KONG",,
TC000205,BONAFIDE SERVICES LIMITED,保其利顧問有限公司,"UNIT 02, 21/F, TOWER 2, ADMIRALTY CENTRE, NO. 18 HARCOURT ROAD, ADMIRALTY, HONG KONG",,
TC000206,CORPORATE BUSINESS SERVICES LIMITED,恒暉商務顧問有限公司,"UNIT 02, 21/F, TOWER 2, ADMIRALTY CENTRE, NO. 18 HARCOURT ROAD, ADMIRALTY, HONG KONG",,
TC000207,ERISS CORPORATE SERVICES LIMITED,雅域仕企業服務有限公司,"UNIT E, 11/F, TOWER B, BILLION CENTRE, 1 WANG KWONG ROAD, KOWLOON BAY, KOWLOON, HONG KONG",,
