TC007126,TIMES ENTERPRISES REGISTRATION SERVICE (HK) LIMITED,時代企業註冊服務（香港）有限公司,"UNIT 1406B, 14/F, THE BELGIAN BANK BUILDING, 721-725 NATHAN ROAD, MONGKOK, KOWLOON, HONG KONG",,
TC007127,"WEI CHEN ENTERPRISE CONSULTING SERVICE CO., LIMITED",唯宸企業諮詢服務有限公司,"FLAT/RM P2, 4/F, PHASE 3, KAISER ESTATE, 11 HOK YUEN STREET, HUNG HOM, KOWLOON, HONG KONG",,
TC007128,MSP ASSOCIATES LIMITED,,"UNIT A, 11/F, WING TAT COMMERCIAL BUILDING, 121-125 WING LOK STREET, SHEUNG WAN, HONG KONG",,
TC007129,LINNOVATE PARTNERS LIMITED,,"FLAT/RM 3303-04, 33/F, AIA KOWLOON TOWER LANDMARK EAST, 100 HOW MING STREET, KWUN TONG, KOWLOON, HONG KONG",,
TC007130,LUEN FAT BUSINESS (HK) LIMITED,聯發商務（香港）有限公司,"UNIT 1406A, 14/F, THE BELGIAN BANK BUILDING, 721-725 NATHAN ROAD, MONGKOK, KOWLOON, HONG KONG",,
TC007135,AIGER TRUST LIMITED,安極信託有限公司,"ROOM B, 21/F, HOI ON COMMERCIAL BUILDING, 8 MUI FONG STREET, SAI WAN, HONG KONG",The licensee is a trust company registered under section 78(1) of the Trustee Ordinance (Cap. 29),持牌人屬根據《受託人條例》(第29章) 第78(1)條註冊的信託公司
TC007136,KILMAX CORPORATE SERVICES LIMITED,甘麥士企業服務有限公司,"UNIT 107,1/F, GODFREY CENTRE SHOPPING ARCADE, 175-185 LAI CHI KOK ROAD, TAI KOK TSUI, KOWLOON, HONG KONG",,
TC007137,ZIRI SOLUTIONS LIMITED,紫日方案有限公司,"UNIT 202, 2/F, TOWER 2, SOUTH SEAS CENTRE, 75 MODY ROAD, TSIM SHA TSUI, KOWLOON, HONG KONG",,
TC007138,HELIXO OFFICE SOLUTIONS LIMITED,,"UNIT 16, 13/F, SING WIN FACTORY BUILDING, 15-17 SHING YIP STREET, KWUN TONG, KOWLOON, HONG KONG",,
TC007139,REVIS ADVISORY HONG KONG LIMITED,一品會計香港有限公司,"ROOM 607, YEN SHENG CENTRE, 64 HOI YUEN ROAD, KWUN TONG, KOWLOON, HONG KONG",,
TC007140,HONG KONG BUSINESS ADVISORY LIMITED,,"UNIT 809, 8/F, BRILL PLAZA, 84 TO KWA WAN ROAD, TO KWA WAN, KOWLOON, HONG KONG",,
TC007141,DAILY CREDIT CORPORATE SERVICES LIMITED,日新企業服務有限公司,"SUITE 2203-05, 22/F, 148 ELECTRIC ROAD, NORTH POINT, HONG KONG",,
TC007142,LSM SERVICES LIMITED,,"ROOM 1501, 15/F, PROSPERITY TOWER, 39 QUEEN'S ROAD CENTRAL, CENTRAL, HONG KONG",,
TC007143,TOP LEAGUE CORPORATE SERVICES COMPANY LIMITED,峰盟企業服務有限公司,"UNIT C, 15/F, FIRST ASIA TOWER, TSUEN WAN, NEW TERRITORIES, HONG KONG",,
TC007144,PROMOVO LIMITED,,"ROOM 101, 1/F, THE LUCKY BUILDING, 39 WELLINGTON STREET, CENTRAL, HONG KONG",,
TC007145,PACIFIC GATEWAY FINANCE LIMITED,,"6 TUNG TAU TSUEN, PING HA ROAD, YUEN LONG, NEW TERRITORIES, HONG KONG",,
TC007146,HUNG FUK ACCOUNTING AND CONSULTING LIMITED,鴻福會計及顧問有限公司,"FLAT/ROOM 706, 7/F, BLOCK 3, LEE SUM FACTORY BUILDING, 28 NG FONG STREET, SAN PO KONG, KOWLOON, HONG KONG",,
TC007147,ALUCIA CORPORATE SERVICES LIMITED,,"FLAT/ROOM 01, 11/F, AUSTIN PLAZA, 83 AUSTIN ROAD, TSIM SHA TSUI, KOWLOON, HONG KONG",,
TC007148,LIGNUM ACCOUNTING SERVICES LIMITED,景燁會計服務有限公司,"FLAT/ROOM 904B, 9/F, PORT 33, 33 TSUEK LUK STREET, SAN PO KONG, KOWLOON, HONG KONG",,
TC007149,UPPER RISE GROUP LIMITED,,"6/F, WYNDHAM PLACE, 40-44 WYNDHAM STREET, CENTRAL, HONG KONG",,
TC007150,ROYAL TALENT ACCOUNTING ADVISORY LIMITED,香港德瑞會計事務有限公司,"FLAT/ROOM 708B, 7/F, BLOCK 1, CHEUNG SHA WAN PLAZA, 833 CHEUNG SHA WAN ROAD, LAI CHI KOK, KOWLOON, HONG KONG",,
TC007151,GLOBAL INHERITANCE ASSET MANAGEMENT LIMITED,環球傳承資產管理有限公司,"FLAT/ROOM 1611, 16/F, THE METROPOLIS TOWER, 10 METROPOLIS DRIVE, HUNG HOM, KOWLOON, HONG KONG",,
TC007152,GOOD START CONSULTANTS LIMITED,怡進顧問有限公司,"FLAT/RM C, 5/F, GARMENT CENTRE, 576-586 CASTLE PEAK ROAD, KOWLOON, HONG KONG",,
TC007153,COMPLIANCEHUB LIMITED,,"ROOM D, 3/F, MEGA CUBE, 8 WANG KWONG ROAD, KOWLOON BAY, KOWLOON, HONG KONG",,
TC007154,UNIVERSAL CHANNEL CONSULTANT LIMITED,普鉦顧問有限公司,"ROOM 512, 5/F, LIPPO SUN PLAZA, 28 CANTON ROAD, TSIM SHA TSUI, KOWLOON, HONG KONG",,
TC007155,MAISON FAMILY OFFICE LIMITED,美盛國際家族辦公室有限公司,"ROOM A1, 26/F, MG TOWER, 133 HOI BUN ROAD, KOWLOON, HONG KONG",,
TC007156,ARK BUSINESS CONSULTANTS LIMITED,方舟商務顧問有限公司,"ROOM 12, 7/F, PHASE 2, METRO CENTRE, 21 LAM HING STREET, KOWLOON BAY, KOWLOON, HONG KONG",,
TC007157,JNB ASSET (HK) LIMITED,,"FLAT/RM K, 8/F, MG TOWER, 133 HOI BUN ROAD, KWUN TONG, KOWLOON, HONG KONG",,
TC007159,BIZWAY LIMITED,企業好幫手有限公司,"ROOM 18, 10/F, FORTUNE COMMERCIAL BUILDING, 362 SHA TSUI ROAD, TSUEN WAN, NEW TERRITORIES, HONG KONG",,
TC007160,INSTON HONG KONG LIMITED,言迅香港有限公司,"17/F, 80 GLOUCESTER ROAD, WAN CHAI, HONG KONG",,
TC007161,PROMAX SECRETARIAL SERVICES LIMITED,至盈秘書服務有限公司,"ROOM 803, 8/F, CHINA INSURANCE GROUP BUILDING, 141 DES VOEUX ROAD CENTRAL, CENTRAL, HONG KONG",,
TC007162,BOOMING HOLDINGS LIMITED,博明控股有限公司,"FLAT/ROOM 2413B, 24/F, TOWER 1, LIPPO CENTRE, 89 QUEENSWAY, ADMIRALTY, HONG KONG",,
TC007163,KKSC BUSINESS CONSULTANCY LIMITED,國青商業顧問有限公司,"FLAT/ROOM A, 29/F, UNITED CENTRE, 95 QUEENSWAY, ADMIRALTY, HONG KONG",,
TC007164,YAN YUN FIDUCIARY SERVICES LIMITED,胤源托管有限公司,"ROOM 71, 2/F, RED MALL, 509 JAFFE ROAD, CAUSEWAY BAY, HONG KONG",,
TC007165,KAISER SECRETARIAL LIMITED,譽凱秘書有限公司,"UNIT 1101, 11/F, TOWER 1, CHEUNG SHA WAN PLAZA, 833 CHEUNG SHA WAN ROAD, LAI CHI KOK, KOWLOON, HONG KONG",,
TC007166,T&K CORPORATE SERVICES LIMITED,淏天企業服務有限公司,"UNIT 1303, 13/F, OFFICEPLUS @SHEUNG WAN, 93-103 WING LOK STREET, SHEUNG WAN, HONG KONG",,
TC007167,RUIFENG (HK) CONSULTANCY LIMITED,瑞豐(香港)諮詢有限公司,"FLAT/ROOM 3203, 32/F, COSCO TOWER, 183 QUEEN'S ROAD CENTRAL, SHEUNG WAN, HONG KONG",,
TC007169,ACES CORPORATE SERVICES LIMITED,,"23/F, ON HONG COMMERCIAL BUILDING, 145 HENNESSY ROAD, WANCHAI, HONG KONG",,
TC007170,CHRYSAFI LIMITED,,"ROOM 403, LAP FAI BUILDING, 6-8 POTTINGER STREET, CENTRAL, HONG KONG",,
TC007171,WOS UNION CONSULTING LIMITED,,"ROOM 07, 12/F, CHEVALIER COMMERCIAL CENTRE, 8 WANG HOI ROAD, KOWLOON BAY, KOWLOON, HONG KONG",,
TC007172,WISEY SECRETARY LIMITED,慧賢秘書有限公司,"UNIT 16, 76/F, THE CENTER, 99 QUEEN'S ROAD CENTRAL, CENTRAL, HONG KONG",,
TC007173,WAN CHUNG YIN MATTHEW trading as M.E. PRO. COMPANY,温仲然 經營 M.E. PRO. COMPANY,"FLAT/RM 20, 23/F, BLOCK 2, METRO CENTRE, 21 LAM HING STREET, KOWLOON BAY, KOWLOON, HONG KONG",,
TC007174,MTGY LIMITED,,"ROOMS 1103-6, 11/F, ST GEORGE'S BUILDING, 2 ICE HOUSE STREET, CENTRAL, HONG KONG",,
TC007175,TSE CHEUK KEI trading as TSE CHEUK KEI,謝綽琦 經營 TSE CHEUK KEI,"ROOM 1401, 14/F, SHAN ON HOUSE, YUE ON COURT, AP LEI CHAU, HONG KONG",,
TC007176,BASTION CORPORATE SERVICES LIMITED,,"19/F, TWO INTERNATIONAL FINANCE CENTRE, 8 FINANCE STREET, CENTRAL, HONG KONG",,
TC007177,CHIBI CORPORATE SERVICES (HK) LIMITED,赤壁企業服務（香港）有限公司,"FLAT 15, 5/F, GENPLAS INDUSTRIAL BUILDING, 56 HOI YUEN ROAD, KWUN TONG, KOWLOON, HONG KONG",,
TC007178,NORTIK CORPORATE SERVICES LIMITED,諾迪企業服務有限公司,"FLAT/ROOM 02, 28/F, HO KING COMMERCIAL CENTRE, 2-16 FA YUEN STREET, MONGKOK, KOWLOON, HONG KONG",,
TC007180,CRYSTAL POWER CONSULTING LIMITED,殷卓顧問有限公司,"ROOM 1318, 13/F, AUSTIN TOWER, 22-26 AUSTIN AVENUE, TSIM SHA TSUI, KOWLOON, HONG KONG",,
TC007183,AQUASTRO CONSULTANTS LIMITED,尚盛顧問有限公司,"UNIT 08, 33/F, CLIFFORD CENTRE, 778 CHEUNG SHA WAN ROAD, LAI CHI KOK, KOWLOON, HONG KONG",,
TC007184,CCB NOMINEES LIMITED,建行(代理人)有限公司,"20/F, CCB CENTRE, 18 WANG CHIU ROAD, KOWLOON BAY, KOWLOON, HONG KONG",,
TC007185,FTI CONSULTING (HONG KONG) SERVICES TWO LIMITED,捷達代理人有限公司,"35/F, OXFORD HOUSE, TAIKOO PLACE, 979 KING'S ROAD, QUARRY BAY, HONG KONG",,
TC007186,DWP SERVICES HK LIMITED,,"1701-02, 17/F, FWD FINANCIAL CENTRE, 308 DES VOEUX ROAD CENTRAL, SHEUNG WAN, HONG KONG",,
TC007187,PANTEX PROFESSIONAL MANAGEMENT LIMITED,百達專業顧問有限公司,"FLAT/ROOM 505, 5/F, LU PLAZA, 2 WING YIP STREET, KWUN TONG, KOWLOON, HONG KONG",,
TC007188,MASS LIMITED,中茂有限公司,"FLAT/ROOM 505, 5/F, LU PLAZA, 2 WING YIP STREET, KWUN TONG, KOWLOON, HONG KONG",,
TC007189,VICTORY POST LIMITED,,"39/F, GLOUCESTER TOWER, THE LANDMARK, 15 QUEEN'S ROAD CENTRAL, HONG KONG",,
TC007190,VALPUSA GROUP LIMITED,,"9/F, AMTEL BUILDING, 148 DES VOEUX ROAD CENTRAL, CENTRAL, HONG KONG",,
TC007192,NOVA OPTIMO SERVICES LIMITED,新星優化服務有限公司,"UNIT A, 11/F, SUPREME INDUSTRIAL BUILDING, 15-17 SHAN MEI STREET, FO TAN, NEW TERRITORIES, HONG KONG",,
TC007193,SILVER WAND BUSINESS CONSULTANCY COMPANY LIMITED,銀杖商業咨詢有限公司,"UNIT A, 9/F, TWO CHINACHEM PLAZA, 68 CONNAUGHT ROAD CENTRAL, HONG KONG",,
TC007194,CORPAGENT ONLINE (HK) LIMITED,,"UNIT 03, 16/F, THE L. PLAZA, 367 - 375 QUEEN'S ROAD CENTRAL, SHEUNG WAN, HONG KONG",,
TC007195,SINO INTERNATIONAL TRUST COMPANY LIMITED,信置國際信託有限公司,"5/F, LINKCHART CENTRE, 2 TAI YIP STREET, KWUN TONG, KOWLOON, HONG KONG",The licensee is a trust company registered under section 78(1) of the Trustee Ordinance (Cap. 29),持牌人屬根據《受託人條例》(第29章) 第78(1)條註冊的信託公司
TC007196,SKY TREND ACCOUNTING SERVICES CENTRE,天正會計服務中心,"OFFICE H, 12/F, KING PALACE PLAZA, 55 KING YIP STREET, KWUN TONG, KOWLOON, HONG KONG",,
TC007197,CORPORATES ASIA LIMITED,,"ROOM 1403, 14/F, HERMES COMMERCIAL CENTRE, 4 HILLWOOD ROAD, TSIM SHA TSUI, KOWLOON, HONG KONG",,
TC007198,KJS SERVICES LIMITED,,"4/F, 299QRC, 287-299 QUEEN'S ROAD CENTRAL, SHEUNG WAN, HONG KONG",,
TC007201,TECHNICAL STANDARDS LIMITED,,"UNIT B, 16/F, TWO CHINACHEM PLAZA, 135-137 DES VOEUX ROAD CENTRAL, CENTRAL, HONG KONG",,
TC007202,HONGKONG DRAGONFLY BUSINESS LIMITED,香港臻晞商業有限公司,"ROOM 03, 13/F, CHEONG TAI BUILDING, NO.287-289, RECLAMATION STREET, MONG KOK, KOWLOON, HONG KONG",,
TC007203,CY ELITE CORPORATE SERVICES LIMITED,晉賢企業服務有限公司,"FLAT 1303, 13/F, PANG KWONG BUILDING, 59 HUNG TO ROAD, KWUN TONG, KOWLOON, HONG KONG",,
TC007204,COUNTAUDIT SECRETARIAL LIMITED,算數秘書有限公司,"UNIT 9039, 9/F, BLOCK B, CHUNG MEI CENTRE, 15-17 HING YIP STREET, KWUN TONG, KOWLOON, HONG KONG",,
TC007205,VENTURE SMART ASIA LIMITED,意博資本亞洲有限公司,"23/F, LEE GARDEN FIVE, 18 HYSAN AVENUE, CAUSEWAY BAY, HONG KONG",,
TC007206,VERTAX ADVISORY GROUP (HK) LIMITED,,"UNIT B01, 4/F, SUMMIT BUILDING, 30 MAN YUE STREET, HUNG HOM, KOWLOON, HONG KONG",,
TC007207,MONDEPAL CONSULTING COMPANY LIMITED,,"23/F, ONE ISLAND EAST, 18 WESTLANDS ROAD, QUARRY BAY, HONG KONG",,
TC007208,BLAUSTEIN ASIA LIMITED,布勞斯坦 有限公司,"UNIT C, 8/F, KING PALACE PLAZA, 55 KING YIP STREET, KWUN TONG, KOWLOON, HONG KONG",,
TC007209,LIGHTBULB LIMITED,光靈有限公司,"FLAT/RM E, 7/F, CHINA OVERSEAS BUILDING, 139 HENNESSY ROAD, WAN CHAI, HONG KONG",,
TC007210,HONG KONG QUALITY INVESTMENT GROUP LIMITED,香港優質投資集團有限公司,"G/F, 1/F, 2/F, ONWARD BUILDING, 528 NATHAN ROAD, YAU MA TEI, KOWLOON, HONG KONG",,
TC007211,ARDOR CORPORATE SERVICES LIMITED,,"FLAT/RM 608, 6/F, FU YUEN INDUSTRIAL BUILDING, 18-22 FUI YIU KOK STREET, TSUEN WAN, NEW TERRITORIES, HONG KONG",,
TC007212,DLO INTERNATIONAL CREDIT LIMITED,,"FLAT A,B,C,D, 10/F, CHAMPION BUILDING, 287-291 DES VOEUX ROAD CENTRAL, SHEUNG WAN, HONG KONG",,
TC007214,EVERT (NOMINEES) LIMITED,,"15/F, PHASES 1&2, CHINA TAIPING TOWER, 8 SUNNING ROAD, CAUSEWAY BAY, HONG KONG",,
TC007215,RTC CORPORATE SERVICES LIMITED,寶鎐企業服務有限公司,"SUITE 2006, AIA KOWLOON TOWER, LANDMARK EAST, 100 HOW MING STREET, KWUN TONG, KOWLOON, HONG KONG",,
TC007216,SJH GLOBAL LIMITED,,"UNIT 210, 2/F, TOWER 2, SOUTH SEAS CENTRE, 75 MODY ROAD, TSIM SHA TSUI, KOWLOON, HONG KONG",,
TC007217,EXCELLENT ACCOUNTING SERVICES LIMITED,卓志會計服務有限公司,"ROOM C, 15/F, REASON GROUP TOWER, 403 CASTLE PEAK ROAD, KWAI CHUNG, NEW TERRITORIES, HONG KONG",,
TC007218,JF MILLET LIMITED,法蘭米勒有限公司,"UNIT 3005, 30/F, CNT TOWER, 338 HENNESSY ROAD, WAN CHAI, HONG KONG",,
TC007219,ORCHARD ONE LIMITED,壹傲卓有限公司,"ROOM 1412, 14/F, ETON TOWER, 8 HYSAN AVENUE, CAUSEWAY BAY, HONG KONG",,
TC007220,HKFA CLEARING LIMITED,香港金融資產清算有限公司,"UNIT 1403, 14/F, RICHMAKE COMMERCIAL BUILDING, 198-200 QUEEN'S ROAD CENTRAL, CENTRAL, HONG KONG",,
TC007221,JL-1 PARTNERS LIMITED,,"ROOM 1401, 14/F, CHUNG YING BUILDING, 20 CONNAUGHT ROAD WEST, SHEUNG WAN, HONG KONG",,
TC007222,AND MAKER LIMITED,魅科有限公司,"FLAT/RM D, 9/F, WELLPOINT INDUSTRIAL BUILDING, 2 KIN WING LANE, TUEN MUN, HONG KONG",,
TC007224,LCY BUSINESS MANAGEMENT LIMITED,,"ROOM 604, 6/F, CHEUNG FUNG COMMERCIAL BUILDING, 21-25 CHEUNG SHA WAN ROAD, KOWLOON, HONG KONG",,
TC007225,D & J CORPORATE SERVICE LIMITED,中港商務秘書有限公司,"16/F, 1 DES VOEUX ROAD WEST, SHEUNG WAN, HONG KONG",,
TC007226,KY CORPORATE SERVICES LIMITED,港優會計顧問有限公司,香港九龍尖沙咀柯士甸路20號保發商業大廈10樓1001室,,
TC007227,CH GROUP HOLDINGS LIMITED,創浩集團控股有限公司,"ROOM 02-03, 31/F, 118 CONNAUGHT ROAD WEST, SAI WAN, HONG KONG",,
TC007228,CORPORFY BUSINESS SOLUTIONS LIMITED,確達訊商業服務有限公司,"FLAT/RM 1, 15/F, JUPITER TOWER, 9 JUPITER STREET, FORTRESS HILL, HONG KONG",,
TC007229,HISOFT CONSULTANTS LIMITED,海輝顧問有限公司,"ROOM 4, 15/F, SUNWISE INDUSTRIAL BUILDING, 16-26 WANG WO TSAI STREET, TSUEN WAN, NEW TERRITORIES, HONG KONG",,
TC007230,SEA CHAMPION CONSULTING LIMITED,海旋諮詢有限公司,"FLAT 1311, 13/F, TAK LIK INDUSTRIAL CENTER, 32 TAI YAU STREET, SAN PO KONG, KOWLOON, HONG KONG",,
TC007231,"FEIFAN ASSET MANAGEMENT CO., LIMITED",飛凡資產管理有限公司,"ROOM 729, 7/F, NAN FUNG TOWER, 88 CONNAUGHT ROAD CENTRAL, SHEUNG WAN, HONG KONG",,
TC007232,DRJ LIMITED,施韋箂有限公司,"UNIT 1517, 15/F, TOWER 2, KOWLOON COMMERCE CENTRE, 51 KWAI CHEONG ROAD, KWAI CHUNG, NEW TERRITORIES, HONG KONG",,
TC007233,IN FORMATIONS & SECRETARIES LIMITED,,"FLAT/RM 1, 6/F, NO. 168 QUEEN'S ROAD CENTRAL, CENTRAL, HONG KONG",,
TC007234,GLOBAL HK CORPORATE SERVICES LIMITED,,"ROOM 2203, 22/F, TUNG WAI COMMERCIAL BUILDING, 109-111 GLOUCESTER ROAD, WAN CHAI, HONG KONG",,
TC007235,JC CORPORATE SECRETARIAL LIMITED,哲思企業秘書有限公司,"UNIT 705, 7/F, ETON TOWER, 8 HYSAN AVENUE, CAUSEWAY BAY, HONG KONG",,
TC007236,CHI YING BUSINESS (HK) LIMITED,香港智盈商務有限公司,"ROOM 6, 11/F, CHEUNG HING BUILDING, 540-544 NATHAN ROAD, YAU MA TEI, KOWLOON, HONG KONG",,
TC007237,ASIA FIDUCIARIES LIMITED,,"FLAT/ROOM 2503, 25/F, BANK OF AMERICA TOWER, 12 HARCOURT ROAD, CENTRAL, HONG KONG",,
TC007238,ABC SECRETARIES LIMITED,,"FLAT/ROOM 2503, 25/F, BANK OF AMERICA TOWER, 12 HARCOURT ROAD, CENTRAL, HONG KONG",,
TC007239,HK JINZHONG BUSINESS GROUP LIMITED,金中(香港)商務集團有限公司,"FLAT/ROOM 1605, 16/F, HO KING COMMERCIAL CENTRE, 2-16 FA YUEN STREET, MONG KOK, KOWLOON, HONG KONG",,
TC007240,EXCEPTION LAND LIMITED,凡事都有例外有限公司,香港上環干諾道西20號中英大廈14樓03室,,
TC007241,FP ESCROW LIMITED,,"16/F, 9 CHONG YIP STREET, KWUN TONG, HONG KONG ",,
TC007242,AHEAD SECRETARY LIMITED,,"FLAT/ROOM 8E, 12/F, WAYSON COMMERCIAL BUILDING, 28 CONNAUGHT ROAD WEST, SHEUNG WAN, HONG KONG",,
TC007243,GLOBAL INT'L BUSINESS SECRETARY LIMITED,環球國際商務秘書有限公司,香港九龍新蒲崗大有街2號旺景工業大廈D座3樓D01室,,
TC007244,HUITONG INTERNATIONAL CONSULTING LIMITED,匯通國際諮詢有限公司,"ROOM 1517,15F, AMIATA INDUSTRIAL BUILDING, 58 LEI MUK ROAD, KWAI CHUNG, HONG KONG ",,
TC007246,YANGTZE CORPORATE MANAGEMENT LIMITED,揚子企業管理有限公司,"UNIT 2203, 22/F, HARBOUR CENTRE, 25 HARBOUR ROAD, WAN CHAI, HONG KONG",,
TC007247,OCS SECRETARIAL LIMITED,奧司秘書服務有限公司,"ROOM E, 10/F, TOWER A, BILLION CENTRE, 1 WANG KWONG ROAD, KOWLOON BAY, KOWLOON, HONG KONG",,
TC007248,FUND CONCEPT HOLDINGS LIMITED,銀創集團有限公司,"ROOM L, UNIT 22-23, 11/F, GOLDFIELD INDUSTRIAL CENTRE, 1 SUI WO ROAD, FO TAN, SHA TIN, NEW TERRITORIES, HONG KONG ",,
TC007249,TRINITY FINANCIAL GROUP LIMITED,,"ROOM L, UNIT 22-23, 11/F, GOLDFIELD INDUSTRIAL CENTRE, 1 SUI WO ROAD, FO TAN, SHA TIN, NEW TERRITORIES, HONG KONG",,
TC007250,LIU LUI LAM & ASSOCIATES LIMITED,廖呂林顧問有限公司,"FLAT/RM M, 17/F, BLOCK 1, KINGS WING PLAZA, 3 ON KWAN STREET, SHEK MUN, SHA TIN, NEW TERRITORIES, HONG KONG",,
TC007251,LIANXING BUSINESS (HK) LIMITED,聯興國際商務香港有限公司,"FLAT/ROOM 6, 11/F, CHEUNG HING BUILDING, 540-544 NATHAN ROAD, YAU MA TEI, KOWLOON, HONG KONG",,
TC007252,WONG & SHAM CONSULTANTS LIMITED,,"OFFICE C, 18/F, EGL TOWER, 83 HUNG TO ROAD, KWUN TONG, KOWLOON, HONG KONG",,
TC007253,CHINA AND PARTNERS LIMITED,,"FLAT/RM 2302, 23/F, NEW WORLD TOWER 1, 18 QUEEN'S ROAD CENTRAL, CENTRAL, HONG KONG",,
TC007254,BL SERVICES (HK) LIMITED,,"31/F, 148 ELECTRIC ROAD, NORTH POINT, HONG KONG",,
TC007255,BOARDROOM SECRETARIES LIMITED,,"31/F, 148 ELECTRIC ROAD, NORTH POINT, HONG KONG",,
TC007256,BOARDROOM NOMINEE (HK) LIMITED,,"31/F, 148 ELECTRIC ROAD, NORTH POINT, HONG KONG",,
TC007257,IP LAB INTERNATIONAL COMPANY LIMITED,港創客國際集團有限公司,"UNIT 3005, 30/F, GLOBAL GATEWAY TOWER, 63 WING HONG STREET, CEUNG SHA WAN, KOWLOON, HONG KONG",,
TC007258,HSIN KUANG CATERING MANAGEMENT LIMITED,新光餐飲管理有限公司,香港九龍黃大仙龍翔道120號新光中心A座5樓C室,,
TC007259,ENDURING HORSE LIMITED,馬毅力有限公司,"UNIT 02-06, 17/F, KINWICK CENTRE, 32 HOLLYWOOD ROAD, HONG KONG",,
TC007260,STEADY DIRECTION LIMITED,,"UNIT 02-06, 17/F, KINWICK CENTRE, 32 HOLLYWOOD ROAD, HONG KONG",,
TC007261,TIMELESS INVESTMENT LIMITED,,"UNIT 02-06, 17/F, KINWICK CENTRE, 32 HOLLYWOOD ROAD, HONG KONG",,
TC007262,SPECIAL ELEMENT LIMITED,,"UNIT 02-06, 17/F, KINWICK CENTRE, 32 HOLLYWOOD ROAD, HONG KONG",,
TC007263,DRAGON AZUR LIMITED,,"UNIT 02-06, 17/F, KINWICK CENTRE, 32 HOLLYWOOD ROAD, HONG KONG",,
TC007264,IMP PROFESSIONAL SERVICES LIMITED,,"ROOM 506, 5/F, EVERGLORY CENTRE, 1B KIMBERLEY STREET, TSIM SHA TSUI, KOWLOON, HONG KONG",,
TC007265,FORTUNE TRUST HONG KONG LIMITED,宏鑫信托（香港）有限公司,"ROOM 611-7, 6/F, SILVERCORD TOWER 2, 30 CANTON ROAD, TSIM SHA TSUI, KOWLOON, HONG KONG",The licensee is a trust company registered under section 78(1) of the Trustee Ordinance (Cap. 29),持牌人屬根據《受託人條例》(第29章) 第78(1)條註冊的信託公司
TC007266,GALAXY BUSINESS CENTRE LIMITED,企匯商務國際有限公司,"UNIT B, 8/F, WING HANG INSURANCE BUILDING, 11 WING KUT STREET, CENTRAL, HONG KONG",,
TC007267,COSMOS MANAGEMENT CONSULTANCY LIMITED,環球商業管理顧問有限公司,"UNIT 304, 3/F, DOMINION CENTRE, 43 QUEEN'S ROAD EAST, WANCHAI, HONG KONG",,
TC007268,ALINEA ASSOCIATES LIMITED,,"ROOM 802, 8/F, CHEVALIER HOUSE, 45-51 CHATHAM ROAD SOUTH, TSIM SHA TSUI, KOWLOON, HONG KONG",,
TC007269,ALPHA BUSINESS CONSULTANCY LIMITED,啟誠商務顧問有限公司,"FLAT/ROOM 1110, 11/F, APEC PLAZA, 49 HOI YUEN ROAD, KWUN TONG, KOWLOON, HONG KONG",,
TC007270,CSCGFM ASIA SERVICES (HONG KONG) PTE. LIMITED,,"UNIT 2, 10/F, NEO, 123 HOI BUN ROAD, KWUN TONG, KOWLOON, HONG KONG",,
TC007271,EDWARD CHOW TAX ADVISER LIMITED,周錦華稅務顧問有限公司,"UNITS A, B, & C, 12/F, JONSIM PLACE, 228 QUEEN'S ROAD EAST, WAN CHAI, HONG KONG",,
TC007273,PERFECT PROFESSIONAL ADJUSTERS LIMITED,優正公證行有限公司,"21/F, CHU KONG SHIPPING TOWER, 143 CONNAUGHT ROAD CENTRAL, SHEUNG WAN, HONG KONG",,
TC007276,EAST EMPIRE MANAGEMENT LIMITED,,"ROOM 7, 11/F, HEWLETT CENTRE, 52-54 HOI YUN ROAD, KWUN TONG, KOWLOON, HONG KONG",,
TC007277,LINK CITY CONSULTANTS LIMITED,連進商務有限公司,"UNIT 15, 18/F, W212, 212 TEXACO ROAD, TSUEN WAN, NEW TERRITORIES, HONG KONG",,
TC007278,ZEUS STRATEGIC MANAGEMENT LIMITED,中承策劃管理有限公司,"ROOM 1312, 13/F, FO TAN INDUSTRIAL CENTRE, 26-28 AU PUI WAN STREET, FO TAN, NEW TERRITORIES, HONG KONG",,
TC007279,IG AUTOACCOUNTING LIMITED,岩國程式會計有限公司,"21/F, CMA BUILDING, 64 CONNAUGHT ROAD, CENTRAL, HONG KONG",,
TC007280,PUN SUK KING trading as FOREVER SERVICES CO.,潘淑琼 經營 承諾服務公司,"ROOM 1016, 10/F, TOWER A, NEW MANDARIN PLAZA, 16 SCIENCE MUSEUM ROAD, TSIM SHA TSUI, KOWLOON, HONG KONG",,
TC007281,SKZ GROUP LIMITED,嶄盈有限公司,"FLAT/ROOM 17, 8/F, ONE MIDTOWN, 11 HOI SHING ROAD, TSUEN WAN, NEW TERRITORIES, HONG KONG",,
TC007282,GOLD CREST DEVELOPMENT LIMITED,曉煌發展有限公司,"22/F, ALLIED KAJIMA BUILDING, 138 GLOUCESTER ROAD, WAN CHAI, HONG KONG",,
TC007284,PROMINENCE TRUST LIMITED,,"18/F, THREE EXCHANGE SQUARE, 8 CONNAUGHT ROAD, CENTRAL, HONG KONG",The licensee is a trust company registered under section 78(1) of the Trustee Ordinance (Cap. 29),持牌人屬根據《受託人條例》(第29章) 第78(1)條註冊的信託公司
TC007285,WD CONSULTING LIMITED,柏雅顧問服務有限公司,"UNIT 02, 16/F, W668 BUILDING, 668 CASTLE PEAK ROAD, CHEUNG SHA WAN, KOWLOON, HONG KONG",,
TC007286,BURGUNDY BUSINESS LIMITED,,"17/F, TOWER ONE, LIPPO CENTRE, 89 QUEENSWAY, ADMIRALTY,  HONG KONG",,
TC007287,RIVERMOUNT SERVICES LIMITED,,"17/F, TOWER ONE, LIPPO CENTRE, 89 QUEENSWAY, HONG KONG",,
TC007288,LUPU TRUSTEE COMPANY LIMITED,陸浦信託有限公司,"ROOM 301, 3RD FLOOR, GOLDEN GATE COMMERCIAL BUILDING, 136-138 AUSTIN ROAD, TSIM SHA TSUI, KOWLOON, HONG KONG",The licensee is a trust company registered under section 78(1) of the Trustee Ordinance (Cap. 29),持牌人屬根據《受託人條例》(第29章) 第78(1)條註冊的信託公司
TC007289,NV DIGITAL SERVICES LIMITED,,"19/F, CHINACHEM TOWER, 34-37 CONNAUGHT ROAD CENTRAL, CENTRAL, HONG KONG",,
TC007290,PAK LEE (HONG KONG) ENTERPRISE REGISTRATIONS LIMITED,栢利(香港)企業註冊有限公司,"ROOM 917A, 9/F, TOWER A, NEW MANDARIN PLAZA, NO.14 SCIENCE MUSEUM ROAD, TSIM SHA TSUI EAST, HONG KONG",,
TC007291,MANIFY ACCOUNTING & SECRETARIAL LIMITED,萬傳會計秘書有限公司,"FLAT/ROOM 535, 5/F, LIN FUNG CENTRE, NOS. 184-186 TEXACO ROAD, TSUEN WAN, NEW TERRITORIES, HONG KONG",,
TC007292,GOLD BRILLIANT HOLDINGS LIMITED,,"UNIT 603, LOW BLOCK, GRAND MILLENNIUM PLAZA, 181 QUEEN'S ROAD CENTRAL, SHEUNG WAN, HONG KONG",,
TC007293,AEGIS SOLUTIONS (HONG KONG) LIMITED,,"20/F, WING SING COMMERCIAL CENTRE, 12-16 WING LOK STREET, SHEUNG WAN, HONG KONG",,
TC007294,C FOUNDATION LIMITED,,香港九龍旺角通菜街1A-1L號威達商業大廈1701B室,,
TC007295,WISE BRIGHT MANAGEMENT LIMITED,智明管理有限公司,"13/F, GRAND BUILDING, 18 CONNAUGHT ROAD CENTRAL, CENTRAL, HONG KONG",,
TC007296,JC CONSULTANCY SERVICES LIMITED,聚思咨詢有限公司,"ROOM 913, 9/F, WOON LEE COMMERCIAL BUILDING, 7-9 AUSTIN AVENUE, TSIM SHA TSUI, KOWLOON, HONG KONG",,
TC007297,GRAND KING GROUP LIMITED,盛璟集團有限公司,"SHOP 115, 1/F, TAI YAU PLAZA, 181 JOHNSTON ROAD, WAN CHAI, HONG KONG",,
TC007298,A & H SECRETARIAL LIMITED,良士秘書有限公司,"UNIT 14, 14/F, LAURELS INDUSTRIAL CENTRE, 32 TAI YAU STREET, KOWLOON, HONG KONG",,
TC007299,MR JAKE LIMITED,,"FLAT 1, 4/F, KIN ON BUILDING, 163-173 CAMP STREET, SHAM SHUI PO, KOWLOON, HONG KONG",,
TC007300,VISUS TRUST LIMITED,遠建信託有限公司,"5/F, STANDARD CHARTERED BANK BUILDING, 4-4A DES VOEUX ROAD CENTRAL, HONG KONG",The licensee is a trust company registered under section 78(1) of the Trustee Ordinance (Cap. 29),持牌人屬根據《受託人條例》(第29章) 第78(1)條註冊的信託公司
TC007301,QUALIS ASIA LIMITED,,"FLAT/ROOM 908, DOMINION CENTRE, 43-59 QUEEN'S ROAD EAST, WAN CHAI, HONG KONG",,
TC007303,YCLEE NOMINEE LIMITED,,"FLAT/RM 1808, 18/F, DOMINION CENTRE, 43-59 QUEEN'S ROAD EAST, HONG KONG",,
TC007304,EPROFIT COMPANY SERVICES LIMITED,永盈公司服務有限公司,"ROOM 01, 14/F, WAYSON COMMERCIAL BUILDING, 28 CONNAUGHT ROAD WEST, SHEUNG WAN, HONG KONG",,
TC007305,PLA HOLDINGS LIMITED,八一控股有限公司,"ROOM 102, 1/F, BLOCK A, KAISER ESTATE PHASE 1, 41 MAN YUE STREET, HUNGHOM, KOWLOON, HONG KONG",,
TC007306,REGUS HK MANAGEMENT LIMITED,,"4/F, THE LEE GARDEN 3, 1 SUNNING ROAD, CAUSEWAY BAY, HONG KONG",,
TC007307,ADEPT SERVICES LIMITED,卓建服務有限公司,"ROOM 2507-8, 25/F, CHINA INSURANCE GROUP BUILDING, 141 DES VOEUX ROAD CENTRAL,  CENTRAL, HONG KONG",,
TC007308,ACCLIME CORPORATE SERVICES LIMITED,凱晉企業服務有限公司,"UNIT B, 17/F, UNITED CENTRE, 95 QUEENSWAY, ADMIRALTY, HONG KONG",,
TC007309,INTERNATIONAL FIDUCIARIES LIMITED,,"6/F, WYNDHAM PLACE, 40-44 WYNDHAM STREET, CENTRAL, HONG KONG",,
TC007310,SCS-INVICTUS CONSULTING (HK) LIMITED,,"ROOM A5 & B7, 16/F, REMEX CENTRE, 42 WONG CHUK HANG ROAD, ABERDEEN, HONG KONG",,
TC007311,JSW CORPORATION LIMITED,,"ROOM 149, 14/F, ISLAND INDUSTRIAL BUILDING, 81-87 TUNG CHAU STREET, TAI KOK TSUI, KOWLOON, HONG KONG",,
TC007312,EARNFUL WORLDWIDE GROUP COMPANY LIMITED,盈豐環球集團有限公司,"WORKSHOP 5, 32/F, KIMBERLAND CENTER, 55 WING HONG STREET, LAI CHI KOK, KOWLOON, HONG KONG",,
TC007313,"BUSINESS AND TALENT MANAGEMENT CO., LIMITED",商業及人才管理有限公司,"UNIT 1802, 18/F, TOWER 1, THE GATEWAY, HARBOUR CITY, 25 CANTON ROAD, TSIM SHA TSUI, KOWLOON, HONG KONG",,
TC007314,DILIGENT TREASURE CORPORATE SERVICES LIMITED,勤寶順企業服務有限公司,"ROOM 908, 9/F, TAI SANG BANK BUILDING, 130-132 DES VOEUX ROAD CENTRAL, CENTRAL, HONG KONG",,
TC007315,CAM BUSINESS SERVICES LIMITED,,"ROOM 20, UNIT 03, 7/F, BLOCK B, TUEN MUN INDUSTRIAL CENTRE, SAN PING CIRCUIT, TUEN MUN, NEW TERRITORIES, HONG KONG",,
TC007316,WITHERS HK PROFESSIONAL SERVICES LIMITED,,"30/F, UNITED CENTRE, 95 QUEENSWAY, ADMIRALTY, HONG KONG",,
TC007317,FAME MAX CONSULTANTS LIMITED,銘盛顧問有限公司,"9/F, AMTEL BUILDING, 148 DES VOEUX ROAD CENTRAL, CENTRAL, HONG KONG",,
