TC002146,"ALLIANCE SECRETARIES AND NOMINEES, LIMITED",聯和秘書及代理人有限公司,"FLAT/RM A, 4/F, NGAN HOUSE, 210 DES VOEUX ROAD CENTRAL, CENTRAL, HONG KONG",,
TC002147,ASIA FINANCE CORPORATION LIMITED,亞洲金融服務有限公司,"ROOM A, 21/F, THE WARREN, 9 WARREN STREET, TAI HANG, CAUSEWAY BAY, HONG KONG",,
TC002148,OL INTERNATIONAL SERVICES LIMITED,,"FLAT C, 2/F, WAH LIK CENTRE, 459 CASTLE PEAK ROAD, TSUEN WAN, NEW TERRITORIES, HONG KONG",,
TC002149,GLOBAL SECRETARIAL SERVICES LIMITED,環球秘書服務有限公司,"FLAT M201, M2/F, HALESON BUILDING, 1 JUBILEE STREET, CENTRAL, HONG KONG",,
TC002150,YABEZ (HONG KONG) COMPANY LIMITED,雅比斯集團(香港)有限公司,"ROOM 05, 4/F, ENERGY PLAZA, 92 GRANVILLE ROAD, TSIM SHA TSUI, KOWLOON, HONG KONG",,
TC002151,SILVER STAR TAX REPRESENTATIVE LIMITED,銀星稅務有限公司,"ROOM 103A, 1/F, MIRROR TOWER, 61 MODY ROAD, TSIM SHA TSUI EAST, KOWLOON, HONG KONG",,
TC002152,CASTLE PEAK PROPERTY INVESTMENT LIMITED,,"ROOM 702, 7/F, FU FAI COMMERCIAL CENTRE, 27 HILLIER STREET, SHEUNG WAN, HONG KONG ",,
TC002153,TRILLIONS CORPORATE SERVICE LIMITED,毅億管理顧問有限公司,"ROOM 3, 8/F, HO LIK CENTRE, 66A SHA TSUI ROAD, TSUEN WAN, NEW TERRITORIES, HONG KONG",,
TC002154,AE MAJORIS CORPORATE SERVICES COMPANY LIMITED,明大企業服務有限公司,"ROOM 1801, 18/F, LEE GARDEN ONE, 33 HYSAN AVENUE, CAUSEWAY BAY, HONG KONG",,
TC002157,MAX GAIN CORPORATE SERVICES LIMITED,進盈企業服務有限公司,"ROOM C, 22/F, CAPITAL TRADE CENTRE, 62 TSUN YIP STREET, KWUN TONG, KOWLOON, HONG KONG",,
TC002158,POWER FRONT LIMITED,,"UNIT 1009, 10/F, CHINACHEM GOLDEN PLAZA, 77 MODY ROAD, TSIM SHA TSUI EAST, KOWLOON, HONG KONG",,
TC002159,K T SERVICES LIMITED,佳能服務有限公司,"FLAT/RM E, 13/F, SUN FAI COMMERCIAL CENTRE, 576 RECLAMATION STREET, MONGKOK, KOWLOON, HONG KONG",,
TC002163,ELITE INVESTMENTS MANAGEMENT LIMITED,誠明投資管理有限公司,"ROOM 1402, 14/F, JUBILEE CENTRE, 18 FENWICK STREET, WAN CHAI, HONG KONG",,
TC002164,ALFRED YEUNG COMPANY LIMITED,楊炳洪會計事務所有限公司,"FLAT/RM 04-05, 18/F, HUA QIN INTERNATIONAL BUILDING, 340 QUEEN'S ROAD CENTRAL, HONG KONG",,
TC002165,"LAM, LEE & SO TAXATION CONSULTANCY LIMITED",林李蘇稅務顧問有限公司,"ROOM 2605, 26/F, ISLAND PLACE TOWER, 510 KING'S ROAD, NORTH POINT, HONG KONG",,
TC002166,STONEHAVEN NOMINEES LIMITED,,"19/F, PRINTING HOUSE, 6 DUDDELL STREET, CENTRAL, HONG KONG",,
TC002167,ST. FILLANS LIMITED,,"19/F, PRINTING HOUSE, 6 DUDDELL STREET, CENTRAL, HONG KONG",,
TC002168,GLENLYON LIMITED,,"19/F, PRINTING HOUSE, 6 DUDDELL STREET, CENTRAL, HONG KONG",,
TC002169,GLENDEVON LIMITED,,"19/F, PRINTING HOUSE, 6 DUDDELL STREET, CENTRAL, HONG KONG",,
TC002170,I. M. SERVICES (H.K.) LIMITED,國際諮詢服務有限公司,"FLAT/RM C, 5/F, ANSON HOUSE, 13-19 LOCK ROAD, TSIM SHA TSUI, KOWLOON, HONG KONG",,
TC002175,HIGHWELL ACCOUNTING AND SECRETARIAL LIMITED,喜華會計秘書服務有限公司,"26/F, SHUN FENG INTERNATIONAL CENTRE, 182 QUEEN’S ROAD EAST, WAN CHAI, HONG KONG",,
TC002176,EASTIN CORPORATE SERVICES LIMITED,京川會計事務有限公司,"FLAT/RM 1707, 17/F, MILLENNIUM CITY 2, 378 KWUN TONG ROAD, KWUN TONG, KOWLOON, HONG KONG",,
TC002177,ACORATE PROFESSIONALS GROUP LIMITED,,"LEVEL 21, PARKVIEW CENTRE, NO. 7 LAU LI STREET, CAUSEWAY BAY, HONG KONG",,
TC002178,EXPRESS CONSULTANTS LIMITED,通誠顧問有限公司,"21/F, PARKVIEW CENTRE, 7 LAU LI STREET, TIN HAU, HONG KONG",,
TC002180,TALARIA ON LIMITED,得力安有限公司,"ROOM 1203, 12/F, EURO TRADE CENTRE, 13-14 CONNAUGHT ROAD CENTRAL, CENTRAL, HONG KONG",,
TC002183,FAIRWEATHER (NOMINEES) LIMITED,,"25TH FLOOR, JARDINE HOUSE, 1 CONNAUGHT PLACE, CENTRAL, HONG KONG",,
TC002186,FAIRWIND NOMINEES LIMITED,,"25TH FLOOR, JARDINE HOUSE, 1 CONNAUGHT PLACE, CENTRAL, HONG KONG",,
TC002187,RAKOS LIMITED,,"25TH FLOOR, JARDINE HOUSE, 1 CONNAUGHT PLACE, CENTRAL, HONG KONG",,
TC002189,H & L SECRETARIAL SERVICES LIMITED,,"FLAT/RM 1804-6, 18/F, WING ON HOUSE, 71 DES VOEUX ROAD CENTRAL, CENTRAL, HONG KONG",,
TC002191,ELITE CORPORATE SERVICES LIMITED,誠明企業服務有限公司,"ROOM 1402, 14/F, JUBILEE CENTRE, 18 FENWICK STREET, WAN CHAI, HONG KONG",,
TC002195,GREAT HONOUR INVESTMENT GROUP LIMITED,卓譽投資集團有限公司,"FLAT/ROOM 1308, 13/F, MULTIFIELD PLAZA, 3 PRAT AVENUE, TSIM SHA TSUI, KOWLOON, HONG KONG",,
TC002196,ERIC'S SECRETARIES LIMITED,李文忠秘書有限公司,"FLAT/RM 210, 2/F, SECURICOR CENTRE, 481 CASTLE PEAK ROAD, CHEUNG SHA WAN, KOWLOON, HONG KONG",,
TC002197,BIG SUCCESS CONSULTING LIMITED,大成功顧問有限公司,"SHOP LG86, LG/F, HOUSTON CENTRE, 63 MODY ROAD, TSIM SHA TSUI, KOWLOON, HONG KONG",,
TC002198,CITY EFFORT LIMITED,誠訊會計稅務有限公司,"FLAT/RM 1003, 10/F, HOLLYWOOD PLAZA, 610 NATHAN ROAD, MONG KOK, KOWLOON, HONG KONG",,
TC002199,GREAT TALENT SECRETARIAL LIMITED,浩才秘書有限公司,"FLAT/RM 02, 21/F, KING CENTRE, 23 DUNDAS STREET, MONG KOK, KOWLOON, HONG KONG",,
TC002200,JUSTINIAN (NOMINEES) LIMITED,,"25TH FLOOR, JARDINE HOUSE, 1 CONNAUGHT PLACE, CENTRAL, HONG KONG",,
TC002201,FAIR WIND SECRETARIAL SERVICES LIMITED,富榮秘書服務有限公司,"25/F, NEICH TOWER, 128 GLOUCESTER ROAD, WAN CHAI, HONG KONG",,
TC002203,NICECORP LIMITED,敬國有限公司,"FLAT B, 4/F, UNIONWAY COMMERCIAL CENTRE, 283 QUEEN'S ROAD CENTRAL, SHEUNG WAN, HONG KONG",,
TC002206,D K FINANCIAL SERVICES LIMITED,,"ROOM 2102-3, 21/F, CHINA INSURANCE GROUP BUILDING, 141 DES VOEUX ROAD CENTRAL, CENTRAL, HONG KONG",,
TC002208,ISLAND SECRETARY LIMITED,,"ROOM 903, 9/F, DOMINION CENTRE, 43-59 QUEEN'S ROAD EAST, WAN CHAI, HONG KONG",,
TC002210,MINDGENIUS CONSULTANTS LIMITED,邁進顧問有限公司,"ROOM 2104, 21/F, KING PALACE PLAZA, 52A SHA TSUI ROAD, TSUEN WAN, NEW TERRITORIES, HONG KONG",,
TC002211,LONGFAITH REGISTRATION LIMITED,永信專業註冊有限公司,"FLAT/ROOM A, 14/F, QUEEN'S CENTRE, 58-64 QUEEN'S ROAD EAST, WAN CHAI, HONG KONG",,
TC002212,HEDI LEE SECRETARY LIMITED,李雪晴秘書有限公司,"ROOM 1116, 11/F, FORTUNE COMMERCIAL BUILDING, 362 SHA TSUI ROAD, TSUEN WAN, NEW TERRITORIES, HONG KONG",,
TC002216,EMINENT ACCOUNTING & SECRETARIAL SERVICES LIMITED,威名會計秘書事務有限公司,"9/F, WORKSHOP 2, FUN TOWER, 35 HUNG TO ROAD, KWUN TONG, KOWLOON, HONG KONG",,
TC002219,ZHONG LUN CORPORATE SERVICES LIMITED,中倫企業服務有限公司,"FLAT/RM 402, JARDINE HOUSE, 1 CONNAUGHT PLACE, CENTRAL, HONG KONG",,
TC002222,GREEN STORAGE & BUSINESS CENTRE LIMITED,綠色迷你倉商務中心有限公司,"8/F, EXCELSIOR BUILDING, 68-76 SHA TSUI ROAD, TSUEN WAN, NEW TERRITORIES, HONG KONG",,
TC002223,VAST ELITE CONSULTANTS LIMITED,卓茂顧問有限公司,"ROOM 3, 8/F, YUE XIU BUILDING, 160-174 LOCKHART ROAD, WAN CHAI, HONG KONG",,
TC002224,EASYWIN CONSULTANTS LIMITED,凱怡顧問有限公司,"ROOMS C&D, 18/F, ALLIANCE BUILDING, 130 CONNAUGHT ROAD CENTRAL, SHEUNG WAN, HONG KONG",,
TC002225,INDAH INT'L ADVISORY LIMITED,英達國際咨詢有限公司,"UNIT 1201, 12/F, PROSPERITY CENTRE, 982 CANTON ROAD, MONG KOK, KOWLOON, HONG KONG",,
TC002226,CROWN BUSINESS CENTRE LIMITED,皇冠商務中心有限公司,"5/F, KOWLOON CENTRE, 29-39 ASHLEY ROAD, TSIM SHA TSUI, KOWLOON, HONG KONG",,
TC002227,SINO RESOURCE BUSINESS SERVICE LIMITED,中港企業服務有限公司,"FLAT/RM 1401, 14/F, CHINA INSURANCE GROUP BUILDING, 141 DES VOEUX ROAD CENTRAL, CENTRAL, HONG KONG",,
TC002229,KNG PARTNERS LIMITED,,"UNIT 605, 6/F, STAG BUILDING, 148 QUEEN'S ROAD CENTRAL, CENTRAL, HONG KONG",,
TC002230,TCL CHINA LIMITED,,"ROOM 2005, 20/F, CRE CENTRE, 889 CHEUNG SHA WAN ROAD, LAI CHI KOK, KOWLOON, HONG KONG",,
TC002231,INTELLIGENT PROFESSIONAL SERVICES LIMITED,卓勤專業服務有限公司,"SUITE 32, 10/F, LEE KING INDUSTRIAL BUILDING, 12 NG FONG STREET, SAN PO KONG, KOWLOON, HONG KONG",,
TC002232,HUNDA CONSULTANTS LIMITED,燊達顧問有限公司,"SUITE 1205, 12/F, TOWER 2, SILVERCORD, 30 CANTON ROAD, TSIM SHA TSUI, KOWLOON, HONG KONG",,
TC002233,WIN WORLD SECRETARY SERVICE LIMITED,永匯秘書服務有限公司,"ROOM 2207, 22/F, KING PALACE PLAZA, 52A SHA TSUI ROAD, TSUEN WAN, NEW TERRITORIES, HONG KONG",,
TC002234,TC FIDUCIARY LIMITED,,"SUITE 126, 12/F, SOMPTUEUX CENTRAL, 52-54 WELLINGTON STREET, CENTRAL, HONG KONG",,
TC002235,LORAL (SERVICES) LIMITED,樂惠秘書有限公司,"FLAT/RM C, 26/F, BILLION PLAZA 2, 10 CHEUNG YUE STREET, CHEUNG SHA WAN, KOWLOON, HONG KONG",,
TC002236,LINKS CONSULTANCY SERVICES LIMITED,聯信顧問服務有限公司,"ROOM 902, 9/F, VALLEY CENTRE, 80-82 MORRISION HILL ROAD, WAN CHAI, HONG KONG",,
TC002237,APEX START LIMITED,創業商務有限公司,"UNIT D, 4/F, CENTURY CENTRE, 33-35 AU PUI WAN STREET, FO TAN, NEW TERRITORIES, HONG KONG",,
TC002238,CANWAYSTAR (NOMINEES) LIMITED,,"UNIT 608, 6/F, WING ON HOUSE, 71 DES VOEUX ROAD CENTRAL, CENTRAL, HONG KONG",,
TC002240,HONIA LIMITED,康利雅有限公司,"5/F, HO LEE COMMERCIAL BUILDING, 38-44 D'AGUILAR STREET, CENTRAL, HONG KONG",,
TC002242,ANG CONSULTING LIMITED,,"18/F, S B COMMERCIAL BUILDING, 478 NATHAN ROAD, MONG KOK, KOWLOON, HONG KONG",,
TC002243,HOLDING-FUNDS LIMITED,喜匯有限公司,"ROOMS 02-3, 21/F, CHINA INSURANCE GROUP BUILDING, 141 DES VOEUX ROAD CENTRAL, HONG KONG",,
TC002244,KENSHORE LIMITED,兼盛有限公司,"ROOMS 02-3, 21/F, CHINA INSURANCE GROUP BUILDING, 141 DES VOEUX ROAD CENTRAL, HONG KONG",,
TC002246,GAIN RICH MANAGEMENT LIMITED,德力管理有限公司,"UNIT 7, 7/F, CORE 45, 43-45 TSUN YIP STREET, KWUN TONG, KOWLOON, HONG KONG",,
TC002247,ABACUS ACCOUNTING SERVICE COMPANY LIMITED,雅勤會計稅務顧問有限公司,"ROOM 909, 9/F, TREND CENTRE, 29-31 CHEUNG LEE STREET, CHAI WAN, HONG KONG",,
TC002248,WONDERFUL ACCOUNTING & CONSULTANCY SERVICES LIMITED,搵得到會計顧問服務有限公司,"FLAT A, 14/F, YIP WAN FACTORY BUILDING, 10 TSUN YIP LANE, KWUN TONG, KOWLOON, HONG KONG",,
TC002249,LOYAL CONSULTANT COMPANY LIMITED,敦忠諮詢有限公司,"ROOM 08, 10/F, NEW TREND CENTRE, 704 PRINCE EDWARD ROAD EAST, SAN PO KONG, KOWLOON, HONG KONG",,
TC002251,GROWTHLINK SERVICES LIMITED,,"18/F, GOLDEN STAR BUILDING, 20-24 LOCKHART ROAD, WAN CHAI, HONG KONG",,
TC002252,EVERSHINE SECRETARIES LIMITED,耀信秘書有限公司,"UNIT 608, 6/F, WING ON HOUSE, 71 DES VOEUX ROAD CENTRAL, CENTRAL, HONG KONG",,
TC002253,SMARTPRO ACCOUNTING SERVICES LIMITED,智明會計服務有限公司,"FLAT/RM 1202, 12/F, 299 QRC, 287-299 QUEEN'S ROAD CENTRAL, SHEUNG WAN, HONG KONG",,
TC002254,KEP SECRETARIAL SERVICES LIMITED,,"17/F, GLOUCESTER TOWER, THE LANDMARK, 11 PEDDER STREET, CENTRAL, HONG KONG",,
TC002255,SL CONSULTANT COMPANY LIMITED,思量顧問有限公司,"UNIT 713, 7/F, ASIA TRADE CENTRE, 79 LEI MUK ROAD, KWAI CHUNG, NEW TERRITORIES, HONG KONG",,
TC002256,TRUTHFUL (NOMINEES) LIMITED,,"17/F, GLOUCESTER TOWER, THE LANDMARK, 11 PEDDER STREET, CENTRAL, HONG KONG",,
TC002257,KLY (NOMINEES) LIMITED,,"17/F, GLOUCESTER TOWER, THE LANDMARK, 11 PEDDER STREET, CENTRAL, HONG KONG",,
TC002258,VC CORPORATE SERVICES LIMITED,滙盈秘書服務有限公司,"7/F, CENTRE POINT, 181-185 GLOUCESTER ROAD, WAN CHAI, HONG KONG",,
TC002260,DBL SHAREHOLDER ONE LIMITED,,"18/F, SIU YING COMMERCIAL BUILDING, 153 QUEEN'S ROAD, CENTRAL, HONG KONG",,
TC002262,ASPEN CORPORATE SERVICES LIMITED,,"FLAT/RM 2103, 21/F, LANDMARK SOUTH, 39 YIP KAN STREET, WONG CHUK HANG, HONG KONG",,
TC002263,CENTURY FAITH CONSULTANTS (ASIA) LIMITED,暉誼顧問(亞洲)有限公司,"UNIT 1105, 11/F, TOWER 2, CHEUNG SHA WAN PLAZA, 833 CHEUNG SHA WAN ROAD, CHEUNG SHA WAN, KOWLOON, HONG KONG",,
TC002264,GOLAW (NOMINEES) LIMITED,,"ROOM 303, 3/F, ST. GEORGE'S BUILDING, 2 ICE HOUSE STREET, CENTRAL, HONG KONG",,
TC002265,CHINA TURBO LIMITED,,"FLAT/ROOM A, 25/F, UNITED CENTRE, 95 QUEENSWAY, ADMIRALTY, HONG KONG",,
TC002266,MISSISSAUGA LIMITED,,"ROOM 303, 3/F, ST. GEORGE'S BUILDING, 2 ICE HOUSE STREET, CENTRAL, HONG KONG",,
TC002267,GINSEC SERVICES LIMITED,晉昇服務有限公司,"FLAT/RM 9, 18/F, PROSPER COMMERCIAL BUILDING, 9 YIN CHONG STREET, MONG KOK, KOWLOON, HONG KONG",,
TC002268,HEFFER MANAGEMENT SERVICES LIMITED,康發商業管理有限公司,"FLAT/RM 804, 8/F, EASTERN COMMERCIAL CENTRE, 397 HENNESSY ROAD, WAN CHAI, HONG KONG",,
TC002269,SNAP SERVICES (H.K.) LIMITED,,"ROOM 303, 3/F, ST. GEORGE'S BUILDING, 2 ICE HOUSE STREET, CENTRAL, HONG KONG",,
TC002271,DC FIDUCIARY SERVICES LIMITED,,"UNIT 603, LOW BLOCK OF GRAND MILLENNIUM PLAZA, 181 QUEEN'S ROAD CENTRAL, HONG KONG",,
TC002272,WP CONSULTANTS LIMITED,鈞略顧問有限公司,"FLAT/RM B, 17/F, DAN6, 6 FUI YIU KOK STREET, TSUEN WAN, NEW TERRITORIES, HONG KONG",,
TC002273,ALBATROSS SECRETARIES LIMITED,,"UNIT 402, 4/F, JARDINE HOUSE, 1 CONNAUGHT PLACE, CENTRAL, HONG KONG",,
TC002274,NEOTECH CONSULTANCY LIMITED,利德顧問有限公司,"UNIT 1225, 12/F, METRO CENTRE I, 32 LAM HING STREET, KOWLOON BAY, KOWLOON, HONG KONG",,
TC002275,RISING FAIR CONSULTANTS LIMITED,聯昇顧問有限公司,"ROOM 1105-12, 11/F, NAN FUNG TOWER, 88 CONNAUGHT ROAD CENTRAL AND 173 DES VOEUX ROAD CENTRAL, HONG KONG",,
TC002276,VANCOUVER CONSULTING GROUP LIMITED,,"FLAT B, 6/F, WAH KIT COMMERCIAL CENTRE, 300 DES VOEUX ROAD CENTRAL, HONG KONG",,
TC002278,CCB (ASIA) TRUSTEE COMPANY LIMITED,建行亞洲信託有限公司,"G/F, 6 DES VOEUX ROAD CENTRAL, CENTRAL, HONG KONG",The licensee is a trust company registered under section 78(1) of the Trustee Ordinance (Cap. 29),持牌人屬根據《受託人條例》(第29章) 第78(1)條註冊的信託公司
TC002280,LASC LIMITED,萊雅氏有限公司,"SUITE A1, 9/F, ONE CAPITAL PLACE, 18 LUARD ROAD, WAN CHAI, HONG KONG",,
TC002282,"ORIENTAL ACCOUNTING & CONSULTANT CO., LIMITED",東方會計及顧問有限公司,"ROOM 15, 6/F, INTERNATIONAL TRADE CENTRE, 11 SHA TSUI ROAD, NEW TERRITORIES, HONG KONG",,
TC002284,AMAZING GRACE MANAGEMENT LIMITED,奇異恩典有限公司,"FLAT/RM 1527, 15/F, TUEN MUN CENTRAL SQUARE, 22 HOI WING ROAD, TUEN MUN, NEW TERRITORIES, HONG KONG",,
TC002285,JOIN SUCCESS CONSULTANTS LIMITED,駿卓顧問有限公司,"UNIT C, 7/F, NATHAN COMMERCIAL BUILDING, 430-436 NATHAN ROAD, KOWLOON, HONG KONG",,
TC002286,JOHNSON MANAGEMENT LIMITED,當信管理有限公司,"FLAT/RM 1527, 15/F, TUEN MUN CENTRAL SQUARE, 22 HOI WING ROAD, TUEN MUN, NEW TERRITORIES, HONG KONG",,
TC002287,TBH SECRETARIES LIMITED,,"3802-06, 38/F, ONE TAIKOO PLACE, 979 KING'S ROAD, QUARRY BAY, HONG KONG",,
TC002288,TBH NOMINEES NO. 1 LIMITED,,"3802-06, 38/F, ONE TAIKOO PLACE, 979 KING'S ROAD, QUARRY BAY, HONG KONG",,
TC002289,A & K NOMINEE COMPANY LIMITED,,"FLAT/RM 1801-05, 18/F, HUA QIN INTERNATIONAL BUILDING, 340 QUEEN'S ROAD CENTRAL, HONG KONG",,
TC002290,TBH NOMINEES NO. 2 LIMITED,,"3802-06, 38/F, ONE TAIKOO PLACE, 979 KING'S ROAD, QUARRY BAY, HONG KONG",,
TC002292,BOSCO NOMINEES LIMITED,,"FLAT/ROOM 1201, 12/F, WAH YUEN BUILDING, 149 QUEEN'S ROAD CENTRAL, CENTRAL, HONG KONG",,
TC002293,CO-VALUES LIMITED,企業本析有限公司,"UNIT 11, 29/F, GLOBAL GATEWAY TOWER, 63 WING HONG STREET, CHEUNG SHA WAN, KOWLOON, HONG KONG",,
TC002294,ANT CONSULTING COMPANY LIMITED,安博咨詢有限公司,"UNIT C, 8/F, ETON BUILDING, 288 DES VOEUX ROAD CENTRAL, SHEUNG WAN, HONG KONG",,
TC002295,CJ GROUP CORPORATE SERVICES LIMITED,卓智集團服務有限公司,"2/F, SHUI YEE FACTORY BUILDING, 15 ASH STREET, TAI KOK TSUI, KOWLOON, HONG KONG",,
TC002296,ABA CORPORATE SERVICES LIMITED,安柏企業服務有限公司,"UNIT C, 8/F, ETON BUILDING, 288 DES VOEUX ROAD CENTRAL, SHEUNG WAN, HONG KONG",,
TC002297,LAM KAM FUNG trading as W & N ACCOUNTING COMPANY,林金鳳 經營 宏毅會計公司,"FLAT/ROOM 53, 11/F, WANG FAI INDUSTRIAL BUILDING, 29 LUK HOP STREET, SAN PO KONG, KOWLOON, HONG KONG",,
TC002298,LINK BUSINESS CENTRE LIMITED,領達商務中心有限公司,"FLAT/ROOM 10-15, 10/F, BLOCK B, NEW MANDARIN PLAZA, 14 SCIENCE MUSEUM ROAD, TSIM SHA TSUI EAST, KOWLOON, HONG KONG",,
TC002299,VCS CORPORATE SERVICES LIMITED,滙智營商顧問有限公司,"14/F, KAM FUNG COMMERCIAL BUILDING, NOS. 2-4 TIN LOK LANE, WAN CHAI, HONG KONG",,
TC002300,GENERAL SECRETARIES LIMITED,,"FLAT/RM 03, 27/F, UNIVERSAL TRADE CENTRE, 3 -5 ARBUTHNOT ROAD, CENTRAL, HONG KONG",,
TC002301,BACKER (ACC) BUSINESS CONSULTANCY LIMITED,盛怡商務顧問有限公司,"FLAT C, 11/F, CNT TOWER, 338 HENNESSY ROAD, WAN CHAI, HONG KONG",,
TC002304,FERLIN CONSULTING SERVICES LIMITED,萊富顧問服務有限公司,"FLAT/RM 501, 5/F, UNION PARK TOWER, 168 ELECTRIC ROAD, NORTH POINT, HONG KONG",,
TC002305,LOUIS LAI & LUK CORPORATE SERVICES LIMITED,黎劍民、陸永熙企業服務有限公司,"9/F, SURSON COMMERCIAL BUILDING, 140-142 AUSTIN ROAD, TSIM SHA TSUI, KOWLOON, HONG KONG",,
TC002306,WORLDWIDE ACCOUNTING & TAXATION SERVICES LIMITED,環球會計及稅務有限公司,"FLAT/RM 22, 2/F, CASEY BUILDING, 38 LOK KU ROAD, SHEUNG WAN, HONG KONG",,
TC002308,TOP CORPORATE SERVICES LIMITED,卓越企業服務有限公司,"ROOM 1802, 18/F, SUNBEAM COMMERCIAL BUILDING, 469-471 NATHAN ROAD, YAU MA TEI, KOWLOON, HONG KONG",,
TC002309,AVANTGARDE REGISTRATIONS LIMITED,先鋒註冊有限公司,"ROOM 1301, 13/F, TOWER A, NEW MANDARIN PLAZA, 14 SCIENCE MUSEUM ROAD, TSIM SHA TSUI, KOWLOON, HONG KONG",,
TC002310,ANAGRAM CONSULTANCY LIMITED,安納邦諮詢有限公司,"FLAT D, 4/F, 11 NASSAU STREET, MEI FOO SUN CHUEN, KOWLOON, HONG KONG",,
TC002311,GLOBAL ASSOCIATES LIMITED,,"FLAT/ROOM 1211, 12/F, TREND CENTRE, 29-31 CHEUNG LEE STREET, CHAI WAN, HONG KONG",,
TC002312,BRIDGE CONSULTANTS LIMITED,本橋顧問有限公司,"UNIT D, 20/F, TOWER A, CAPITAL TOWER, 38 WAI YIP STREET, KOWLOON BAY, KOWLOON, HONG KONG",,
TC002313,MERIDIAN PARTNERS LIMITED,,"LEVEL 43, CHAMPION TOWER, 3 GARDEN ROAD, CENTRAL, HONG KONG",,
TC002315,HONGFULL BUSINESS SERVICES LIMITED,康富商業服務有限公司,"ROOM 2002, 20/F, ON HONG COMMERCIAL BUILDING, 145 HENNESSY ROAD, WAN CHAI, HONG KONG",,
TC002316,SKY FORTUNE SECRETARIAL SERVICES LIMITED,天順秘書服務有限公司,"23/F, TOWER 2, ADMIRALTY CENTRE, 18 HARCOURT ROAD, HONG KONG",,
TC002317,MILAGE SERVICES COMPANY LIMITED,萬利泉服務有限公司,"UNIT 1101, 11/F, KING CENTRE, 23-29 DUNDAS STREET, MONG KOK, KOWLOON, HONG KONG",,
TC002318,LEUNG PING WAI DENNIS trading as DENNIS LEUNG & CO,梁炳偉 經營 DENNIS LEUNG & CO,"FLAT/RM F, 52/F, BLOCK 5, MANHATTAN HILL, 1 PO LUN STREET, LAI CHI KOK, KOWLOON, HONG KONG",,
TC002319,PROSEC LIMITED,,"FLAT/RM B, 18/F, WINSAN TOWER, 98 THOMSON ROAD, WAN CHAI, HONG KONG",,
TC002320,POPULAR PROFICIENT SERVICE LIMITED,大眾專業商務有限公司,"UNIT B, 18/F, WINSAN TOWER, 98 THOMSON ROAD, WAN CHAI, HONG KONG",,
TC002322,SKY FORT DEVELOPMENT LIMITED,天堡發展有限公司,"ROOM A, 6/F, SHING HING COMMERCIAL BUILDING, 21-27 WING KUT ROAD, CENTRAL, HONG KONG",,
TC002324,STATE STREET TRUST (HK) LIMITED,,"68TH FLOOR, BLOCK TWO, INTERNATIONAL FINANCE CENTRE, 8 FINANCE STREET, CENTRAL, HONG KONG",The licensee is a trust company registered under section 78(1) of the Trustee Ordinance (Cap. 29),持牌人屬根據《受託人條例》(第29章) 第78(1)條註冊的信託公司
TC002325,EASTYOUTH SECRETARIAL SERVICES LIMITED,東青秘書服務有限公司,"ROOM 1505-6, 15/F, STRAND 50, 50 BONHAM STRAND, SHEUNG WAN, HONG KONG",,
TC002326,EASTYOUTH MANAGEMENT LIMITED,東青管理有限公司,"ROOM 1505-6, 15/F, STRAND 50, 50 BONHAM STRAND, SHEUNG WAN, HONG KONG",,
TC002327,ASIAN SPIRIT (NOMINEES) LIMITED,,"FLAT/RM B, 13/F, PRAT COMMERCIAL BUILDING, 17-19 PRAT AVENUE, TSIM SHA TSUI, KOWLOON, HONG KONG",,
TC002329,TEAM BEST LIMITED,民通有限公司,"FLAT/RM 105, 1/F, FOOK TIN BUILDING, 38 WAI CHI STREET, KOWLOON, HONG KONG",,
TC002330,PRO CONSULTANCY NOMINEES LIMITED,專業顧問服務代理人有限公司,"UNIT 03-06, 16/F, ALLIANCE BUILDING, 130-136 CONNAUGHT ROAD CENTRAL, SHEUNG WAN, HONG KONG",,
TC002331,GLOBAL PROFESSIONAL CONSULTANTS LIMITED,高寶專業顧問有限公司,"FLAT/RM 508, 5/F, NEW TREND CENTRE, 704 PRINCE EDWARD ROAD, SAN PO KONG, KOWLOON, HONG KONG",,
TC002332,PRO SECRETARIAL SERVICES LIMITED,專業秘書服務有限公司,"FLAT/ROOM 03-06, 16/F, ALLIANCE BUILDING, 130-136 CONNAUGHT ROAD CENTRAL, SHEUNG WAN, HONG KONG",,
TC002333,VERSATILE CORPORATE SERVICES LIMITED,,"ROOM/FLAT 07, 16/F, DOMINION CENTRE, 43 QUEEN'S ROAD EAST, WAN CHAI, HONG KONG",,
TC002334,RINGOBAKO CO. LIMITED,蘋果箱有限公司,"FLAT/RM 03, 12/F, HUNDSUN INTERNATIONAL CENTER, 44 HEUNG YIP ROAD, WONG CHUK HANG, HONG KONG",,
TC002335,ECOVIS SECRETARIES (H.K.) LIMITED,君豐秘書有限公司,"ROOM 1905, 19/F, WEST TOWER, SHUN TAK CENTRE, 168-200 CONNAUGHT ROAD CENTRAL, SHEUNG WAN, HONG KONG",,
TC002336,DEVELOPMENT PRINCIPLES (HONG KONG) LIMITED,滙發中國基金管理(香港)有限公司,"ROOM 804, 8/F, FAR EAST CONSORTIUM BUILDING, 121 DES VOEUX ROAD CENTRAL, CENTRAL, HONG KONG",,
TC002342,WELL PACIFIC MANAGEMENT LIMITED,偉和管理有限公司,"ROOM 2810, 28/F, ASIA TRADE CENTRE, 79 LEI MUK ROAD, KWAI CHUNG, NEW TERRITORIES, HONG KONG",,
TC002344,ONFIELD CONSULTANTS LIMITED,安輝顧問有限公司,"ROOM 1405, 14/F, WING TUCK COMMERCIAL CENTRE, 177-183 WING LOK ROAD, SHEUNG WAN, HONG KONG",,
TC002345,YUNG WAI LAN trading as CORPORATE ACCOUNTING SERVICES CO,容惠蘭 經營 高卓會計服務公司,"7/F, BLISSFUL BUILDING, 243-247 DES VOEUX ROAD CENTRAL, SHEUNG WAN, HONG KONG",,
TC002346,CHAMPWAY CORPORATE SERVICES LIMITED,卓慧商業服務有限公司,"FLAT/RM 3, 17/F, STERLING CENTRE, 11 CHEUNG YUE STREET, CHEUNG SHA WAN, KOWLOON, HONG KONG",,
TC002348,BANK OF CHINA (HONG KONG) TRUSTEES LIMITED,中國銀行(香港)信託有限公司,"21 & 22/F, BANK OF CHINA CENTRE, 11 HOI FAI ROAD, KOWLOON, HONG KONG",The licensee is a trust company registered under section 78(1) of the Trustee Ordinance (Cap. 29),持牌人屬根據《受託人條例》(第29章) 第78(1)條註冊的信託公司
TC002349,TAGENT CORPORATE SERVICES LIMITED,騰駿秘書有限公司,"ROOM 1507, 15/F, EMPEROR GROUP CENTRE, 288 HENNESSY ROAD, WAN CHAI, HONG KONG",,
TC002350,FIDINAM (HONG KONG) LIMITED,富德林(香港)有限公司,"ROOM 1501, 15/F, PROSPERITY TOWER, 39 QUEEN'S ROAD CENTRAL, HONG KONG",,
TC002351,SHARLES SECRETARY LIMITED,,"FLAT/RM 1904, 19/F, KAI TAK COMMERCIAL BUILDING, 161 CONNAUGHT ROAD CENTRAL, HONG KONG",,
TC002352,TY ENTERPRISES (HK) LIMITED,楊氏企業(香港)有限公司,"FLAT/ROOM 406, 4/F, DOMINION CENTRE, 43-59 QUEEN'S ROAD EAST, WANCHAI, HONG KONG",,
TC002353,PRIMEFORD SECRETARIAL SERVICES LIMITED,準誠秘書服務有限公司,"9/F, FORTUNE HOUSE, 61 CONNAUGHT ROAD CENTRAL, CENTRAL, HONG KONG",,
TC002354,TY CORPORATE SERVICES LIMITED,楊氏企業服務有限公司,"ROOM 406, 4/F, DOMINION CENTRE, 43-59 QUEEN’S ROAD EAST, WAN CHAI, HONG KONG",,
TC002355,ORIENTAL PEARL CORPORATE SERVICE LIMITED,東方明珠企業服務有限公司,"UNIT 3709, 37/F, TOWER 2, LIPPO CENTRE, 89 QUEENSWAY, ADMIRALTY, HONG KONG",,
TC002356,IQS NOMINEE LIMITED,芷群有限公司,"ROOM 2318, 23/F, LEIGHTON CENTRE, 77 LEIGHTON ROAD, CAUSEWAY BAY, HONG KONG",,
TC002357,GALAXY COMPANY SECRETARIES LIMITED,星睿企業秘書有限公司,"37/F, ONE TAIKOO PLACE, TAIKOO PLACE, 979 KING'S ROAD, QUARRY BAY, HONG KONG",,
TC002358,TRUSEC (H.K.) LIMITED,,"4603-4609, 46/F, JARDINE HOUSE, ONE CONNAUGHT PLACE, CENTRAL, HONG KONG",,
TC002359,FEDERAL SECRETARIAL SERVICES LIMITED,公眾秘書服務社有限公司,"ROOM 604, 6/F, EMPEROR GROUP CENTRE, 288 HENNESSY ROAD, WAN CHAI, HONG KONG",,
TC002360,ACCELERATE SERVICES COMPANY LIMITED,展達服務有限公司,"SUITE 603, 6/F, LAWS COMMERCIAL PLAZA, 788 CHEUNG SHA WAN ROAD, LAI CHI KOK, KOWLOON, HONG KONG",,
TC002361,S. S. LAU SECRETARIAL SERVICES LIMITED,劉善生秘書有限公司,"FLAT/RM 1201, 12/F, SHANGHAI INDUSTRIAL INVESTMENT BUILDING, 48-62 HENNESSY ROAD, WAN CHAI, HONG KONG",,
TC002362,CHL CONSULTING LIMITED,弘遠諮詢有限公司,"UNIT 3102, 31/F, 99 HENNESSY ROAD, WAN CHAI, HONG KONG",,
TC002363,FULL MILL COMPANY LIMITED,富苗有限公司,"UNIT B3, 3/F, TAI TAK INDUSTRIAL BUILDING, 2-12 KWAI FAT ROAD, KWAI CHUNG, NEW TERRITORIES, HONG KONG",,
TC002364,BOSCO SECRETARIES LIMITED,,"FLAT/RM 1201, 12/F, WAH YUEN BUILDING, 149 QUEEN’S ROAD CENTRAL, HONG KONG",,
TC002365,SIT LAK PUN EDMUND trading as GENESIS CONSULTANT COMPANY,薛立品 經營 創慧顧問咨詢公司,"FLAT 1804, 18/F. BLOCK J, LUK YEUNG SUN CHUEN, 22-66 WAI TSUEN ROAD, TSUEN WAN, NEW TERRITORIES, HONG KONG",,
TC002366,FAS (NOMINEES) LIMITED,,"ROOM 902, WILSON HOUSE, 19-27 WYNDHAM STREET, CENTRAL, HONG KONG",,
TC002367,ANSON SECRETARIES LIMITED,恒誠秘書有限公司,"UNIT NO.11, 11/F, WAYSON COMMERCIAL BUILDING, 28 CONNAUGHT ROAD WEST, SHEUNG WAN, HONG KONG",,
TC002368,LOYALTY SECRETARIAL LIMITED,誠迅秘書有限公司,"FLAT/ROOM 10, 10/F, METRO CENTRE, 32 LAM HING STREET, KOWLOON BAY, KOWLOON, HONG KONG",,
TC002369,BONWISE FINANCIAL SERVICES LIMITED,,"FLAT/ROOM 2110, 21/F, WITTY COMMERCIAL BUILDING, 1A-1L TUNG CHOI STREET, MONG KOK, KOWLOON, HONG KONG",,
TC002370,HUNG YAT PANG trading as BEST OPTION ACCOUNTING AND CONSULTANT COMPANY,洪逸鵬 經營 上雋會計顧問公司,"FLAT 07, 12/F, PRINCESS MANSION, 165-175 KING'S ROAD, NORTH POINT, HONG KONG",,
TC002371,FAMCO LIMITED,明達有限公司,"FLAT/RM 1031, 10/F, OCEAN CENTRE, HARBOUR CITY,5 CANTONROAD, TSIMSHATSUI, KOWLOON, HONG KONG",,
TC002373,CORPORATE ACCOUNTS CONSULTANCY LIMITED,快達會計有限公司,"FLAT/ROOM 7, 7/F, KING'S COMMERCIAL BUILDING, 2-4 CHATHAM COURT, TSIM SHA TSUI, KOWLOON, HONG KONG",,
TC002375,GLOBAL BUSINESS (ASIA) LIMITED,環球商務(亞洲)有限公司,"ROOM A, 21/F, GAYLORD COMMERCIAL BUILDING, 114-118 LOCKHART ROAD, WAN CHAI, HONG KONG",,
TC002377,FESTIVAL CONCEPTS CORPORATE SERVICES LIMITED,名睿企業服務有限公司,"FLAT/RM 702, 7/F, KOWLOON BUILDING, 555 NATHAN ROAD, MONG KOK, KOWLOON, HONG KONG",,
TC002378,MB CONSULTANTS (HK) LIMITED,宏圖顧問(香港)有限公司,"FLAT/RM 701, 7/F, LUCKY CENTRE, 165-171 WANCHAI ROAD, WAN CHAI, HONG KONG",,
