Name of Licensee (English),Name of Licensee (Chinese),Branch Name (English),Branch Name (Chinese),Address (English only),Address Type (English),Address Type (Chinese),As at (Date)
247 PAY LIMITED,,,,"ROOM 1845, 15/F, RADIO CITY, 505-511 HENNESSY ROAD, CAUSEWAY BAY, HONG KONG",Specified Premises,指明處所,13/09/2021
3 SING INTERNATIONAL LIMITED,三昇聯匯有限公司,3 SING CURRENCY EXCHANGE,三昇聯匯,"SHOP 175, 1/F, KINGS WING PLAZA 1, 3 ON KWAN ST, SHEK MUN, SHA TIN, NEW TERRITORIES",Specified Premises,指明處所,13/09/2021
3 SING INTERNATIONAL LIMITED,三昇聯匯有限公司,3 SING CURRENCY EXCHANGE,三昇聯匯,"SHOP A, G/F, 29A-29B NGA TSIN WAI ROAD, KOWLOON CITY, KOWLOON",Specified Premises,指明處所,13/09/2021
3 SING INTERNATIONAL LIMITED,三昇聯匯有限公司,3 SING CURRENCY EXCHANGE,三昇聯匯,"SHOP 5, LEVEL 1, JADE PLAZA, 3 ON CHEE ROAD, TAI PO, NEW TERRITORIES",Specified Premises,指明處所,13/09/2021
99BILL INTERNATIONAL FINANCIAL SERVICES COMPANY LIMITED,快錢國際金融服務有限公司,,,"UNIT 1102-03, 11/F, 9 QUEEN'S ROAD CENTRAL, CENTRAL, HONG KONG",Correspondence Address,通訊地址,13/09/2021
A STAR ASIA COMPANY LIMITED,其星亞洲有限公司,,,"SHOP 10, G/F, YIP CHEONG BLDG, 4-16 HILL RD, SAI YING PUN, HONG KONG",Specified Premises,指明處所,13/09/2021
ABLE LEADERS LIMITED TRADING AS DOR FORTUNE,聯駿匯有限公司 營業名稱 多福,DOR FORTUNE,多福,"WORKSHOP 2, G/F, CROWN INDUSTRIAL BUILDING, 106 HOW MING STREET, KWUN TONG, KOWLOON",Specified Premises,指明處所,13/09/2021
ABLE LEADERS LIMITED TRADING AS DOR FORTUNE,聯駿匯有限公司 營業名稱 多福,DOR FORTUNE,多福,"UNIT 6, G/F, W668, 676 CASTLE PEAK ROAD, LAI CHI KOK, KOWLOON",Specified Premises,指明處所,13/09/2021
"ABUSALIH, ABDUL RASHEED TRADING AS REAL FOREX & REMITTANCES",,,,"SHOP 88A, G/F, CHUNGKING MANSION, 36-44 NATHAN ROAD, TSIM SHA TSUI, KOWLOON",Specified Premises,指明處所,13/09/2021
ACU MONEY CHANGER LIMITED,,,,"ROOM 1, G/F, ACU TOWER, 88 BONHAM STRAND, SHEUNG WAN, HONG KONG",Specified Premises,指明處所,13/09/2021
ADYEN HONG KONG LIMITED,,,,"7102, 7/F, YF LIFE TOWER, 33 LOCKHART ROAD, WAN CHAI, HONG KONG",Correspondence Address,通訊地址,13/09/2021
AERAPAY LIMITED,,,,"ROOM C, 30/F, MORRISON PLAZA, 5-9A MORRISON HILL ROAD, WAN CHAI, HONG KONG",Correspondence Address,通訊地址,13/09/2021
AILINGUAL LIMITED,艾靈谷有限公司,,,"UNIT 32 OF WORKSHOP NO 10, 1/F, HEWLETT CENTRE, 54 HOI YUEN ROAD, KWUN TONG, KOWLOON",Correspondence Address,通訊地址,13/09/2021
AIRWALLEX (HONG KONG) LIMITED,,,,"ROOM 08-10, 63/F, ONE ISLAND EAST, 18 WESTLANDS ROAD, QUARRY BAY, HONG KONG",Correspondence Address,通訊地址,13/09/2021
ALI EXCHANGE LIMITED,阿里找換有限公司,,,"ROOM 1003, 10/F, KEYBOND COMMERCIAL BUILDING, 38 FERRY STREET, JORDAN, KOWLOON",Specified Premises,指明處所,13/09/2021
ALLCOM EXCHANGE (H.K.) LIMITED,,,,"SHOP 60, G/F, CHUNG KING MANSION, 36-44 NATHAN ROAD, TSIM SHA TSUI, KOWLOON",Specified Premises,指明處所,13/09/2021
ALLIANCE FOREX LIMITED,安心匯有限公司 營業名稱 安心匯兌換匯款,,安心匯兌換匯款,"SHOP 40 & 41, 1/F OF THE PODIUM, ADMIRALTY CENTRE, 18 HARCOURT ROAD, ADMIRALTY, HONG KONG",Specified Premises,指明處所,13/09/2021
ALLIED SMART CREATION LIMITED,滙駿創建有限公司,,,"SHOP A, G/F, TAI KONG BUILDING, 7-9 SAN TSOI STREET, SHEUNG SHUI, NEW TERRITORIES",Specified Premises,指明處所,13/09/2021
ALLIED SMART CREATION LIMITED,滙駿創建有限公司,ALLIED SMART CREATION LIMITED,滙駿創建有限公司,"SHOP 05, G/F, LEVEL 2, KWAI CHUNG PLAZA, 7-11 KWAI FOO ROAD, KWAI CHUNG, NEW TERRITORIES",Specified Premises,指明處所,13/09/2021
ALLINPAY FINANCIAL SERVICES LIMITED,通華金融服務有限公司,,,"FLAT J, 15/F, KING PALACE PLAZA, 55 KING YIP STREET, KWUN TONG, KOWLOON",Specified Premises,指明處所,13/09/2021
ALLPAY INTERNATIONAL LIMITED,,,,"ROOM 1119, 11/F, BLOCK B, MANNING INDUSTRIAL BUILDING, 116-118 HOW MING STREET, KWUN TONG, KOWLOON",Correspondence Address,通訊地址,13/09/2021
"ALLSCORE PAYMENT SERVICE (HONG KONG) CO., LIMITED",商銀信支付服務（香港）有限公司,,,"ROOM S9, 12/F, ORIENTAL CRYSTAL COMMERCIAL BUILDING, 46 LYNDHURST TERRACE, CENTRAL, HONG KONG",Specified Premises,指明處所,13/09/2021
ALOFT TECHNOLOGY COMPANY LIMITED,邏庫科技有限公司,,,"ROOM 507, 5/F, GREENFIELD TOWER CONCORDIA PLAZA, 1 SCIENCE MUSEUM ROAD, TSIM SHA TSUI, KOWLOON",Specified Premises,指明處所,13/09/2021
ALPCORP LIMITED,,ALPCORP LIMITED,,"UNIT 1227, 12/F, INFINITUS PLAZA, 199 DES VOEUX ROAD CENTRAL, SHEUNG WAN, HONG KONG",Specified Premises,指明處所,13/09/2021
ALPHA REMIT LIMITED,,,,"G/F, 45B JORDAN ROAD, YAU MA TEI, KOWLOON",Specified Premises,指明處所,13/09/2021
"AMERICAN EXPRESS INTERNATIONAL, INC.",美國運通國際股份有限公司,,,"18/F, 12 TAIKOO WAN ROAD, QUARRY BAY, HONG KONG",Correspondence Address,通訊地址,13/09/2021
ANGRA HK LIMITED,,,,"ROOM 25, 43/F, AIA TOWER, 183 ELECTRIC ROAD, NORTH POINT, HONG KONG",Correspondence Address,通訊地址,13/09/2021
APG WORLDWIDE LIMITED,智匯通香港有限公司,,,"SUITE 2335, UNIT A-E, 23/F, BILLION PLAZA 2, 10 CHEUNG YUE STREET, CHEUNG SHA WAN, KOWLOON",Correspondence Address,通訊地址,13/09/2021
APPLE SOUTH-EAST ASIA LIMITED,紅蘋果東南亞有限公司,,,"G/F & M/F, 17 KOWLOON CITY RD, TO KWA WAN, KOWLOON",Specified Premises,指明處所,13/09/2021
ARSHAD MAHMOOD TRADING AS ISLAND TOYS,艾卓文,,,"SHOP I, G/F, SEA VIEW BLDG, 1 NGAN WAN ROAD, MUI WO LANTAU ISLAND, NEW TERRITORIES",Specified Premises,指明處所,13/09/2021
ARUBA TRANSFER (HK) LIMITED,,,,"UNIT 403, 4/F, HANKOW CENTRE, 5-15 HANKOW ROAD, TSIM SHA TSUI, KOWLOON",Specified Premises,指明處所,13/09/2021
ASIA ONE FOREIGN EXCHANGE AND REMITTANCE LIMITED,亞滙找換匯款有限公司,,,"UNIT 906, 9/F, STAR HOUSE, 3 SALISBURY ROAD, TSIM SHA TSUI, KOWLOON",Specified Premises,指明處所,13/09/2021
ASIA TRANSPAY (HK) LIMITED,,,,"ROOM 1, 1/F, KAM FAI BUILDING, 128-132 YEE KUK STREET, SHAM SHUI PO, KOWLOON",Correspondence Address,通訊地址,13/09/2021
ASIA UNION FINANCIAL (HK) LIMITED,亞聯金融(香港)有限公司,ASIA UNION FINANCIAL (HK) LIMITED,亞聯金融(香港)有限公司,"SHOP 14, G/F, FORTUNE PLAZA, 4 ON CHEE ROAD, TAI PO, NEW TERRITORIES",Specified Premises,指明處所,13/09/2021
ASIABILL COMPANY LIMITED,,,,"FLAT 321, 3/F, 19W, 19 SCIENCE PARK WEST AVENUE, MA LIU SHUI, NEW TERRITORIES",Correspondence Address,通訊地址,13/09/2021
ASPAC REMITTANCE LIMITED,,TRANSFER POINT,滙點,"SHOP 4, LG/F, FORTUNE CENTRE, 44,46,48 YUN PING ROAD, CAUSEWAY BAY, HONG KONG",Specified Premises,指明處所,13/09/2021
AT SERVICES LIMITED,,,,"ROOM 14, 4/F, UNITS 401-403, CYBERPORT 1, 100 CYBERPORT ROAD, POK FU LAM, HONG KONG",Correspondence Address,通訊地址,13/09/2021
ATLANTIC PARTNERS ASIA PS LIMITED,,,,"UNIT 1927, 19/F, WEST EXCHANGE TOWER, 322 DES VOEUX ROAD CENTRAL, SHEUNG WAN, HONG KONG",Correspondence Address,通訊地址,13/09/2021
AURELIA LIMITED,,,,"UNIT 07 OF FLAT 225, 2/F, 8 WANG KWONG ROAD, KOWLOON BAY, KOWLOON",Correspondence Address,通訊地址,13/09/2021
AZIMO HONG KONG LIMITED,,,,"FLAT 2207-09 (ROOM 18), 22/F, TOWER 2, LIPPO CENTRE, 89 QUEENSWAY, ADMIRALTY, HONG KONG",Correspondence Address,通訊地址,13/09/2021
BACCARAT HK TRADING LIMITED,百樂滙香港貿易有限公司,,,"FLAT D, 18/F, SANG WOO BUILDING, 227-228 GLOUCESTER ROAD, WAN CHAI, HONG KONG",Specified Premises,指明處所,13/09/2021
BAI QIAN INTERNATIONAL LIMITED,佰錢國際有限公司,,,"ROOM 1220, 12/F, 133 WAI YIP STREET, KWUN TONG, KOWLOON",Specified Premises,指明處所,13/09/2021
BANCKA LIMITED,百家有限公司,,,"FLAT C, 18/F, SANG WOO BUILDING, 227-228 GLOUCESTER ROAD, WAN CHAI, HONG KONG",Specified Premises,指明處所,13/09/2021
BCA FINANCE LIMITED,中亞財務有限公司,,,"UNIT 4707, 47/F, THE CENTER, 99 QUEEN'S ROAD CENTRAL, CENTRAL, HONG KONG",Specified Premises,指明處所,13/09/2021
BCA FINANCE LIMITED,中亞財務有限公司,BCA FINANCE LIMITED,中亞財務有限公司,"UNIT A, 1/F, DRAGON RISE, 9-11 PENNINGTON STREET, CAUSEWAY BAY, HONG KONG",Specified Premises,指明處所,13/09/2021
BCA FINANCE LIMITED,中亞財務有限公司,BCA FINANCE LIMITED,中亞財務有限公司,"SHOP 136, LIK SANG PLAZA, NO.269 CASTLE PEAK ROAD, TSUEN WAN, NEW TERRITORIES",Specified Premises,指明處所,13/09/2021
BCA FINANCE LIMITED,中亞財務有限公司,BCA FINANCE LIMITED,中亞財務有限公司,"SHOP D21, 1/F, HOP YICK PLAZA, 23 TAI TONG ROAD, YUEN LONG, NEW TERRITORIES",Specified Premises,指明處所,13/09/2021
BDO REMIT LIMITED,,,,"SHOP 231, 232, 233, 234 & 237, 2/F, WORLDWIDE HOUSE, 19 DES VOEUX ROAD CENTRAL, CENTRAL, HONG KONG",Specified Premises,指明處所,13/09/2021
BEAUTIFUL WORLD LIMITED,樂有限公司,,,"UNIT 407, 4/F, TOWER B, NEW MANDARIN PLAZA, 14 SCIENCE MUSEUM ROAD, TSIM SHA TSUI, KOWLOON",Specified Premises,指明處所,13/09/2021
BEEPAY LIMITED,,,,"UNIT 1405A, 14/F, THE BELGIAN BANK BUILDING, 721-725 NATHAN ROAD, MONG KOK, KOWLOON",Correspondence Address,通訊地址,13/09/2021
BERLIN COMPANY EXCHANGE LIMITED,百年找換有限公司,,,"ROOM 1703, 17/F, THE CHINESE BANK BUILDING, 61-65 DES VOEUX ROAD, CENTRAL, HONG KONG",Specified Premises,指明處所,13/09/2021
BEST SUCCESS CORPORATION LIMITED TRADING AS METRO FOREIGN EXCHANGE,利成興業有限公司,METRO FOREIGN EXCHANGE,,"SHOP B1, G/F, 1 TAK HING ST, YAU MA TEI, KOWLOON",Specified Premises,指明處所,13/09/2021
BEST SUCCESS CORPORATION LIMITED TRADING AS METRO FOREIGN EXCHANGE,利成興業有限公司,METRO FOREIGN EXCHANGE,,"SHOP D2, G/F, 68-70 PARKES STREET, JORDAN, KOWLOON",Specified Premises,指明處所,13/09/2021
BEST SUCCESS CORPORATION LIMITED TRADING AS METRO FOREIGN EXCHANGE,利成興業有限公司,METRO FOREIGN EXCHANGE,,"SHOP 52C, G/F, GOLDEN BUILDING, 146-152 FUK WA STREET, SHAM SHUI PO, KOWLOON",Specified Premises,指明處所,13/09/2021
BEST SUN TRADING LIMITED,佳逸貿易有限公司,,,"ROOM B1, 18/F, CHAI WAN CENTRE INDUSTRIAL BUILDING, 20 LEE CHUNG STREET, CHAI WAN, HONG KONG",Specified Premises,指明處所,13/09/2021
BEST SUN TRADING LIMITED,佳逸貿易有限公司,BEST REMITTANCE,,"SHOP 77, G/F, LEE BO BUILDING, 3 TSING HO SQUARE, TUEN MUN, NEW TERRITORIES",Specified Premises,指明處所,13/09/2021
BEST SUN TRADING LIMITED,佳逸貿易有限公司,BEST REMITTANCE,,"SHOP D1, G/F, TREASURE COURT, 28 BELCHER'S STREET, KENNEDY TOWN, HONG KONG",Specified Premises,指明處所,13/09/2021
BEST SUN TRADING LIMITED,佳逸貿易有限公司,BEST REMITTANCE,,"SHOP 23, B/F, JUMBO BUILDING, 201 ABERDEEN MAIN ROAD, ABERDEEN, HONG KONG",Specified Premises,指明處所,13/09/2021
BEST SUN TRADING LIMITED,佳逸貿易有限公司,BEST REMITTANCE,,"SHOP SPACE NO. 72C, G/F, BLOCKS 7-14, CITY GARDEN, 233 ELECTRIC ROAD, NORTH POINT, HONG KONG",Specified Premises,指明處所,13/09/2021
BEST SUN TRADING LIMITED,佳逸貿易有限公司,BEST REMITTANCE,,"SHOP 53, G/F, LEVER BUILDING, 33 LARCH STREET, TAI KOK TSUI, KOWLOON",Specified Premises,指明處所,13/09/2021
BEST SUN TRADING LIMITED,佳逸貿易有限公司,BEST REMITTANCE,,"SHOP 11, 2/F, JADE PLAZA, 3 ON CHEE ROAD, TAI PO, NEW TERRITORIES",Specified Premises,指明處所,13/09/2021
BEST SUN TRADING LIMITED,佳逸貿易有限公司,BEST REMITTANCE,,"SHOP B21, 1/F, SAN PO KONG PLAZA, 33 SHUNG LING STREET, SAN PO KONG, KOWLOON",Specified Premises,指明處所,13/09/2021
BEST SUN TRADING LIMITED,佳逸貿易有限公司,BEST REMITTANCE,,"SHOP 4, G/F, SHIU KING BLDG, 179 NGAU TAU KOK ROAD, NGAU TAU KOK, KOWLOON",Specified Premises,指明處所,13/09/2021
BEST SUN TRADING LIMITED,佳逸貿易有限公司,BEST REMITTANCE,,"SHOP 37, LEVEL 2/F, SHEUNG SHUI TOWN CENTRE, 9 CHI CHEONG ROAD, SHEUNG SHUI, NEW TERRITORIES",Specified Premises,指明處所,13/09/2021
BEST SUN TRADING LIMITED,佳逸貿易有限公司,BEST REMITTANCE,,"SHOP 98, G/F, BLOCK A-E, WHAMPOA EST, 115-129 DOCK ST 1-25 MAN TAI ST AND 1-15 TAK MAN ST, HUNG HOM, KOWLOON",Specified Premises,指明處所,13/09/2021
BEST SUN TRADING LIMITED,佳逸貿易有限公司,BEST REMITTANCE,,"SHOP 59A, PODIUM/F, MEI FOO SUN CHUEN, 26-36, 33-39 & 40-50 BROADWAY 1-11, 2-4 & 15-21 GLEE PATH, LAI CHI KOK, KOWLOON",Specified Premises,指明處所,13/09/2021
BHF HONG KONG LIMITED,,BHF REMITTANCE,,"SHOP 328, 3/F, WORLD-WIDE PLAZA, 19 DES VOEUX ROAD CENTRAL, CENTRAL, HONG KONG",Specified Premises,指明處所,13/09/2021
BINDO LABS LIMITED,,,,"FLAT B1, 10/F, PRINCE INDUSTRIAL BUILDING, 706 PRINCE EDWARD ROAD EAST, SAN PO KONG, KOWLOON",Specified Premises,指明處所,13/09/2021
BMC FOREX LIMITED,,BMC,,"FLAT D7, 9/F, KA WING FACTORY BUILDING, 19-21 NG FONG STREET, SAN PO KONG, KOWLOON",Specified Premises,指明處所,13/09/2021
BMC FOREX LIMITED,,BMC FOREX 24.7,,"FLAT 1, G/F, KEYBOND COMMERCIAL BUILDING, 38 FERRY STREET, YAU MA TEI, KOWLOON",Specified Premises,指明處所,13/09/2021
BNI REMITTANCE LIMITED,,,,"SHOP 5, G/F, KESWICK COURT, 3 KESWICK STREET, CAUSEWAY BAY, HONG KONG",Specified Premises,指明處所,13/09/2021
BNI REMITTANCE LIMITED,,BNI REMITTANCE LIMITED,,"FLAT 209, 2/F, LIK SANG PLAZA, FOO YU BUILDING, 269 CASTLE PEAK ROAD, TSUEN WAN, NEW TERRITORIES",Specified Premises,指明處所,13/09/2021
BNI REMITTANCE LIMITED,,BNI REMITTANCE LIMITED,,"SHOP 83, G/F, WHAMPOA 108 SHOPPING CENTRE, WHAMPOA EST, 19-23 MAN TAI STREET, HUNG HOM, KOWLOON",Specified Premises,指明處所,13/09/2021
BNI REMITTANCE LIMITED,,BNI REMITTANCE LIMITED,,"FLAT 104-105, 1/F, HOP YICK COMMERCIAL CENTRE, 33 HOP CHOI STREET, YUEN LONG, NEW TERRITORIES",Specified Premises,指明處所,13/09/2021
BO WUI TECHNOLOGY LIMITED TRADING AS BAO YING MONEY EXCHANGE,寶匯科技有限公司 營業名稱 寶盈找換,BAO YING MONEY EXCHANGE,寶盈找換,"SHOP 3A, 1/F, TELFORD HOUSE, 16 WANG HOI ROAD, KOWLOON BAY, KOWLOON",Specified Premises,指明處所,13/09/2021
BO WUI TECHNOLOGY LIMITED TRADING AS BAO YING MONEY EXCHANGE,寶匯科技有限公司 營業名稱 寶盈找換,BAO YING MONEY EXCHANGE,寶盈找換,"SHOP C OF UNIT 1, G/F, BLOCK 3, CAMELPAINT BUILDING, 60 HOI YUEN ROAD, KWUN TONG, KOWLOON",Specified Premises,指明處所,13/09/2021
BOKU NETWORK SERVICES HK LIMITED,,,,"UNIT 5, 26/F, TECHNOLOGY PLAZA, 29-35 SHA TSUI ROAD, TSUEN WAN, NEW TERRITORIES",Correspondence Address,通訊地址,13/09/2021
BONG LEI YUNG TRADING AS BAN DUNG,黃麗容 營業名稱 萬隆,,,"SHOP 8, G/F, HONLEY COURT, 94-110 TUEN MUN HEUNG SZE WUI ROAD, TUEN MUN, NEW TERRITORIES",Specified Premises,指明處所,13/09/2021
BONG TET SEN TRADING AS AMIN REMITTANCE,王德星,,,"SHOP 5, G/F, MAYFAIR BUILDING, 123 FUK WA STREET, SHAM SHUI PO, KOWLOON",Specified Premises,指明處所,13/09/2021
BONG TET SEN TRADING AS AMIN REMITTANCE,王德星,,,"SHOP 819, 5/F, SCENEWAY PLAZA, 8 SCENEWAY ROAD, LAM TIN, KOWLOON",Specified Premises,指明處所,13/09/2021
BONG TET SEN TRADING AS AMIN REMITTANCE,王德星,AMIN REMITTANCE,,"SHOP A (SMALL SHOP), G/F, PING ON BUILDING, 33-39 HEUNG SZE WUI STREET, TAI PO, NEW TERRITORIES",Specified Premises,指明處所,13/09/2021
BONG TET SEN TRADING AS AMIN REMITTANCE,王德星,AMIN REMITTANCE,,"SHOP 47, G/F, LAI BO BUILDING, 2 TSING HO SQUARE, TUEN MUN, NEW TERRITORIES",Specified Premises,指明處所,13/09/2021
BONG TET SEN TRADING AS AMIN REMITTANCE,王德星,AMIN REMITTANCE,,"SHOP 3, G/F, TAI FUNG HOUSE, 72-76 LION ROCK ROAD, KOWLOON CITY, KOWLOON",Specified Premises,指明處所,13/09/2021
BONG TET SEN TRADING AS AMIN REMITTANCE,王德星,AMIN REMITTANCE,,"G/F, 1035 CANTON ROAD, MONG KOK, KOWLOON",Specified Premises,指明處所,13/09/2021
BONG TET SEN TRADING AS AMIN REMITTANCE,王德星,AMIN REMITTANCE,,"FLAT A(01D), 17/F, CAUSEWAY BAY COMMERCIAL BUILDING, 3 SUGAR STREET, CAUSEWAY BAY, HONG KONG",Specified Premises,指明處所,13/09/2021
BONG TET SEN TRADING AS AMIN REMITTANCE,王德星,AMIN REMITTANCE,,"SHOP 6 AND 6A, G/F, WUN FAT BUILDING, 8 WANG FAT PATH, YUEN LONG, NEW TERRITORIES",Specified Premises,指明處所,13/09/2021
BONG TET SEN TRADING AS AMIN REMITTANCE,王德星,AMIN REMITTANCE,,"SHOP 64, L1/F, LUNG FUNG GARDEN, 33 LUNG SUM AVENUE, SHEUNG SHUI, NEW TERRITORIES",Specified Premises,指明處所,13/09/2021
BONG TET SEN TRADING AS AMIN REMITTANCE,王德星,AMIN REMITTANCE,,"SHOP B29, BASEMENT/F, JUMBO BUILDING, 201 ABERDEEN MAIN ROAD, ABERDEEN, HONG KONG",Specified Premises,指明處所,13/09/2021
BONG TET SEN TRADING AS AMIN REMITTANCE,王德星,AMIN REMITTANCE,,"SHOP 73, G/F, BEVERLY GARDEN SHOPPING CENTRE, TSEUNG KWAN O, NEW TERRITORIES",Specified Premises,指明處所,13/09/2021
BONG TET SEN TRADING AS AMIN REMITTANCE,王德星,AMIN REMITTANCE,,"SHOP B1, NO.13, G/F, MEI FOO SUN CHUEN, PHASE 1, 15-21 BROADWAY, LAI CHI KOK, KOWLOON",Specified Premises,指明處所,13/09/2021
BONG TET SEN TRADING AS AMIN REMITTANCE,王德星,AMIN REMITTANCE,,"SHOP B, G/F, MARBLE PLACE, 2H MARBLE ROAD, NORTH POINT, HONG KONG",Specified Premises,指明處所,13/09/2021
BPI REMITTANCE CENTRE (HK) LTD,,BPI REMITTANCE CENTER,,"ROOM 114, 1/F, WORLDWIDE HOUSE, 19 DES VOEUX ROAD CENTRAL, CENTRAL, HONG KONG",Specified Premises,指明處所,13/09/2021
BPI REMITTANCE CENTRE (HK) LTD,,BPI REMITTANCE CENTER,,"SHOP 18B2, 2/F, TUNG YIK BLDG, 8 YU KING SQUARE, YUEN LONG, NEW TERRITORIES",Specified Premises,指明處所,13/09/2021
BPI REMITTANCE CENTRE (HK) LTD,,BPI REMITTANCE CENTER,,"SHOP 258, 2/F, LIK SANG PLAZA, 269 CASTLE PEAK ROAD, TSUEN WAN, NEW TERRITORIES",Specified Premises,指明處所,13/09/2021
BRDGEPAY (H.K) PRIVATE LIMITED,合眾私人有限公司,,,"ROOM 22 UNIT 603, 6/F, TOWER 1, ADMIRALTY CENTRE, 18 HARCOURT ROAD, ADMIRALTY, HONG KONG",Correspondence Address,通訊地址,13/09/2021
BRI REMITTANCE COMPANY LIMITED TRADING AS BRI REMITTANCE,,BRI REMITTANCE,,"ROOM 22, G/F, BAYVIEW MANSION, 11-33 MORETON TERRACE, CAUSEWAY BAY, HONG KONG",Specified Premises,指明處所,13/09/2021
BRI REMITTANCE COMPANY LIMITED TRADING AS BRI REMITTANCE,,BRI REMITTANCE,,"SHOP 214, 2/F, LIK SANG PLAZA, 269 CASTLE PEAK ROAD, TSUEN WAN, NEW TERRITORIES",Specified Premises,指明處所,13/09/2021
BRI REMITTANCE COMPANY LIMITED TRADING AS BRI REMITTANCE,,BRI REMITTANCE,,"SHOP 025, 1/F, HOP YICK COMM CTR, 33 HOP CHOI STREET, YUEN LONG, NEW TERRITORIES",Specified Premises,指明處所,13/09/2021
BRI REMITTANCE COMPANY LIMITED TRADING AS BRI REMITTANCE,,BRI REMITTANCE,,"G/F, 137 SAI YEE STREET, MONG KOK, KOWLOON",Specified Premises,指明處所,13/09/2021
BRI REMITTANCE COMPANY LIMITED TRADING AS BRI REMITTANCE,,BRI REMITTANCE,,"SHOP 3, G/F, BAYVIEW MANSION, 24-36 CAUSEWAY ROAD, CAUSEWAY BAY, HONG KONG",Specified Premises,指明處所,13/09/2021
BRIDGEHARBOUR (HK) MANAGEMENT SERVICE COMPANY LIMITED,樂力(香港)管理服務有限公司,,,"FLAT B, 15/F, ORIENTAL CRYSTAL COMM BLDG, 46 LYNDHURST TERRACE, CENTRAL, HONG KONG",Correspondence Address,通訊地址,13/09/2021
BRILLIANT SKY WORLDWIDE LIMITED,盛天環球有限公司,,,"ROOM 21, 1/F, THE LODGE WORKSMART OFFICES, 535 CANTON ROAD, JORDAN, KOWLOON",Specified Premises,指明處所,13/09/2021
BRINGALLPAY LIMITED,鉑贏奧佩有限公司,,,"WORKSHOP B09 UNIT A, 2/F, HUNG TO CENTRE, 94-96 HOW MING STREET, KWUN TONG, KOWLOON",Correspondence Address,通訊地址,13/09/2021
"BROTHERS FOREIGN CURRENCY EXCHANGE CO., LIMITED",兄弟外幣兌換有限公司,,,"SHOP G6, G7, G/F, UNITED MANSION, 37E-H, 37J-K JORDAN RD & 95-103 SHANGHAI ST, JORDAN, KOWLOON",Specified Premises,指明處所,13/09/2021
BT CAPITAL LIMITED TRADING AS BT EXCHANGE,寶通資本有限公司 營業名稱 寶通找換,BT EXCHANGE,寶通找換,"G/F, 6A WING LOK STREET, SHEUNG WAN, HONG KONG",Specified Premises,指明處所,13/09/2021
BTR EXCHANGE LIMITED,,,,"FLAT A1, 5/F, TSIM SHA TSUI MANSION, 89 NATHAN ROAD, TSIM SHA TSUI, KOWLOON",Specified Premises,指明處所,13/09/2021
BUNG TJIU KIAN TRADING AS TOKO INDONESIA,翁秋娟 營業名稱 康記,,,"SHOP G20, G/F, RHINE GARDEN, 38 CASTLE PEAK ROAD, SHAM TSENG, NEW TERRITORIES",Specified Premises,指明處所,13/09/2021
BYT CONSULTING SERVICES LIMITED,柏雅通顧問服務有限公司,,,"ROOM 1217, CENTRAL BUILDING, 1-3 PEDDER STREET, CENTRAL, HONG KONG",Specified Premises,指明處所,13/09/2021
C & HK YITONG EXCHANGE,中港銀通兌換行,,,"2-3, G/F, CHUNG WO COMMERCIAL CENTRE, 42-46 SHANGHAI STREET, JORDAN, KOWLOON",Specified Premises,指明處所,13/09/2021
"CADANO, ARIEL DOROTEO TRADING AS EMK TRADING COMPANY",,,,"SHOP KC, LOWER DECK, MUI-WO PIER, LANTAU ISLAND, NEW TERRITORIES",Specified Premises,指明處所,13/09/2021
CALSONS REMITTANCE,,,,"FLAT 20, 2/F, TUNG YICK BUILDING, 8 YU KING SQUARE, YUEN LONG, NEW TERRITORIES",Specified Premises,指明處所,13/09/2021
CALSONS REMITTANCE,,CALSONS REMITTANCE,,"SHOP 216, 2/F, WORLDWIDE HOUSE, 19 DES VOEUX ROAD CENTRAL, CENTRAL, HONG KONG",Specified Premises,指明處所,13/09/2021
CAMEL SUPPLY CHAIN MANAGEMENT (ASIA) LIMITED,駱駝供應鏈管理亞洲有限公司,,,"UNIT 1102-03, 11/F, 9 QUEEN'S ROAD CENTRAL, CENTRAL, HONG KONG",Correspondence Address,通訊地址,13/09/2021
CAPITAL EXCHANGE LIMITED,,,,"FLAT D, 13/F, ALPHA HOUSE, 27-33 NATHAN ROAD, TSIM SHA TSUI, KOWLOON",Specified Premises,指明處所,13/09/2021
CARDUP HK LIMITED,,,,"ROOM 29, 5/F, CORE F, CYBERPORT 3, 100 CYBERPORT ROAD, POK FU LAM, HONG KONG",Correspondence Address,通訊地址,13/09/2021
CASHMALLOW HONG KONG LIMITED,,,,"ROOM 1423, 14/F, RADIO CITY, 505-511 HENNESSY ROAD, CAUSEWAY BAY, HONG KONG",Correspondence Address,通訊地址,13/09/2021
CASSON HONG MONEY EXCHANGE LIMITED TRADING AS HING YIP MONEY EXCHANGE COMPANY,加誠行找換有限公司 營業名稱 興業找換公司,HING YIP EXCHANGE AND REMITTANCE COMPANY,興業找換匯款公司,"SHOP 3, G/F, TUNG NING BLDG, 126 CONNAUGHT ROAD CENTRAL, SHEUNG WAN, HONG KONG",Specified Premises,指明處所,13/09/2021
CASSON HONG MONEY EXCHANGE LIMITED TRADING AS HING YIP MONEY EXCHANGE COMPANY,加誠行找換有限公司 營業名稱 興業找換公司,WING FU GROUP EXCHANGE AND REMITTANCE COMPANY,永富集團找換匯款公司,"SHOP A, G/F, 65 SAN FUNG AVENUE, SHEUNG SHUI, NEW TERRITORIES",Specified Premises,指明處所,13/09/2021
CASSON HONG MONEY EXCHANGE LIMITED TRADING AS HING YIP MONEY EXCHANGE COMPANY,加誠行找換有限公司 營業名稱 興業找換公司,CASSON HONG EXCHANGE AND REMITTANCE COMPANY,加誠行找換匯款公司,"SHOP G (PORTION OF SHOP 5), G/F, WAI LEE BUILDING, 997 KING'S ROAD, QUARRY BAY, HONG KONG",Specified Premises,指明處所,13/09/2021
CASSON HONG MONEY EXCHANGE LIMITED TRADING AS HING YIP MONEY EXCHANGE COMPANY,加誠行找換有限公司 營業名稱 興業找換公司,CASSON HONG FOREIGN EXCHANGE COMPANY,加誠行外幣找換公司,"SHOP A, G/F, 87 SAN FUNG AVENUE, SHEUNG SHUI, NEW TERRITORIES",Specified Premises,指明處所,13/09/2021
CEBUANA LHUILLIER HK LIMITED TRADING AS CEBUANA LHUILLIER,,CEBUANA LHUILLIER,,"SHOP 144, 1/F, LIK SANG PLAZA, 269 CASTLE PEAK ROAD, TSUEN WAN, NEW TERRITORIES",Specified Premises,指明處所,13/09/2021
CENTRAL ASIA EXCHANGE LIMITED,,,,"ROOM 432, 4/F, HANKOW CENTRE, 5-15 HANKOW ROAD, TSIM SHA TSUI, KOWLOON",Specified Premises,指明處所,13/09/2021
CEO MONEY EXCHANGE LIMITED,環滙找換有限公司,,,"SHOP 101C40, 1/F, OK MALL, KINGS WING PLAZA, PHASE 2, 1 ON KWAN STREET, SHA TIN, NEW TERRITORIES",Specified Premises,指明處所,13/09/2021
"CHAN CRISTINA TRADING AS HONG KONG DECHENG CO,",陳宣頤 營業名稱 香港德盛公司,,,"SHOP E, G/F, 13 SAN HONG STREET, SHEUNG SHUI, NEW TERRITORIES",Specified Premises,指明處所,13/09/2021
"CHAN CRISTINA TRADING AS HONG KONG DECHENG CO,",陳宣頤 營業名稱 香港德盛公司,"HONG KONG DECHENG CO,",香港德盛公司,"SHOP A, G/F, 80 SAN FUNG AVENUE, SHEUNG SHUI, NEW TERRITORIES",Specified Premises,指明處所,13/09/2021
"CHAN CRISTINA TRADING AS HONG KONG DECHENG CO,",陳宣頤 營業名稱 香港德盛公司,"HONG KONG DECHENG CO,",香港德盛公司,"SHOP 8B, G/F, BRIGHTON PLACE, 23 SHIU WO STREET, TSUEN WAN, NEW TERRITORIES",Specified Premises,指明處所,13/09/2021
"CHAN CRISTINA TRADING AS HONG KONG DECHENG CO,",陳宣頤 營業名稱 香港德盛公司,"HONG KONG DECHENG CO,",香港德盛公司,"SHOP STAIRCASE, G/F, 19 FU HING STREET, SHEUNG SHUI, NEW TERRITORIES",Specified Premises,指明處所,13/09/2021
CHAN HEUNG LAM TRADING AS WAI HONG EXCHANGE,陳香琳 營業名稱 瑋航找換,,,"SHOP 28, G/F, HONOUR BUILDING, 80J TO KWA WAN ROAD, TO KWA WAN, KOWLOON",Specified Premises,指明處所,13/09/2021
CHAN ING MOI TRADING AS WARUNG JATIM,陳映梅 營業名稱 亞熱帶食品公司,,,"SHOP G39, MIDLAND CENTRE, 328 QUEEN'S ROAD CENTRAL, CENTRAL, HONG KONG",Specified Premises,指明處所,13/09/2021
CHAN KWAI MAN TRADING AS ELITE CURRENCY EXCHANGE,陳桂文 營業名稱 億利找換店,,,"SHOP 138, 1/F, KWUN TONG PLAZA, 68 HOI YUEN ROAD, KWUN TONG, KOWLOON",Specified Premises,指明處所,13/09/2021
CHAN KWAI MAN TRADING AS ELITE CURRENCY EXCHANGE,陳桂文 營業名稱 億利找換店,ELITE CURRENCY EXCHANGE,億利找換店,"SHOP 2, 1/F, SHATIN GALLERIA, 18-24 SHAN MEI STREET, FO TAN SHA TIN, NEW TERRITORIES",Specified Premises,指明處所,13/09/2021
CHAN KWUN KAU KAUMAN TRADING AS FU YU INVESTMENT MANAGEMENT CO,陳冠球 營業名稱 富譽投資管理公司,,,"SHOP 9, G/F, CAMBRIDGE BUILDING, 41 HONG NING ROAD, KWUN TONG, KOWLOON",Specified Premises,指明處所,13/09/2021
CHAN MUN TONG TRADING AS GAM WO EXCHANGE,陳滿棠 營業名稱 金禾找換,,,"SHOP D, 17 TSUN FU STREET, SHEUNG SHUI, NEW TERRITORIES",Specified Premises,指明處所,13/09/2021
CHAN PIK YU TRADING AS MOST LUCKY COMPANY,陳碧如 營業名稱 展祥公司,,,"SHOP 1C, G/F, BLOCK B, TONIC INDUSTRIAL CENTRE, 19 LAM HING STREET, KOWLOON BAY, KOWLOON",Specified Premises,指明處所,13/09/2021
CHAN PING HUEN,陳炳煊 營業名稱 利豐肉食公司,,,"SHOP B, G/F, 140 ELECTRIC ROAD, CAUSEWAY BAY, HONG KONG",Specified Premises,指明處所,13/09/2021
