KWOK HING EXCHANGE AND REMITTANCE CO LIMITED,國興找換匯款有限公司,KWOK HING RENMINBI EXCHANGE CO.,國興人民幣找換行,"SHOP G04, G/F, NEW CAPITAL COMPUTER PLAZA, 85-95 UN CHAU STREET, SHAM SHUI PO, KOWLOON",Specified Premises,指明處所,13/09/2021
KWOK HING EXCHANGE AND REMITTANCE CO LIMITED,國興找換匯款有限公司,,國興找換匯款公司,"SHOP A068, 1/F, NAM FUNG CENTRE, 264-298 CASTLE PEAK ROAD, TSUEN WAN, NEW TERRITORIES",Specified Premises,指明處所,13/09/2021
KWOK HING INVESTMENT MANAGEMENT LIMITED TRADING AS KWOK HING RMB EXCHANGE SHOP,國興投資管理有限公司 營業名稱 國興人民幣找換行,KWOK HING RMB EXCHANGE SHOP,國興人民幣找換行,"PORTION 1, SHOP C-D, G/F, 543 NATHAN ROAD, YAU MA TEI, KOWLOON",Specified Premises,指明處所,13/09/2021
KWOK HING INVESTMENT MANAGEMENT LIMITED TRADING AS KWOK HING RMB EXCHANGE SHOP,國興投資管理有限公司 營業名稱 國興人民幣找換行,,國興人民幣找換行,"SHOP 1, 3/F, SCENEWAY PLAZA, LAM TIN, KOWLOON",Specified Premises,指明處所,13/09/2021
KWOK HING INVESTMENT MANAGEMENT LIMITED TRADING AS KWOK HING RMB EXCHANGE SHOP,國興投資管理有限公司 營業名稱 國興人民幣找換行,,家興人民幣找換店,"STAIRCASE (NEAR SHOP N65-68), G/F, STAGE 7 MOUNT STERLING MALL, MEI FOO SUN CHUEN, LAI CHI KOK, KOWLOON",Specified Premises,指明處所,13/09/2021
KWOK HING INVESTMENT MANAGEMENT LIMITED TRADING AS KWOK HING RMB EXCHANGE SHOP,國興投資管理有限公司 營業名稱 國興人民幣找換行,KAM HING RMB EXCHANGE SHOP,金興人民幣找換行,"SHOP 3, G/F, RIGHT SHOP SOUTHERN BUILDING, 257-273 KING'S ROAD, NORTH POINT, HONG KONG",Specified Premises,指明處所,13/09/2021
KWOK HING INVESTMENT MANAGEMENT LIMITED TRADING AS KWOK HING RMB EXCHANGE SHOP,國興投資管理有限公司 營業名稱 國興人民幣找換行,KWOK HING RENMINBI EXCHANGE SHOP,國興人民幣找換行,"SHOP D2, G/F, PAK LOK BUILDING, 322-326A NATHAN ROAD, JORDAN, KOWLOON",Specified Premises,指明處所,13/09/2021
KWOK HOI YIN TRADING AS TOKO INDONESIA A MEI,郭海燕 營業名稱 美美印尼土產店,,,"UNIT 4, G/F, HANG FU BUILDING, 38 YAU SAN STREET, YUEN LONG, NEW TERRITORIES",Specified Premises,指明處所,13/09/2021
KWOK KANG YEE TRADING AS PO YUEN FOREIGN EXCHANGE,郭鏡義 營業名稱 寶源外幣找換店,,,"SHOP 142A, G/F, MAN BO BUILDING, TUEN MUN, NEW TERRITORIES",Specified Premises,指明處所,13/09/2021
KWOK MAN MAN TRADING AS TT CITY MONEY EXCHANGE,郭敏敏 營業名稱 匯城人民幣找換店,,,"SHOP B2, G/F, TAK YAN HSE PHASE 2, 61-63 HEUNG WO ST, TSUEN WAN, NEW TERRITORIES",Specified Premises,指明處所,13/09/2021
KWOK SAU YING TRADING AS FU SHUN INT'L DEVELOPMENT CO,郭秀英 營業名稱 富信國際發展公司,,,"FRONT PORTION 1, G/F, 142 CHUNG ON STREET, TSUEN WAN, NEW TERRITORIES",Specified Premises,指明處所,13/09/2021
KWOK WUI GROUP LIMITED,國匯集團 (中國) 有限公司,,,"SHOP 6 (NOT INCLUDE M/F), G/F, CHI KAM COURT, 97 HAU WONG ROAD, KOWLOON CITY, KOWLOON",Specified Premises,指明處所,13/09/2021
KWOK WUI GROUP LIMITED,國匯集團 (中國) 有限公司,KWOK WUI GROUP LIMITED,國匯集團(中國)有限公司,"STAIRCASE, G/F, 118-120 TUNG CHOI STREET, MONG KOK, KOWLOON",Specified Premises,指明處所,13/09/2021
KWOK WUI GROUP LIMITED,國匯集團 (中國) 有限公司,KWOK WUI GROUP LIMITED,國匯集團(中國)有限公司,"FLAT B1, G/F, SAN FUNG BUILDING, 33 SAN FUNG AVENUE, SHEUNG SHUI, NEW TERRITORIES",Specified Premises,指明處所,13/09/2021
KWOK WUI GROUP LIMITED,國匯集團 (中國) 有限公司,KWOK WUI GROUP,國匯找換,"SHOP C, G/F, 156-158 TEMPLE STREET, JORDAN, KOWLOON",Specified Premises,指明處所,13/09/2021
KWOK WUI GROUP LIMITED,國匯集團 (中國) 有限公司,KWOK WUI GROUP,國匯集團,"SHOP 04, G/F, MAN FUNG BUILDING, 11-15 FUNG KWAN STREET, YUEN LONG, NEW TERRITORIES",Specified Premises,指明處所,13/09/2021
KWOK YIM CHING TRADING AS INDONESIA FOOD RETAIL,郭艷青 營業名稱 南洋食品,,,"SHOP 3, G/F, MAN PO BUILDING, SAN TSING STREET, TUEN MUN, NEW TERRITORIES",Specified Premises,指明處所,13/09/2021
LAI YUN HO TRADING AS CHUNG KONG REMINBI & FOREIGN MONEY EXCHANGE CO.,賴潤浩 營業名稱 中港人民幣外幣找換,,,"PORTION OF SHOP 4, G/F, PENINSULA APARTMENTS, 16 MODY ROAD, TSIM SHA TSUI, KOWLOON",Specified Premises,指明處所,13/09/2021
LAI YUN HO TRADING AS CHUNG KONG REMINBI & FOREIGN MONEY EXCHANGE CO.,賴潤浩 營業名稱 中港人民幣外幣找換,WUI PO MONEY EXCHANGE CO,滙寶找換行,"SIDE SHOP, G/F, GRANDMARK, 8A-10 GRANVILLE ROAD, TSIM SHA TSUI, KOWLOON",Specified Premises,指明處所,13/09/2021
LAM CHUN CHOI,林進財 營業名稱 順興人民幣找換店,,,"SHOP A066, 1/F, NAN FUNG CENTRE, 264-298 CASTLE PEAK ROAD, TSUEN WAN, NEW TERRITORIES",Specified Premises,指明處所,13/09/2021
LAM KA LOK TRADING AS CHK EXCHANGE,林嘉樂 營業名稱 中港兑換,,,"SHOP 220A, TAI WO PLAZA, TAI PO, NEW TERRITORIES",Specified Premises,指明處所,13/09/2021
LAM KAM DAI TRADING AS KAM YUEN R.M.B. MONEY EXCHANGE,林錦地 營業名稱 鑫源人民幣找換店,,,"G/F, BLOCK A, I-FENG MANSION, 237 TO KWA WAN ROAD, TO KWA WAN, KOWLOON",Specified Premises,指明處所,13/09/2021
LAM KING TRADING AS PRINCE ORGANIZATION PROMOTE CONSULTANT CO.,林競 營業名稱 太子企業推廣顧問公司,PRINCE MONEY EXCHANGE,太子找換,"SHOP R110, G/F, COMM COMPLEX (BUTTERFLY PLAZA), BUTTERFLY ESTATE, 1 WU CHUI ROAD, TUEN MUN, NEW TERRITORIES",Specified Premises,指明處所,13/09/2021
LAM KING TRADING AS PRINCE ORGANIZATION PROMOTE CONSULTANT CO.,林競 營業名稱 太子企業推廣顧問公司,PRINCE MONEY EXCHANGE,太子人民幣(外幣)找換店,"SHOP 59, G/F, LUNG MUN OASIS, TUEN MUN, NEW TERRITORIES",Specified Premises,指明處所,13/09/2021
LAM KING TRADING AS PRINCE ORGANIZATION PROMOTE CONSULTANT CO.,林競 營業名稱 太子企業推廣顧問公司,PRINCE MONEY EXCHANGE,太子人民幣(外幣)找換店,"SHOP 44A, G/F, RICHLAND GARDEN COMMERCIAL COMPLEX, 138 WU CHUI ROAD, TUEN MUN, NEW TERRITORIES",Specified Premises,指明處所,13/09/2021
LAM KWOK WAI TRADING AS SAHABAT EXPRESS,林國威,,,"SHOP A, G/F, 122 SAI WAN HO STREET, SHAU KEI WAN, HONG KONG",Specified Premises,指明處所,13/09/2021
LAM LEE LOI TRADING AS G-THREE CONSULTANTS COMPANY,林利來 營業名稱 哲生顧問公司,,,"SHOP 25, G/F, FAR EAST MANSION, 5-6 MIDDLE ROAD, TSIM SHA TSUI, KOWLOON",Specified Premises,指明處所,13/09/2021
LAM LEE LOI TRADING AS G-THREE CONSULTANTS COMPANY,林利來 營業名稱 哲生顧問公司,G-THREE CONSULTANTS COMPANY,哲生顧問公司,"SHOP 11, G/F, FAR EAST MANSION, 5-6 MIDDLE ROAD, TSIM SHA TSUI, KOWLOON",Specified Premises,指明處所,13/09/2021
LAM YING LUNG TRADING AS KA WAH FOREIGN CURRENCY EXCHANGE COMPANY,林映龍 營業名稱 嘉華外幣兌換公司,,,"FLAT C106B, G/F, BLOCK C, WHAMPOA BLDG, 97A BAKER STREET, HUNG HOM, KOWLOON",Specified Premises,指明處所,13/09/2021
LAM YING TONG TRADING AS HAPPING CHANGE,林映彤 營業名稱 開心找換店,,,"SHOP B, G/F, 20 SHUNG LING STREET, SAN PO KONG, KOWLOON",Specified Premises,指明處所,13/09/2021
LAM YU HANG,林宇恒 營業名稱 新盛泉東南亞食品,,,"G/F, 236 KI LUNG STREET, SHAM SHUI PO, KOWLOON",Specified Premises,指明處所,13/09/2021
LAM'S BROTHER FOREIGN EXCHANGE LIMITED,林氏兄弟外幣兌換有限公司,,,"UNIT A084, 1/F, NAN FUNG CENTRE, 264-298 CASTLE PEAK ROAD, TSUEN WAN, NEW TERRITORIES",Specified Premises,指明處所,13/09/2021
LAM'S BROTHER FOREIGN EXCHANGE LIMITED,林氏兄弟外幣兌換有限公司,LAM'S BROTHER FOREIGN EXCHANGE LIMITED,林氏兄弟外幣兌換有限公司,"SHOP I, G/F, 79 YEUNG UK ROAD, TSUEN WAN, NEW TERRITORIES",Specified Premises,指明處所,13/09/2021
LANDMARK COMMERCE (HK) LIMITED,匯恒訊飛有限公司,,,"SHOP B88, B/F, TST PLAZA, CHEVALIER HOUSE, 45-51 CHATHAM ROAD SOUTH, TSIM SHA TSUI, KOWLOON",Correspondence Address,通訊地址,13/09/2021
LAU CHIN YAU,劉展休 營業名稱 億豐人民幣找換行,,,"G/F, 5A SAU FU STREET, YUEN LONG, NEW TERRITORIES",Specified Premises,指明處所,13/09/2021
LAU CHIN YAU,劉展休 營業名稱 億豐人民幣找換行,,新中華找換行,"SHOP A, G/F, LONGFIELD CENTRE, 129-131 CASTLE PEAK ROAD, YUEN LONG, NEW TERRITORIES",Specified Premises,指明處所,13/09/2021
LAU CHIN YAU,劉展休 營業名稱 億豐人民幣找換行,,新中華找換行,"SHOP F, G/F, 75 CASTLE PEAK ROAD, YUEN LONG, NEW TERRITORIES",Specified Premises,指明處所,13/09/2021
LAU CHIN YAU,劉展休 營業名稱 億豐人民幣找換行,,新中華找換行,"SHOP 43, G/F, HEALEY BUILDING, 211-223 CASTLE PEAK ROAD, YUEN LONG, NEW TERRITORIES",Specified Premises,指明處所,13/09/2021
LAU CHING CHE TRADING AS FULTON CO,劉清池 營業名稱 富東公司,,,"FLAT B, 15/F, SUEN YUE BUILDING, 48 BONHAM STRAND WEST, SHEUNG WAN, HONG KONG",Specified Premises,指明處所,13/09/2021
LAU KWOK WAH,劉國華 營業名稱 興華公司,,,"SHOP C, G/F, 66 HO PUI STREET, TSUEN WAN, NEW TERRITORIES",Specified Premises,指明處所,13/09/2021
LAU SAU MEI TRADING AS CHOW HING HO RMB MONEY EXCHANGE,劉秀美 營業名稱 周興號人民幣找換店,,,"G/F, 79 OAK STREET, TAI KOK TSUI, KOWLOON",Specified Premises,指明處所,13/09/2021
LAU SIU YUEN TRADING AS TOKO INDONESIA KIM FONG,劉小元 營業名稱 錦丰東南亞食品店,,,"G/F, 26 WAN TAU SQUARE, TAI PO, NEW TERRITORIES",Specified Premises,指明處所,13/09/2021
LAW PING CHIU,羅炳潮 營業名稱 恒豐人民幣找換行,,,"SHOP G9, G/F, WINNER MANSION, 23 NAM ON STREET, SHAU KEI WAN, HONG KONG",Specified Premises,指明處所,13/09/2021
LBC MABUHAY HONG KONG LIMITED,,,,"SHOP 319, 3/F, WORLD WIDE HOUSE, 19 DES VOEUX ROAD, CENTRAL, HONG KONG",Specified Premises,指明處所,13/09/2021
LBC MABUHAY HONG KONG LIMITED,,LBC MABUHAY HONG KONG LIMITED - HUNGHOM BRANCH,,"FLAT D-5/6, 1/F, PLANET SQUARE, 1-15 TAK MAN STREET, HUNG HOM, KOWLOON",Specified Premises,指明處所,13/09/2021
LBC MABUHAY HONG KONG LIMITED,,LBC MABUHAY HONG KONG - LIK SANG,,"SHOP 260, 2/F, LIK SANG PLAZA, 269 CASTLE PEAK ROAD, TSUEN WAN, NEW TERRITORIES",Specified Premises,指明處所,13/09/2021
LBC MABUHAY HONG KONG LIMITED,,LBC MABUHAY HONG KONG LIMITED,,"SHOP 3 & 3A, 2/F, TUNG YIK BUILDING, NO.8 YU KING SQUARE, YUEN LONG, NEW TERRITORIES",Specified Premises,指明處所,13/09/2021
LBC MABUHAY HONG KONG LIMITED,,LBC MABUHAY HONG KONG LIMITED,,"SHOP 69D&E, 75A, G/F, BLOCK 13, CITY GARDEN SHOPPING ARCADE, 233 ELECTRIC ROAD, NORTH POINT, HONG KONG",Specified Premises,指明處所,13/09/2021
LBC MABUHAY HONG KONG LIMITED,,LBC MABUHAY HONG KONG LIMITED,,"SHOP 156, 1/F, PAULINE BUILDING, 9-15 HEUNG SZE WUI ST, TAI PO, NEW TERRITORIES",Specified Premises,指明處所,13/09/2021
LEE NG TRADING AS TOKO EMPAT,李五,,,"SHOP 24, LG/F, TAI PING MARKET, 1010-1030 KING'S ROAD, QUARRY BAY, HONG KONG",Specified Premises,指明處所,13/09/2021
LEE NG TRADING AS TOKO LIMA,李五,,,"SHOP 40, G/F, HENG FA CHUEN WET MARKET, 100 SHING TAI ROAD, CHAI WAN, HONG KONG",Specified Premises,指明處所,13/09/2021
LEE SHENG (CHINA) LIMITED TRADING AS LEE TUNG MONEY EXCHANGE,利盛(中國)有限公司 營業名稱 利通找換,LEE TUNG MONEY EXCHANGE,利通找換,"FLAT 1, G/F, NEW CITY CENTRE, 2 LEI YUE MUN ROAD, KWUN TONG, KOWLOON",Specified Premises,指明處所,13/09/2021
LEE WAI CHI CAROL TRADING AS SAYA MART COMPANY,李惠芝,,,"SHOP 503 STALL 9, 5/F, CHI FU LANDMARK, POK FU LAM, HONG KONG",Specified Premises,指明處所,13/09/2021
LEE WING SANG TRADING AS LIAN SHENG DA RENMINBI EXCHANGE,李榮生 營業名稱 連勝達人民幣找換行,,,"SHOP 12A, G/F, 50 SOY STREET, MONG KOK, KOWLOON",Specified Premises,指明處所,13/09/2021
LEGENDARY TRADING LIMITED TRADING AS GOLDEN TREND COMPANY,廣澤貿易有限公司 營業名稱 金港匯公司,GOLDEN TREND MONEY EXCHANGE,金港匯找換店,"FLAT B, G/F, TONG SING MANSION, 78-82 TSEUK LUK STREET, SAN PO KONG, KOWLOON",Specified Premises,指明處所,13/09/2021
LEI TAT GLOBAL (HK) LIMITED,利達環球（香港）有限公司 營業名稱 利達找換店,,利達找換店,"FLAT D01, G/F, BLOCK G&H, EAST SUN INDUSTRIAL CENTRE, 16 SHING YIP STREET, KWUN TONG, KOWLOON",Specified Premises,指明處所,13/09/2021
LEUNG KWAI FAN,梁桂芬 營業名稱 志興人民幣找換行,,,"SHOP D1 & D2, G/F, KWOK WAH MANSION, 142-148 CASTLE PEAK ROAD, YUEN LONG, NEW TERRITORIES",Specified Premises,指明處所,13/09/2021
LEUNG KWAI FAN,梁桂芬 營業名稱 志興人民幣找換行,,,"PORTION OF SHOP D (D2), G/F, KWOK WAH MANSION, 142-148 CASTLE PEAK ROAD, YUEN LONG, NEW TERRITORIES",Specified Premises,指明處所,13/09/2021
LEUNG KWAI FAN,梁桂芬 營業名稱 志興人民幣找換行,,新志興找換行,"SHOP 3, G/F, CHEUNG FAT BUILDING, 32A YU KING SQUARE, YUEN LONG, NEW TERRITORIES",Specified Premises,指明處所,13/09/2021
LEUNG MAN KIT TRADING AS SHING SHUN HONG EXCHANGE & REMITTANCE COMPANY,梁文傑 營業名稱 誠信行人民幣找換店,,,"SHOP B1, G/F, EFFORT INDUSTRIAL BUILDING, 2-8 KUNG YIP STREET, KWAI CHUNG, NEW TERRITORIES",Specified Premises,指明處所,13/09/2021
LEUNG NGA SZE TRADING AS CHUNG CHEE RENMINBI EXCHANGE AND REMITTANCE COMPANY,梁雅詩 營業名稱 中資人民幣找換匯款公司,,,"SHOP B, G/F, 174 FA YUEN STREET, MONG KOK, KOWLOON",Specified Premises,指明處所,13/09/2021
LEUNG WAI CHUN TRADING AS BIRDY EXCHANGE,梁維津,,,"SHOP 261A, G/F, LAN FONG BUILDING, 261 CHEUNG SHA WAN ROAD, SHAM SHUI PO, KOWLOON",Specified Premises,指明處所,13/09/2021
LI CHI LOK,李梓樂 營業名稱 東升食品,,,"STALL S-SK22-23, G/F, SHA KOK MARKET, SHA KOK SHOPPING CENTRE, SHA KOK ESTATE, SHA TIN, NEW TERRITORIES",Specified Premises,指明處所,13/09/2021
LI CHU,李初 營業名稱 中盛找換行,,,"SHOP 3A, G/F, FOO TAT BUILDING, 50 SOY STREET, MONG KOK, KOWLOON",Specified Premises,指明處所,13/09/2021
LI CHUN NING TRADING AS MING FAI TELECOM,李俊寧 營業名稱 明輝電訊,,,"SHOP A4A, G/F, MAN FAT BUILDING, 30 BELCHER'S STREET, KENNEDY TOWN, HONG KONG",Specified Premises,指明處所,13/09/2021
LI HUAQIN TRADING AS INDONESIA MAKANAN PASAR,李華琴 營業名稱 日日好印尼食品市場,,,"SHOP STALL NO. D13, MARKET PLACE OF COMMERCIAL BLOCK 2, UPPER OI MAN ESTATE, NO.60 CHUNG HAU ST, HO MAN TIN, KOWLOON",Specified Premises,指明處所,13/09/2021
LI LAI FAN TRADING AS EMPEROR EXCHANGE SHOP,李麗芬 營業名稱 英皇找換店,,,"UNIT 8A, L1/F, WAH YIU INDUSTRIAL CENTRE, 30-32 AU PUI WAN STREET, FO TAN SHA TIN, NEW TERRITORIES",Specified Premises,指明處所,13/09/2021
LI YANGHENG,李揚恒 營業名稱 鵬偉找換店,,,"SHOP 8, G/F, BI JOU APARTMENTS, 157 PRINCE EDWARD ROAD WEST, MONG KOK, KOWLOON",Specified Premises,指明處所,13/09/2021
LIAN HUI DEVELOPMENT LIMITED TRADING AS LIAN HUI MONEY EXCHANGE,聯匯實業發展有限公司 營業名稱 聯滙找換,LIAN HUI MONEY EXCHANGE,聯滙找換,"SHOP 4, G/F, 209, 211, 213, 217, 219 AND 221 CASTLE PEAK ROAD, TSUEN WAN, NEW TERRITORIES",Specified Premises,指明處所,13/09/2021
LIANG HAU LING TRADING AS MURNI TOKO INDONESIA,梁巧玲 營業名稱 萬利印尼土產食品商店,,,"G/F, 19 TAK LUNG FRONT STREET, SAI KUNG, NEW TERRITORIES",Specified Premises,指明處所,13/09/2021
LIANG YEKAI TRADING AS TIANMA RMB EXCHANGE CO.,梁業凱 營業名稱 天馬人民幣找換行,,,"FLAT J, G/F, JADE COURT, 81-87 WAI CHING STREET, YAU MA TEI, KOWLOON",Specified Premises,指明處所,13/09/2021
LIANG YEKAI TRADING AS TIANMA RMB EXCHANGE CO.,梁業凱 營業名稱 天馬人民幣找換行,TIANMA RMB EXCHANGE CO.,天馬人民幣找換行,"FLAT B, G/F, 38H KWEILIN STREET, SHAM SHUI PO, KOWLOON",Specified Premises,指明處所,13/09/2021
LIANG YEKAI TRADING AS TIANMA RMB EXCHANGE CO.,梁業凱 營業名稱 天馬人民幣找換行,TIANMA RMB EXCHANGE CO.,天馬人民幣找換行,"PORTION OF SHOP, G/F, 3B WATERLOO ROAD, YAU MA TEI, KOWLOON",Specified Premises,指明處所,13/09/2021
LIANLIAN INTERNATIONAL COMPANY LIMITED,連連國際支付有限公司,,,"ROOM 25, 3/F, IT STREET CYBERPORT 3, 100 CYBERPORT ROAD, POK FU LAM, HONG KONG",Correspondence Address,通訊地址,13/09/2021
LIE SIU CHUEN TRADING AS ASIA FOOD,李霄泉,,,"SHOP T-TS35A TIN SHUI MKT, G/F, TIN SHUI SHOPPING CENTRE, TIN SHUI ESTATE, TIN SHUI WAI, NEW TERRITORIES",Specified Premises,指明處所,13/09/2021
LILI HENNY TRADING AS WARUNG GAUL,李甜甜,,,"SHOP 13A4, G/F, MEI FOO SUN CHUEN, 17D BROADWAY ST, LAI CHI KOK, KOWLOON",Specified Premises,指明處所,13/09/2021
LIN HUI ZHI TRADING AS CHOW KEE MONEY EXCHANGE CO.,林惠枝 營業名稱 周記人民幣找換公司,,,"UNIT F2, G/F, BLOCK 3, KWUN TONG IND CENTRE, 448 KWUN TONG RD, KWUN TONG, KOWLOON",Specified Premises,指明處所,13/09/2021
LING YAT WA TRADING AS WORLD UNION REMITTANCE COMPANY,寧日華 營業名稱 世聯匯款公司,,,"ROOM A, 14/F, HING LEE COMMERCIAL BUILDING, 12-14 SHANGHAI STREET, JORDAN, KOWLOON",Specified Premises,指明處所,13/09/2021
LING'S LIMITED,齡氏有限公司,,,"FLAT 2, 12/F, LOON KEE BUILDING, 267-275 DES VOEUX ROAD CENTRAL, CENTRAL, HONG KONG",Specified Premises,指明處所,13/09/2021
LINK PASS GLOBAL LIMITED,節節通環球有限公司,,,"WORKSHOP ROOM A-08 UNIT A, 2/F, HUNG TO CENTRE, 94-96 HOW MING STREET, KWUN TONG, KOWLOON",Correspondence Address,通訊地址,13/09/2021
LINKLOGIS INTERNATIONAL COMPANY LIMITED,,,,"ROOM 01-03, 45/F, CHINA ONLINE CENTRE, 333 LOCKHART ROAD, WAN CHAI, HONG KONG",Specified Premises,指明處所,13/09/2021
LITE PAY COMPANY LIMITED,利達支付有限公司,,,"FLAT/RM 20, 3/F, IT STREET CYBERPORT 3, 100 CYBERPORT ROAD, POK FU LAM, HONG KONG",Correspondence Address,通訊地址,13/09/2021
LIU CHI MING,廖智明 營業名稱 元朗找換行,,,"SHOP A1, G/F, KIN SHING BUILDING, 209 CASTLE PEAK ROAD, YUEN LONG, NEW TERRITORIES",Specified Premises,指明處所,13/09/2021
LIU CHI MING,廖智明 營業名稱 元朗找換行,,新田找換行,"SHOP H4, G AND COCKLOFT/F, LEE KING BUILDING, 3-19 HONG KING STREET, YUEN LONG, NEW TERRITORIES",Specified Premises,指明處所,13/09/2021
LIU CHI MING,廖智明 營業名稱 元朗找換行,,廖氏找換行,"UNIT A2 ON SHOP NO.7, G/F, FULL YAU COURT, 37-51 YAU SAN ST, YUEN LONG, NEW TERRITORIES",Specified Premises,指明處所,13/09/2021
LIU CHI MING,廖智明 營業名稱 元朗找換行,,廖氏人民幣找換行,"SHOP C, G/F, REAR PORTION, 100 CASTLE PEAK ROAD, YUEN LONG, NEW TERRITORIES",Specified Premises,指明處所,13/09/2021
LIU SHUN CHING TRADING AS TOKO INDONESIA MURAH,廖順正 營業名稱 永順東南亞食品,,,"STALL NO. M212, G/F, MARKET PLACE OF TIN SHING SHOPPING CENTRE, TIN SHING COURT, 3 TIN CHING STREET, YUEN LONG, NEW TERRITORIES",Specified Premises,指明處所,13/09/2021
LIU WAI NEI TRADING AS TOKO SANG HING LUNG INDO,廖偉彌 營業名稱 生興隆,,,"SHOP W-CY8, G/F, CHUK YUEN MARKET, CHUK YUEN PLAZA, CHUK YUEN (SOUTH) ESTATE, 15 CHUK YUEN ROAD, WONG TAI SIN, KOWLOON",Specified Premises,指明處所,13/09/2021
LIU WAI NEI TRADING AS TOKO SANG HING LUNG INDO,廖偉彌 營業名稱 生興隆,TOKO SANG HING LUNG INDO,生興隆雜貨,"SHOP 417, G/F, MARKET PLACE OF COMMERCIAL CENTRE 1 (AREA 2) (LOK FU PLACE), LOK FU ESTATE, 198 JUNCTION ROAD, LOK FU, KOWLOON",Specified Premises,指明處所,13/09/2021
LIU YUK CHU TRADING AS YIP HING RMB EXCHANGE SHOP,廖玉珠 營業名稱 葉興人民幣找換行,,,"SHOP A3, G/F, LUCKY COMMERCIAL CENTRE, 103-109 DES VOEUX ROAD WEST, SHEUNG WAN, HONG KONG",Specified Premises,指明處所,13/09/2021
LO CHEUK TSUN TRADING AS CHUNG WO FOREIGN EXCHANGE CO,勞卓進 營業名稱 中和找換店,,,"SHOP 175, MARITIME SQUARE, 33 TSING KING ROAD, TSING YI, NEW TERRITORIES",Specified Premises,指明處所,13/09/2021
LO LAU PING TRADING AS KAM WA MONEY EXCHANGE COMPANY,盧柳平 營業名稱 錦華人民幣(外幣)找換店,,,"SHOP 39, G/F, MAN BO BUILDING, NO.2 TSING HOI CIRCUIT, TUEN MUN, NEW TERRITORIES",Specified Premises,指明處所,13/09/2021
LO WING PUN TRADING AS FAI TAT REMITTANCE,羅荣彬 營業名稱 快達匯款,,,"SHOP D2, G/F, 135 PEI HO STREET, SHAM SHUI PO, KOWLOON",Specified Premises,指明處所,13/09/2021
LO WING PUN TRADING AS FAI TAT REMITTANCE,羅荣彬 營業名稱 快達匯款,FAI TAT REMITTANCE,快達匯款,"PORTION SHOP D, G/F, 139 PRINCE EDWARD ROAD WEST, MONG KOK, KOWLOON",Specified Premises,指明處所,13/09/2021
LONGITUDE ASIA LIMITED,瑞士經緯投資有限公司,,,"ROOM B, 20/F, MALAHON CENTRE, 10-12 STANLEY STREET, CENTRAL, HONG KONG",Specified Premises,指明處所,13/09/2021
LOYAL CO,永恒公司,,,"FLAT 508, 5/F, SANDS BUILDING, 17 HANKOW ROAD, TSIM SHA TSUI, KOWLOON",Specified Premises,指明處所,13/09/2021
LUCKY MONEY EXCHANGE LIMITED,幸運來找換有限公司,,,"SHOP B, G/F, 769 NATHAN ROAD, MONG KOK, KOWLOON",Specified Premises,指明處所,13/09/2021
LUCKY MONEY EXCHANGE LIMITED,幸運來找換有限公司,LUCKY MONEY EXCHANGE LIMITED,幸運來找換有限公司,"STAIRCASE G/F, 729 NATHAN ROAD, MONG KOK, KOWLOON",Specified Premises,指明處所,13/09/2021
LUCKY MONEY EXCHANGE LIMITED,幸運來找換有限公司,LUCKY MONEY EXCHANGE LIMITED,幸運來找換有限公司,"ROOM C2, G/F, FUNG WAH FACTORIAL BUILDING, 646, 648&648A CASTLE PEAK ROAD, CHEUNG SHA WAN, KOWLOON",Specified Premises,指明處所,13/09/2021
LUCKY MONEY EXCHANGE LIMITED,幸運來找換有限公司,LUCKY MONEY EXCHANGE LIMITED,幸運來找換有限公司,"SHOP 13A, G/F, PEI HO SHOPPING CENTRE, 115-117 FUK WA STREET, SHAM SHUI PO, KOWLOON",Specified Premises,指明處所,13/09/2021
LUCKY MONEY HONG KONG LIMITED,,,,"FLAT 82B, G/F, BLOCK 13, CITY GARDEN SHOPPING CENTRE, 233 ELECTRIC ROAD, NORTH POINT, HONG KONG",Specified Premises,指明處所,13/09/2021
LUCKY MONEY HONG KONG LIMITED,,LUCKY MONEY HONG KONG LIMITED,,"UNIT 39, G/F, EAST COMMERCIAL CENTRE, SOUTH HORIZONS, AP LEI CHAU, HONG KONG",Specified Premises,指明處所,13/09/2021
LUCKY MONEY HONG KONG LIMITED,,LUCKY MONEY HONG KONG LIMITED,,"SHOP 23, G/F, LAGUNA ARCADE, LAGUNA CITY, 95 CHA KWO LING ROAD, LAM TIN, KOWLOON",Specified Premises,指明處所,13/09/2021
LUCKY PESO INTERNATIONAL FINANCE (HK) LIMITED,,,,"ROOM 1035, 10/F, NAN FUNG CENTRE, 264-298 CASTLE PEAK ROAD, TSUEN WAN, NEW TERRITORIES",Specified Premises,指明處所,13/09/2021
LUCKY STAR MANAGEMENT LIMITED,褔星管理有限公司,IREMIT,,"SHOP 149, 1/F, WORLD WIDE PLAZA, 19 DES VOEUX ROAD, CENTRAL, HONG KONG",Specified Premises,指明處所,13/09/2021
LUCKY STAR MANAGEMENT LIMITED,褔星管理有限公司,IREMIT,,"SHOP 280, 2/F, LIK SANG PLAZA, 269 CASTLE PEAK ROAD, TSUEN WAN, NEW TERRITORIES",Specified Premises,指明處所,13/09/2021
LUFTHANSA AIRPLUS SERVICEKARTEN GESELLSCHAFT MIT BESCHRANKTER HAFTUNG TRADING AS AIRPLUS INTERNATIONAL,,,,"UNIT D & E, 7/F, NEICH TOWER, 128 GLOUCESTER ROAD, WAN CHAI, HONG KONG",Correspondence Address,通訊地址,13/09/2021
LUI CHI WAI TRADING AS WING LUNG REMINBI EXCHANGE CO.,呂志偉 營業名稱 永隆人民幣找換行,,,"SHOP 5A, G/F, HAND FAIR COURT, 255 CASTLE PEAK ROAD, CHEUNG SHA WAN, KOWLOON",Specified Premises,指明處所,13/09/2021
LUI HIU SHAN TRADING AS COME COME SOUTHEAST ASIAN FOOD STORES,呂曉珊 營業名稱 來來東南亞食品,,,"STALL NO M53, FORTUNE CITY ONE MARKET, CITY ONE SHATIN, SHA TIN, NEW TERRITORIES",Specified Premises,指明處所,13/09/2021
LUK YI PUI,陸怡貝 營業名稱 俊昇人民幣找換店,,,"SHOP PORTION 5, G/F, 41A & 41B FU HING STREET 15/19 SAN FAT STREET, SHEUNG SHUI, NEW TERRITORIES",Specified Premises,指明處所,13/09/2021
LULU FINANCIAL SERVICES (HONG KONG) LIMITED TRADING AS LULU MONEY,,LULU MONEY,,"ROOM 305, 3/F, HANKOW CENTRE, 5-15 HANKOW ROAD, TSIM SHA TSUI, KOWLOON",Specified Premises,指明處所,13/09/2021
LULU FINANCIAL SERVICES (HONG KONG) LIMITED TRADING AS LULU MONEY,,LULU MONEY,,"SHOP 369, 3/F, WORLDWIDE HOUSE, 19 DES VOEUX ROAD CENTRAL, CENTRAL, HONG KONG",Specified Premises,指明處所,13/09/2021
LULU FINANCIAL SERVICES (HONG KONG) LIMITED TRADING AS LULU MONEY,,LULU MONEY,,"UNIT 71-B OF THE  PODIUM, 1/F, FU FAI GARDEN, 28 ON SHING STREET, SHA TIN, NEW TERRITORIES",Specified Premises,指明處所,13/09/2021
LULU FINANCIAL SERVICES (HONG KONG) LIMITED TRADING AS LULU MONEY,,LULU MONEY,,"SHOP 230, 2/F, LIK SANG PLAZA, 269 CASTLE PEAK ROAD, TSUEN WAN, NEW TERRITORIES",Specified Premises,指明處所,13/09/2021
LULU FINANCIAL SERVICES (HONG KONG) LIMITED TRADING AS LULU MONEY,,LULU MONEY,,"UNIT 46D, PLANET SQUARE, 1-15 TAK MAN STREET, HUNG HOM, KOWLOON",Specified Premises,指明處所,13/09/2021
LUNG SING INVESTMENT INTERNATIONAL LIMITED TRADING AS YAU SING MONEY EXCHANGE COMPANY,隆盛投資國際有限公司 營業名稱 優盛找換匯款公司,YAU SING MONEY EXCHANGE COMPANY,優盛找換匯款公司,"FLAT 3, 11/F, TERN PLAZA, 5 CAMERON ROAD, TSIM SHA TSUI, KOWLOON",Specified Premises,指明處所,13/09/2021
LUNG TENG HUI LIMITED,隆騰薈有限公司 營業名稱 Q找換店,,Q找換店,"SHOP 2, B1, G/F, MAN WAH HOUSE, 135 KWONG FUK ROAD, TAI PO, NEW TERRITORIES",Specified Premises,指明處所,13/09/2021
LUO CIHUI,羅慈惠 營業名稱 順達找換行,,順達找換行,"SHOP A2A, G/F, KAM HOI BUILDING, 121-123 SHANGHAI STREET, JORDAN, KOWLOON",Specified Premises,指明處所,13/09/2021
LUO CIHUI,羅慈惠 營業名稱 順達找換行,,順達找換行,"SHOP 1, G/F, BOWRING COMMERCIAL CENTRE, 150 WOO SUNG STREET, JORDAN, KOWLOON",Specified Premises,指明處所,13/09/2021
MA TAK SHING RAYMOND TRADING AS INDO JAYA COMPANY,馬德誠,,,"FLAT 3, 1/F, JUBILEE GARDEN MARKET, 2-18 LOK KING STREET, FO TAN SHA TIN, NEW TERRITORIES",Specified Premises,指明處所,13/09/2021
MA XIUJUAN TRADING AS HONG KONG HUIKE CO.,马秀娟 營業名稱 香港滙客公司,,,"SHOP UNDER STAIRCASE, G/F, 51-53 SAN FUNG AVENUE, SHEUNG SHUI, NEW TERRITORIES",Specified Premises,指明處所,13/09/2021
